name,category,subcategory,price,unit
Femora D1 Mango Wooden Tissue Holder -Walnut : 1 Unit,Tissue Paper & Napkins,tissue,600.0,
Femora D2 Mango Wooden Tissue Holder -Walnut : 1 Unit,Tissue Paper & Napkins,tissue,600.0,
Butterfly Stainless Steel Cooker - Curve : 5.5 Litres,,,4851.0,
Butterfly Stainless Steel Cooker - Curve : 3 Litres,,,3646.0,
Pigeon Hard Anodised All-In-One Super Pressure Cooker : 3 Litres,,,3445.0,
Surya Intech Pressure Cooker Combo : 3 Units,,,1950.0,
Surya Intech Pressure Cooker Combo : 3 Litres + 2 Litres,,,1150.0,
Pigeon Favourite Aluminium Pressure Cooker (2 L+ 3 L+ 5 L) : 1 Unit,,,3195.0,
Hawkins Steel Induction Pressure Cooker - HSS3T : 3 Litres,,,3025.0,
Prestige Deluxe Alpha Svachh Stainless Steel Pressure Cooker Handi : 3 Litres,,,2830.0,
Pigeon Titanium Hard Anodized Pressure Cooker: 3 Litres,,,2195.0,
Pigeon Titanium Hard Anodized Pressure Cooker : 5 Litres,,,2995.0,
Hawkins Contura Black Hard Anodised Cooker CB30 : 3 Litres,,,2225.0,
Prestige Svachh Nakshatra+ Hard Anodised Handi Cooker : 3 Litre,,,2300.0,
Hawkins Contura Hard Anodised Pressure Cooker - CB20 : 2 Litres,,,1950.0,
Vinod 18/8 Stainless Steel Splendid Plus Pressure Cooker : 1. 5 Litres,,,2380.0,
Vinod Stainless Steel Outer Lid Pressure Cooker : 3 Litres,,,2695.0,
Bergner Pura Stainless Steel Outer Lid Pressure Cooker : 1.5 Litres,,,2489.0,
Prestige Svachh Pressure Cooker Hard Anodized : 5 Litres,,,3500.0,
Hawkins Classic Pressure Cooker - CL3T : 3 Litres,,,1575.0,
Hawkins Futura Hard Anodised Handi - AH3S : 3 Litres,,,1850.0,
Jaipan Aluminium Combo Star Plus Cooker With Common Lid (5.5 L+ 3.5 L) : 1 Unit,,,2695.0,
Hawkins Futura Hard Anodised Bowl - ACB60 : 6 Litres,,,2450.0,
Kent Multiuse Cooker (116114) - 1.2L : 800 W,,,2900.0,
Jaipan Combo Star Aluminium Cooker With Common Lid (2 L + 3 L) : 1 Unit,,,1795.0,
Pigeon Favourite Aluminium Pressure Cooker : 7.5 Litres,,,2495.0,
Hawkins Induction Pressure Cooker - IH20 : 2 Litres,,,1700.0,
Vinod Stainless Steel Outer Lid Pressure Cooker : 5 Litres,,,3520.0,
Prestige Svachh Aluminium Cooker Combo : 3 Litres + 5 Litres,,,3030.0,
Bergner Argent Elements Stainless Steel Pressure Cooker : 3.5 Litres,,,4695.0,
Prestige Deluxe Plus Hard Anodised Pressure Handi Cooker : 3 Litres,,,2880.0,
Prestige Nakshatra Svachh Hard Anodized Handi Cooker : 5 Litres,,,3150.0,
Prestige Malti Cooker (1L) - Stainless Steel - 600W : 1 Unit,,,1995.0,
Hawkins Futura Induction Pressure Cooker - IFP30 : 3 Litres,,,3900.0,
Bergner Pura Stainless Steel Outer Lid Pressure Cooker : 5 Litres,,,3799.0,
Hawkins Miss Mary Pressure Cooker - MM30 : 3 Litres,,,1250.0,
Bergner Argent Elements Stainless Steel Pressure Cooker : 1.5 Litres,,,3895.0,
Prestige Nakshatra Plus Svachh Handi (2 L) - Aluminium : 1 Unit,,,1525.0,
Prestige Nakshatra Plus Svachh Handi (5 L) - Aluminium : 1 Unit,,,2350.0,
Stainless Steel Idli Maker with Lid : 1 Unit,,,900.0,
Home Zone by Kitchen Essentials Stainless Steel Triply Cookware Set : 3 Pieces,,,4990.0,
Home Zone Triply Stainless Steel Kadai - 22 cms : 1 Unit,,,2200.0,
Pigeon Storm Non-Stick Induction Base Flat Tawa - 280 mm : 1 Unit,,,1095.0,
Home Zone Triply Stainless Steel Kadai - 24 cms : 1 Unit,,,2700.0,
Anjali Non-Stick Dosa Tawa - 270 mm : 1 Unit,,,785.0,
Prestige Omega Deluxe Granite Dosa Tawa - 280 mm : 1 Unit,,,1390.0,
Anjali Uttappa Tawa 4 Cavities : 1 Unit,,,815.0,
Veer Stainless Steel Copper Bottom Handi : 4 Piece,,,700.0,
Borosil Granito Non-Stick Induction Base Dosa Tawa - Black : 31 cm,,,1695.0,
Stainless Steel Triply Kadai With Gold PVD Coating Handle : 20 cm,,,1049.0,
Hawkins Non-Stick Dosa Tava (NDT28) - Diameter 28 cm : 1 Unit,,,1525.0,
Anjali Fiesta Stainless Steel Cookware Milk Pan With Lid : 1 Unit,,,691.0,
Bergner Non-Stick Soft Touch Handle Flat Frying Pan - 24 cm : 1 Unit,,,999.0,
Indigo Metalware Stainless Steel Coffee Warmer - 870 ml : 1 Unit,,,423.0,
Anjali Stainless Steel Allure Cookware Set : 5 Pieces,,,3150.0,
Vinod Platinum Stainless Steel Triply Kadai With Lid - 26 cm : 3.7 Litres,,,4170.0,
Bombay Kookware Non-Stick Appam With Glass Lid- Grey : 26 cm,,,985.0,
Bergner Non-Stick Soft Touch Handle Flat Tawa - 28 cm : 1 Unit,,,999.0,
Nidhi Non-Stick Cookware Set : 2 Pieces,,,565.0,
Crystal Plus Series Non-Stick Cookware Set - CNS 898 : 2 Units,,,1600.0,
Bombay Kookware Non-Stick Small Granite Grill Pan- Black : 22 cm,,,810.0,
Hawkins Futura Roti Tawa - IART26 : Diameter 26 cm,,,1210.0,
Wonderchef Duralife Die-cast Non stick Dosa Tawa - Ivory : 28 cm,,,2000.0,
Macclite Cast Ironium Induction Base Dosa Tawa - Black : 30 cm,,,1865.0,
Hawkins Futura Hard Anodised Tava - AT26 : Diameter 26 cm,,,1060.0,
Hawkins Futura Hard Anodised Tava - AT26XP : Diameter 26 cm,,,1210.0,
Hawkins Futura Hard Anodised Tava - AT26X : Diameter 26 cm,,,1210.0,
Bombay Kookware Non-Stick Dosa Tawa - Blue : 25.5 cm,,,650.0,
Beezy Stainless Steel Idly Stand 4 Plate : 1 Unit,,,410.0,
Wonderchef Royal Velvet 28 cm Dosa Tawa : 1 Unit,,,1800.0,
Bombay Kookware Smart Non-Stick Tawa - Maroon : 28 cm,,,1000.0,
Borosil Granito Non-Stick Induction Base Kadai With Lid (2.5 L) - 24 cm : 1 Unit,,,1745.0,
Hawkins NDT33 Aluminium Futura Non-Stick Dosa Tava - Black : 33 cm,,,1840.0,
Bombay Kookware Non-Stick Flat Tawa - Grey : 32 cm,,,1050.0,
Bombay Kookware Induction Non-Stick Granite Roti Tawa - Grey : 26 cm,,,990.0,
Vinod Platinum Stainless Steel Triply Kadai With Lid - 24 cm : 3.2 Litres,,,3820.0,
Bombay kookware Non-Stick Fry Pan - Blue : 20 cm,,,575.0,
Prestige Omega Omni Tawa - 275 mm : 1 Piece,,,1180.0,
Wonderchef Duralife Die-cast Non stick Dosa Tawa - Copper : 28 cm,,,2000.0,
Wonderchef Royal Velvet 24 cm Grill Pan : 1 Unit,,,2000.0,
Bergner Argent Stainless Steel Triply Saute Pan With Lid - 26 cm : 1 Unit,,,4295.0,
Bergner Tripro Triply Saucepan - Silver (16 cm) : 1 Unit,,,1999.0,
Bombay Kookware Non-stick Kadai With Glass Lid- Maroon : 24 cm,,,1150.0,
Vinod Platinum Stainless Steel Triply Kadai With Lid - 22 cm : 2. 4 Litres,,,3450.0,
Hawkins STP15 Stainless Steel 1.5 Cup Tadka Pan : 360 ml,,,500.0,360 ml
Anjali Aluminium Biryani Pot : 4.25 Litres,,,1695.0,
Bergner Argent Stainless Steel Triply Kadai With Lid : 2 Litres,,,3565.0,
Hawkins IART28 Aluminium Hard Anodised Futura Roti Tava : 28 cm,,,1390.0,
Prestige Concave Tava Omega - 280 mm : 1 Piece,,,1210.0,
Borosil Granito Non-Stick Concave Tawa - Black : 25 cm,,,1045.0,
Borosil Granito Non-Stick Induction Base Kadai With Lid (3 L) - 26 cm : 1 Unit,,,1945.0,
KYYTE Iron Sheet Metal Kadai With Stainless Steel Handle - Black : 24 cm,,,1280.0,
Kitchen Essentials Non-Stick Bottom Handi With Hammer Tone Finish : 4.25 Litres,,,1585.0,
Borosil Granito Non-Stick Induction Base Flat Tawa - Black : 28 cm,,,1345.0,
Bombay Kookware Induction NonStick FryPan With Glass Lid - Maroon : 26 cm,,,1240.0,
Wonderchef Royal Velvet 24 cm Fry Pan : 1 Unit,,,1500.0,
Hawkins IAD375S Aluminium Hard Anodised Futura Deep Fry Pan : 3.75 Litre,,,2420.0,
Hawkins ICF24G Aluminium Ceramic  Non-Stick Frying Pan : 24 cm,,,1845.0,
Borosil Granito Non-Stick Induction Base Flat Tawa - Black : 25 cm,,,1145.0,
Bergner Argent Stainless Steel Triply Fry Pan : 24 cm,,,2995.0,
Vinod Platinum Stainless Steel Triply Tope With Lid (18 cm) - 2. 5 L : 1 Unit,,,2290.0,
Real Kitchen Non Stick Cookware Set : 4 Pieces,,,1345.0,
Vinod Platinum Stainless Steel Extra Deep Tasla - 26 cm : 3.7 Litres,,,3290.0,
Bombay Kookware Induction Non-Stick Kadai - Maroon : 24 cm,,,775.0,
Vinod Platinum Stainless Steel Extra Deep Tasla - 22 cm : 2. 4 Litres,,,2590.0,
Bombay Kookware Non-Stick Kala Kruti Fry Pan & Dosa Tawa -Ivory : 2 Pieces,,,1650.0,
Borosil Granito Induction Base Non-Stick Fry Pan - Black : 26 cm,,,1395.0,
KYYTE Iron Sheet Metal Wok With Wooden Handle - Black : 24 cm,,,1280.0,
Bombay Kookware Non-Stick Mini Pan - Blue : 15 cm,,,370.0,
Prestige Omega Essentials Fry Pan - 240 mm : 1 Unit,,,1020.0,
Trupti Stainless Steel Triply Kadai : 2 Litres,,,2200.0,
Hawkins ICT26 Aluminium Ceramic Non-Stick Tava : 26 cm,,,1350.0,
Vinod Platinum Stainless Steel Triply Fry Pan : 20 cm,,,2690.0,
Bombay Kookware Non-Stick Tawa Pan - Grey : 27 cm,,,900.0,
Bombay Kookware Non-Stick Appachetty - Red : 21 cm,,,630.0,
Vinod Platinum Stainless Steel Triply Tope With Lid (16 cm) - 1. 7 L : 1 Unit,,,1780.0,
Hawkins SSH50G Stainless Steel Cook & Serve Handi : 5 Litre,,,3200.0,
Bombay Kookware Non-Stick Kadai - Blue : 20 cm,,,675.0,
Wonderchef Royal Velvet 24 cm Wok With Lid : 1 Unit,,,2000.0,
HAZEL Aluminium Handi With Lid - 1900 ml : 1 Unit,,,1199.0,
HAZEL Aluminium Handi With Lid - 1200 ml : 1 Unit,,,1049.0,
Hawkins AT28 Aluminium Hard Anodised Futura Tava : 28 cm,,,1210.0,
Bombay Kookware Non-Stick Casserole With Glass Lid- Red : 24 cm,,,1770.0,
Borosil Granito Induction Base Non-Stick Fry Pan - Black : 24 cm,,,1195.0,
Judge By TTK Prestige Non Stick Set - Black : 3 Pieces,,,1820.0,
Bombay Kookware Non-Stick Kala Kruti Fry Pan - Grey & Black : 24 cm,,,960.0,
Wonderchef Duralife Die-Cast Non-Stick Fry Pan - Copper : 24 cm,,,1950.0,
Prestige Plus Roti Tawa - Hard Anodised (22.5 cm) : 1 Unit,,,975.0,
Bergner Eternity Stainless Steel Kadai With Lid - 20 cm : 1.9 Litres,,,1990.0,
Prestige Durastone Omni Tawa - Hard Anodised (27 cm) : 1 Unit,,,1550.0,
Nidhi Ceramic Fry Pan With Glass Lid - Green (24 cm) : 1 Unit,,,940.0,
Vinod Platinum Stainless Steel Extra Deep Tasla - 24 cm : 3. 2 Litres,,,2690.0,
HAZEL Aluminium Kadhai Cookware Tasra - 500 ml : 1 Unit,,,629.0,
Hawkins ICK25G Aluminium Ceramic Non-Stick Deep Kadhai : 2.5 Litre,,,2100.0,
Vinod Platinum Stainless Steel Triply Fry Pan : 24 cm,,,3190.0,
Nidhi Hard Anodised Tawa (Black) - 27.5 cm : 1 Unit,,,775.0,
Nidhi Ceramic Kadhai With Glass Lid - Green (26 cm) : 1 Unit,,,1120.0,
Anjali Grill Tawa - 270 mm : 1 Unit,,,669.0,
Prestige Durastone Kadai - Hard Anodised (24cm) : 1 Unit,,,2150.0,
Nidhi Hard Anodised Kadhai - Black (3.5 L) : 1 Unit,,,1045.0,
HAZEL Heavy Base Thick Flat Bottom Patila - 1100 ml : 1 Unit,,,809.0,
Nidhi Sigma Non Stick Deep Kadai With Steel Lid - Grey : 1 Unit,,,750.0,
Nidhi Hard Anodised Kadhai - Black (5.5 L) : 1 Unit,,,1395.0,
Bergner Non-Stick Induction Base Earth Tawa - Black (28 cm ) : 1 Unit,,,1355.0,
The Chef Story Stainless Steel Triply Frypan (26 cm) : 1 Unit,,,3199.0,
Nidhi Hard Anodised Fry Pan (Black) - 1.5 L : 1 Unit,,,860.0,
Bergner Tri-Pro Stainless Steel Kadai With Lid - 22 cm : 1.9 Litres,,,3795.0,
HAZEL Heavy Base Thick Flat Bottom Patila - 1500 ml : 1 Unit,,,1049.0,
Prestige Durastone Fry Pan - Hard Anodised (24 cm ) : 1 Unit,,,1490.0,
Prestige Omega Deluxe Granite Fry Pan (24 cm ) - Aluminium : 1 Unit,,,1220.0,
The Chef Story Stainless Steel Triply Frypan (24 cm) : 1 Unit,,,1898.0,
Nidhi Hard Anodised Tadka Pan - Black (11 cm) : 1 Unit,,,190.0,
Anjali Non-Stick Roti Tawa - 275 mm : 1 Unit,,,785.0,
The Chef Story Everyday Non Stick Kadai with Glass Lid - 24 cm : 1 Unit,,,2112.0,
Nidhi Hard Anodised Non-Stick Smart Tawa (Black) - 31 cm : 1 Unit,,,1375.0,
Nidhi Hard Anodised Non-Stick Smart Tawa (Black) - 28.5 cm : 1 Unit,,,1225.0,
Prestige Ceraglide Frypan - Aluminium (24 cm) : 1 Unit,,,1150.0,
Prestige Ceraglide Non Stick Omni Tawa - Aluminium (25 cm) : 1 Unit,,,1050.0,
Prestige Omega Deluxe Kadai (26 cm) - Aluminium : 1 Unit,,,1910.0,
Prestige Ceraglide Deep Kadai - Aluminium (24 cm) : 1 Unit,,,1675.0,
The Chef Story Stainless Steel Triply Saucepan with Glass Lid (18 cm) - 2 L : 1 Unit,,,2139.0,
The Chef Story Everyday Non Stick Kadai with Glass Lid - 26 cm : 1 Unit,,,2390.0,
Prestige Ceraglide Frypan - Aluminium (26 cm) : 1 Unit,,,1275.0,
Prestige Ceraglide Non Stick Omni Tawa - Aluminium (28 cm) : 1 Unit,,,1250.0,
The Chef Story Everyday Non Stick Frypan - 26 cm : 1 Unit,,,1657.0,
The Chef Story Everyday Non Stick Flat Tawa - 29 cm : 1 Unit,,,1648.0,
Judge By TTK Prestige Non Stick kadai - Black : 24cm,,,890.0,
Pigeon ESS Non-Stick Gift Set - Red : 7 Pieces,,,2995.0,
Stainless Steel Modak Maker with Glass Lid : 1 Unit,,,1280.0,
Prestige Omega Cherry Non-Stick Cookware Set : 4 Pieces,,,3600.0,
Copper Base Steel Prabhu Chetty Cookware Set : 5 Pieces,,,670.0,
Nidhi Cookware Non-stick Gift Set : 3 Pieces,,,945.0,
Gokul Stainless Steel Milk Boiler - 1.5 Litres : 1 Unit,,,669.0,
Macclite Non-Stick Aluminium Pentagon Gift Set - Red : Pack of 5,,,2470.0,
Anjali Fab Non-Stick Granita Gift Set : 3 Pieces,,,2995.0,
Bergner Non-Stick Induction Base Sherry Plus Cookware Set (Red) - 6 Pieces : 1 Unit,,,5500.0,
Bergner Non-Stick Induction Base Dahlia Cookware Set (Green) - 3 Pieces : 1 Unit,,,2995.0,
Macclite Alpha Non - Stick Aluminium Gift Set - Red : Pack of 3,,,1595.0,
Greenchef Non Stick Trio Pack : 3 Pieces,,,1399.0,
Borosil Microwave Safe Designer Glass Bowl - 430 ml : 4 Pieces,,,695.0,
Bergner Stone Plus Non Stick Cookware Set : 4 Pieces,,,4195.0,
Wonderchef Milano Set - Red : 4 Pieces,,,4200.0,
Wonderchef Bellagio Ceramic Non stick Cookware Set - Electric Blue : 4 Pieces,,,6000.0,
Borosil Festive Glory Non Stick Cookware Set - Pink : 4 Pieces,,,4090.0,
Bergner Aluminium Induction Base Cookware Set - Red : 4 Units,,,4895.0,
Wonderchef Evita Non-Stick Cookware Set : 3 Pieces,,,4000.0,
Borosil Festive Glory Non Stick Cookware Set - Blue : 3 Pieces,,,2940.0,
Bergner Aluminium Induction Base Cookware Set -Purple : 4 Units,,,4895.0,
Crystal Non-Stick Cookware Set - CNS 897 : 3 Pieces,,,3000.0,
Borosil Festive Glory Non Stick Cookware Set - Pink : 3 Pieces,,,2940.0,
Borosil Festive Glory Non Stick Cookware Set - Pink : 2 Pieces,,,2340.0,
Bergner Optimum Non Stick Cookware Set : 5 Pieces,,,5495.0,
Wonderchef Royal Velvet Plus Set - Purple : 4 Pieces,,,5000.0,
Macclite Non-Stick Aluminium Gift Set Duo Pack (Black) - 2 Pieces : 1 Unit,,,1499.0,
Wonderchef Blueberry Aluminium Non-Stick Cookware Set : 4 Pieces,,,4200.0,
Nidhi Omega Non Stick Set - Golden (Set Of 4) : 1 Unit,,,1690.0,
Bergner Bellini Marble Non Stick Cookware Set : 2 Pieces,,,2995.0,
Nidhi Non-Stick Spatter Cookware Set (Green) - 3 Pieces : 1 Unit,,,1350.0,
Anjali Non-Stick Handi Gift Set : 2 Pieces,,,1995.0,
Dine smart Stylon Melamine Dinner Set :  24 Pieces,,,1699.0,
La Opala W & L English Lavender Dinner Set (English Lavender) - 18 Pieces : 1 Unit,,,1950.0,
La Opala Novo Dinner Set : 10 Pieces,,,1175.0,
La Opala W & L Blissful Green Dinner Set (Blissful Green) - 18 Pieces : 1 Unit,,,1950.0,
La Opala W & L Radiant Curve Dinner Set (Radiant Curve) - 18 Pieces : 1 Unit,,,1950.0,
Joyo Home Wave Round Dinner Set : 6 Pieces,,,591.0,
La Opala W & L Petite Roses Dinner Set : 18 Pieces,,,1950.0,
Larah By Borosil Dinner Set (Thali Set) Classic - 18 Pieces : 1 Unit,,,2195.0,
La Opala W & L Trinity Green Dinner Set (Trinity Green) - 18 Pieces : 1 Unit,,,1950.0,
Larah By Borosil Dinner Set (Thali Set) Cripper - 18 Pieces : 1 Unit,,,2195.0,
Srithai Dinner Plate P6161-11 - Queen Diamond : 6 Pieces,,,1590.0,
Larah By Borosil Dinner Set (Thali Set) Verona - 18 Pieces : 1 Unit,,,2195.0,
Srithai Dinner Plate P6161-11 - Royal Opera : 6 Pieces,,,1590.0,
Steel Eco Thali Combo Set : 3 Pieces,,,199.0,
Veer Steel Promo Thali (13 Inches) : 1 Unit,,,220.0,
ALL Time Treats Plate - Custard White Soft Mint : 6 Piece,,,275.0,
Stainless Steel Gold PVD Coating Hammered  Thali (No.7) : 1 Unit,,,399.0,
Stainless Steel Baggy Plate : 1 Unit,,,109.0,
Stainless Steel Gold PVD Coating Round Thali (No.13) : 1 Unit,,,699.0,
Wood & Kemp Melamine Green Banana Leaf Thali - 12 Inches : 1 Unit,,,95.0,
Disposable Paper Plates - 7 Inches : Pack of 50,,,75.0,
Stainless Steel Gold PVD Coating Kids Thali : 23 cm,,,299.0,
Stainless Steel Gold PVD Coating Square Halwa Thali 10x5 cm : 1 Unit,,,199.0,
Stainless Steel Gold PVD Coating Small Square Thali 18x5 cm : 1 Unit,,,499.0,
Deepvansh Stainless Steel Snack Plate - 18 cm,,,,
Yera Dotted Glass Tumbler - 215 ml : 6 Pieces,,,230.0,
Yera Glass Tumbler Assorted - 250 ml : 6 Pieces,,,240.0,
Borosil Radius Glass (295 ml) - 6 Pieces : 1 Unit,,,675.0,
Sanjeev Kapoor Florence Water Glass Set - 270 ml : 6 Pieces,,,595.0,
Ocean Glass Plaza : 6 Pieces,,,820.0,
Sanjeev Kapoor Infinity Goblet Wine Glasses - 190 ml : 2 Piece,,,595.0,
Signoraware Illusion Borosilicate Glass Set : 6 Units,,,495.0,
Soogo Aria Juice Glass (230 ml) - Set Of 6 : 1 Unit,,,645.0,
Ocean Unity Glass (255 ml) - 6 Pieces : 1 Unit,,,615.0,
Soogo Navel Juice Mug (160 ml) - Set Of 6 : 1 Unit,,,495.0,
Pasabahce Pub Pilsner Glass (320 ml) - 2 Pieces : 1 Unit,,,300.0,320 ml
Deepvansh Stainless Steel Water/Juice Glass Set : 6 Pieces,,,650.0,
Sanjeev Kapoor Paris Crystal Whiskey Glass - 330 ml : 6 Pieces,,,845.0,
Stainless Steel Damru Glass - 320 ml : 3 Pieces,,,179.0,
Soogo Aria Whiskey Glass Set - 330 ml : 6 Piece,,,845.0,
Sanjeev Kapoor Paris Crystal Juice Glass - 230 ml : 6 Pieces,,,645.0,
Soogo Vogue Shot Glass Set - 50 ml :  6 Piece,,,245.0,
Borosil Vision Large Glass - 350 ml : 6 Pieces,,,595.0,
Sanjeev Kapoor Melbourne Rock Glass Set - 350 ml : Set of 6,,,845.0,
Borosil Lemon Jug Set 1 Litre Jug & 4 Glasses : 1 Set,,,1345.0,
ALL Time Treats Glass - Custard White Soft Mint (1.5 Litre) : 6 Piece,,,185.0,
Borosil Vision Medium Glass Set - 295 ml : 6 Pieces,,,525.0,
HAZEL Stainless Steel Lassi Glass - 750 ml : 1 Unit,,,359.0,
Borosil Glance-Vision Medium Glass - 295 ml : 6 Pieces,,,645.0,
Borosil Sintra-Vision Medium Glass - 295 ml : 6 Pieces,,,645.0,
Nakshatra Stainless Steel Hammered Glass - Set of 6 Pieces : 350ml,,,320.0,350 ml
La Opala Opal Novo Pudding Set : 7 Pieces,,,540.0,
Yera Glass Polaris Pudding Set - 7 Pieces : 1 Unit,,,440.0,
Gokul Steel Single Wall Ice-Cream Bowl & Spoon (Set of 6) : 1 Unit,,,559.0,
Sanjeev kapoor Lock & Lock Glassware Round Container - 400 ml : 1 Unit,Jars & Containers,container,199.0,
Borosil Mixing Glass Bowl With White Lid : Set of 3,,,1595.0,
Gokul Stainless Steel Lotus Flower Bowls & Tray : 5 Pieces,,,529.0,
All Time Plastic Classic Mixing Bowl With Lid : 4 Pieces,,,455.0,
Signoraware Glass Mixing Bowl Borosilicate - 3 Bowls : 1 Unit,,,1099.0,
Stainless Steel Gold PVD Coating Hammered Apple Halwa Wati : 1 Unit,,,158.0,
Sanjeev Kapoor Cocoon Stackable Bowl (160 ml) - Set Of 6 : 1 Unit,,,474.0,
Sanjeev Kapoor Titan Square Glass Baking Dish - 1 Litre : 1 Unit,,,595.0,
Stainless Steel Gold PVD Coating Hammered Matka Wati : 250 ml,,,198.0,250 ml
Dinewell Melamine Chip & Dip Serving Platter - Matte Black : 1 Unit,,,110.0,
Dinewell Melamine Leaf Small Serving Platter - Matte Black : 1 Unit,,,110.0,
SignoraWare Borosilicate Bake 'N' Serve Oval Dish: 700 ml,,,289.0,700 ml
Dinewell Melamine Barbecue Serving Platter - Matte Black : 1 Unit,,,110.0,
All Time Plastic Mixing Bowl - 22cm : 2.2 Litre,,,115.0,
Borosil Deep Rectangular Glass Dish : 1.5 Litres,,,775.0,
SignoraWare Delicious Borosilicate Glass Bowl -220ml: Set of 6,,,699.0,
Femora Borosilicate Microwave Glass Mixing Bowls (3 Pieces) : 1 Unit,,,1035.0,
Lucky Glass Glasso Mixing Bowl (Container) With Lid - 405 ml (2 Pieces) : 1 Unit,Jars & Containers,container,300.0,
SignoraWare Borosilicate Bake 'N' Serve Rectangular Dish: 1 L,,,475.0,
Indigo Metalware Stainless Steel Sauce Cup - Round (6 Piece) : 1 Unit,,,210.0,
Dinewell Melamine Curve Small Serving Bowl - Matte Black : 550 ml,,,110.0,550 ml
Yamasin Fantastic Snack Dish - Green : 25 cm,,,1195.0,
Stainless Steel Gold PVD Coating Square Wati 9x9 cm: 1 Unit,,,189.0,
All Time Fast Food Tray - Grey : 1 Unit,,,320.0,
Lucky Glass Dal Bowl (LG-221) - 180 ml - 6 Pieces) : 1 Unit,,,350.0,
Dinewell Melamine Elect Serving Platter - Assorted : 1 Unit,,,110.0,
Indigo Metalware Stainless Steel French Fry's Cup : 1 Unit,,,248.0,
Stainless Steel Gold PVD Coating Kids Wati : 1 Unit,,,108.0,
All Time Plastic Classic Mixing Bowl - 14 cm : 800 ml,,,60.0,800 ml
Dinewell Melamine Slanted Large Serving Bowl - Matte Black : 650 ml,,,110.0,650 ml
Borosil Rectangular Glass Dish With Green Lid : 2.6 Litres,,,1095.0,
HAZEL Stainless Steel Serving Tray Rectangle - 29.5x19x2 cm : 1 Unit,,,669.0,
Borosil Hydra Insulated Coffeemate Mug : 300 ml,,,845.0,300 ml
Nanobot Stainless Steel AKUA Water Bottle : 715 ml,,,329.0,715 ml
Cello Sportigo Water Bottle - Assorted Colours : 1 Litre,,,193.0,
Nayasa Turtle Plastic Bottle : 1 Litre,,,119.0,
Champ Stainless Steel Fridge Bottle : 1 Litre,,,280.0,
Borosil Stainless Steel Go Sport Water Bottle - Black : 900 ml,,,1155.0,900 ml
Plastic Woben Water Bottle - Assorted : 2 Litres,,,310.0,
Nanobot Stainless Steel AKUA Water Bottle : 540 ml,,,299.0,540 ml
Sanjeev Kapoor Quadro Glassware Fridge Water Jug (1.1 L) : 1 Unit,,,345.0,
Cello Diamond Plastic Bottle : 950 ml,,,139.0,950 ml
Borosil Stainless Steel Hydra Trek Bottle - Black : 700 ml,,,1055.0,700 ml
Borosil Stainless Steel Hydra Trek Bottle - Green : 700 ml,,,1055.0,700 ml
Borosil Stainless Steel Hydra Go Sports Bottle - Black : 600 ml,,,975.0,600 ml
Signoraware Oxy Stainless Steel Water Bottle : 1 L,,,389.0,
Signoraware Aqua Stainless Steel Water Bottle : 1 L,,,379.0,
Jolly Aqua Cool Water Bottle - Assorted : 1 Litre,,,50.0,
Milton Thermosteel Duo Deluxe Bottle (Silver) - 1 L : 1 Unit,,,1450.0,
Signoraware Aqua Star Borosilicate Glass Bottle - Multicolour : 750 ml,,,395.0,750 ml
Nouvetta Stainless Steel Bingo Double Wall Bottle  (Rose Gold) - 750 ml : 1 Unit,,,1395.0,
Jolly Enrich Plastic Water Bottle (Assorted) - 780 ml : 1 Unit,,,25.0,780 ml
Pinnacle Wave Hydration Bottle - Green : 1 Litre,,,640.0,
Plastic Tall Yao Water Bottle : 1 Litres,,,222.0,
Pinnacle Quench Hydration Bottle - Green : 700 ml,,,480.0,700 ml
Aura Water Bottle - Blue : 1 Litre,,,60.0,
Jolly Stay Cool Plastic Water Bottle (Assorted) - 500 ml : 1 Unit,,,25.0,500 ml
Nouvetta Stainless Steel Stella Double Wall Water Bottle : 750 ml,,,1295.0,750 ml
Borosil Roma Glass Bottle Wide Mouth Silver Lid : 1 Litre,,,595.0,
Aura Water Bottle - Grey : 1 Litre,,,60.0,
Signoraware Fliptop Aqua Water Bottle - Green (1 L) : 1 Unit,,,150.0,
Pinnacle Quench Hydration Bottle - Peach : 700 ml,,,480.0,700 ml
Pinnacle Wave Hydration Bottle - Black : 1 Litre,,,640.0,
Belocopia Hiero Flip Plastic 2 Colour Water Bottle (1L) Pink-Blue-Yellow CWB0011 - Set Of 3 : 1 Unit,,,499.0,
Stainless Steel Alexa Gold PVD Coating Water Bottle : 1 Litres,,,499.0,
Borosil Sintra Glass Bottle Wide Mouth Silver Lid : 1 Litre,,,595.0,
Pinnacle Quench Hydration Bottle - Blue : 700 ml,,,480.0,700 ml
Signoraware Stainless Steel Shaker - Black : 650 ml,,,475.0,650 ml
White Gold Glass Bottle (WG-11162) - 1000 ml : 1 Unit,,,300.0,
All Time Plastic Freeze Bottle : 1 Litre,,,135.0,
Nouvetta Stainless Steel Stella Double Wall Water Bottle : 350 ml,,,1045.0,350 ml
Aura Water Bottle - Green : 1 Litre,,,60.0,
Nouvetta Stainless Steel Luft Double Wall Bottle ( Pink Metallic)- 500 ml: 1 Unit,,,1695.0,
Belocopia Hiero Flip Plastic 2 Colour Water Bottle (1L) Multi Colour (NYB) CWB0012 - Set Of 3 : 1 Unit,,,349.0,
Joyo Transparent Fridge Jug - 1.25 ml : 1 Unit,,,494.0,25 ml
SignoraWare Borosilicate Glass Water Bottle : 750 ml,,,409.0,750 ml
SignoraWare Borosilicate Glass Oil Dispenser: 1000 ml,,,580.0,1000 ml
Borosil Sintra Glass Bottle Wide Mouth Silver Lid : 550 ml,,,425.0,550 ml
Trupti Stainless Steel Medium Mug : 1 Unit,,,89.0,
Flair Solitaire Gift Set of Insulated Stainless Steel Bottle & Ball Pen : 1 Unit,,,999.0,
Cello Stainless Steel Swift Bottle - Silver : 500 ml,,,769.0,500 ml
Borosil Roma Glass Bottle Wide Mouth Silver Lid : 550 ml,,,425.0,550 ml
Belocopia Hiero Plastic Waterbottle (1L) Pink-Blue-Yellow CWB0010 - Set of 3 : 1 Unit,,,479.0,
SignoraWare Stainless Steel Kids Insulated Bottle - Red : 350 ml,,,1249.0,350 ml
Nouvetta Apricot Borosilicate Printed Glass Bottle : 1 Litre,,,1595.0,
Milton Thermosteel Flask : 1 Litre,,,1205.0,
Milton Thermosteel Flask : 500 ml,,,810.0,500 ml
Borosil Thermo Stainless Steel Flask - Black : 500 ml,,,805.0,500 ml
Femora Galaxy World Thermosteel Double Wall Kids Water Bottle With Bag Pink : 550 ml,,,880.0,550 ml
Femora You Are Unique Thermosteel Double Wall Kids Water Bottle With Bag Pink : 550 ml,,,880.0,550 ml
D Homes Stainless Steel Vaccume Flask : 1000ml,,,590.0,1000 ml
D Homes Steel Vaccum Flask : 500 ml,,,390.0,500 ml
Pinnacle Prudence Ice Box - Cool Blue : 11 Litres,,,1650.0,
D Homes Stainless Steel Vacuum Cola Flask : 750 ml,,,540.0,750 ml
Pinnacle Platino Cooler Jug - Cool Blue : 4 Litres,,,720.0,
Pinnacle Prudence Ice Box - Cool Blue : 4.5 Litres,,,990.0,
Pinnacle Platino Cooler Jug - Sea Green : 4 Litres,,,720.0,
Pinnacle Prudence Ice Box - Sea Green : 11 Litres,,,1650.0,
Pinnacle Prudence Ice Box - Sea Green : 4.5 Litres,,,990.0,
Paras Stainless Steel Flexi 2 Layer Lunch Box (Assorted) : 1 Unit,,,399.0,
Treo Milton Glass Round Tiffin - Set of 3 : 1 Unit,,,1360.0,
Aqua Export Stainless Steel Microsafe Dabbi - Red : 400 ml,,,149.0,400 ml
Magnus Olive 3 Prime Stainless Steel Lunch Box - Green : 3 Container,Jars & Containers,container,849.0,
Kitchen Essentials Stainless Steel Clip Tiffin Box : Set of 3 Container,Jars & Containers,container,410.0,
Joyo MaxSafe Stainless Steel Square Food Container : 400 ml,Jars & Containers,container,759.0,400 ml
Joyo Plastic 4 Side Lock 2051 Lunch Box - 800 ml : 2 Units,,,200.0,
Plastic Metka Lunch Box (Assorted) : 1 Unit,,,270.0,
Magnus Olive 2 Stainless Steel Lunch Box - Green : 2 Container,Jars & Containers,container,545.0,
Magnus Microwave Neo 5 Inner Steel (4 Lunch Boxes + 1 Bottle) - Blue : 5 Unit,,,1599.0,
Borosil Stainless Steel Hot-N-Fresh Lunch Box (Set Of 3) : 1 Unit,,,3190.0,
Joyo MaxSafe Stainless Steel round Food Container : 360 ml,Jars & Containers,container,649.0,360 ml
All Time Plastic Salad Lunch Box With Dip Container : 1 Unit,Jars & Containers,container,270.0,
Signoraware Stainless Steel Best Lunch Box - Blue : 4 Containers,Jars & Containers,container,969.0,
SignoraWare Slim Glass Jumbo Lunch Box: 1.4 L,,,1025.0,
Magnus Fancy 3 Prime Stainless Steel Lunch Box - Red : 3 Container,Jars & Containers,container,549.0,
Asian Fun Meal Super Insulated Lunch Box - Red: 350 ml,,,309.0,350 ml
Signoraware Executive Borosilicate Glass 3 Lunch Box With Bag - Set Of 3 : 1 Unit,,,1099.0,
