name,category,subcategory,price,unit
Asian Fun Meal Super Insulated Lunch Box - Green: 350 ml,,,309.0,350 ml
Signoraware Compact Lunch Box - Blue : 3 Containers,Jars & Containers,container,250.0,
Asian Fun Meal Super Insulated Lunch Box - Orange: 350 ml,,,309.0,350 ml
SignoraWare Stainless Steel Midday Maxx Lunch Box - Blue : 2 Containers,Jars & Containers,container,525.0,
SignoraWare Feast Oval Steel Lunch box - Blue: 2 Containers,Jars & Containers,container,399.0,
SignoraWare Feast Oval Steel Lunch box - Green: 2 Containers,Jars & Containers,container,399.0,
SignoraWare Double Decker Special Steel Lunch Box-Blue: 3 Containers,Jars & Containers,container,849.0,
Varmora Stainless Steel Mini Xclusive Lunch Box - Blue : 4 Container,Jars & Containers,container,1059.0,
Varmora Stainless Steel Mini Xclusive Lunch Box - Raspberry Pink : 4 Container,Jars & Containers,container,1059.0,
Signoraware Executive Small Lunch Box With Bag (Assorted) : 1 Unit,,,395.0,
All Time Plastic Food Gear 9302 Lunch Box : 3 Pieces,,,755.0,
Varmora Fresh Bite Lunch Box - Pista Green : 2 Container,Jars & Containers,container,219.0,
Varmora Stainless Steel Classic Lunch Box - Cyan Blue : 4 Container,Jars & Containers,container,1439.0,
SignoraWare Plastic Slim Compartment Lunch Box - Purple: 610 ml,,,175.0,610 ml
Asian Little Champions Set Lunch Box & Bottle - Yellow & Blue: Set of 3,,,623.0,
SignoraWare Easy Plastic Lunch Box (850 ml + 150 ml) - Purple: 1 Unit,,,230.0,
Asian Little Champions Set Lunch Box & Bottle - Green & Violet: Set of 3,,,623.0,
Asian Little Champions Set Lunch Box & Bottle - Green & Blue: Set of 3,,,623.0,
Signoraware Best Lunch Box With Bag (Assorted) : 1 Unit,,,590.0,
Asian Little Champions Set Lunch Box & Bottle - Saffron Red & Blue: Set of 3,,,623.0,
Plastic Lunch Box (8520) : Assorted - 1 Unit,,,220.0,
Signoraware Compact Lunch Box with Bag - Assorted,,,425.0,
Yera X Series Glass Jar With Lid - 320 ml : 2 Pieces,Jars & Containers,jar,190.0,320 ml
Yera Lucia Jar Glass Jars - 245 ml : 4 Pieces,Jars & Containers,jar,150.0,245 ml
La Opala Coffee Cup Set (Assorted) - 6 Pieces : 1 Unit,,,395.0,
La Opala Sovrana Cup & Saucer Set : 6 Pieces,,,795.0,
D Homes Glass Jar with Lid - 150 ml : 4 Pieces,Jars & Containers,jar,110.0,
La Opala Cup & Saucer Set - Assorted : 6 Pieces,,,600.0,
Veer Steel Combo Set : 6 Pieces,,,420.0,
La Opala Jamaica Coffee Cup Set - 6 Pieces : 1 Unit,,,395.0,
La Opala Coffee Mug Set (Assorted) - 6 Pieces : 1 Unit,,,430.0,
Femora Gold Series Ceramic Coffee Mug (Peach) - 320 ml : 2 Piece,,,480.0,
Femora Gold Series Ceramic Coffee Mug (Black) - 320 ml : 2 Piece,,,480.0,
Femora Gold Series Ceramic Coffee Mug (Blue) - 320 ml : 2 Piece,,,480.0,
La Opala Jamaican Cup & Saucer Set - 6 Pieces : 1 Unit,,,550.0,
Femora Gold Series Ceramic Coffee Mug (Green) - 320 ml : 2 Piece,,,480.0,
La Opala Sovrana Coffee Mug Set : 6 Pieces,,,540.0,
Femora Ceramic Coffee Mug (Green) - 360 ml : 2 Piece,,,430.0,
Steel Chakali Sancha : 1 Unit,,,449.0,
Femora Ceramic Coffee Mug (Brown) - 360 ml : 2 Piece,,,430.0,
Femora Ceramic Coffee Mug (Black) - 360 ml : 2 Piece,,,430.0,
Femora Ceramic Coffee Mug (Blue) - 360 ml : 2 Piece,,,430.0,
Femora Ceramic Gold Line Tea Cups (Blue) - 180 ml : 6 Piece,,,640.0,
Signoraware Airtight Round Borosilicate Glass Jar : 1.3 L,Jars & Containers,jar,460.0,
Magnus Klip Lock Stainless Steel Tumbler Glass Matte - Green : 350 ml,,,255.0,350 ml
Femora Ceramic Gold Line Tea Cups (Black) - 180 ml : 6 Piece,,,640.0,
SignoraWare Lock N Store Borosilicate Glass Container : 320 ml,Jars & Containers,container,269.0,320 ml
Ocean Plaza Water Glass Set : 6 Pieces,,,820.0,
Ocean Charisma Whisky Glass Set : 6 Pieces,,,850.0,
Ocean Ivory Water Glass Set : 6 Pieces,,,820.0,
Ocean Sweet Bell Water Glass Set : 6 Pieces,,,760.0,
Ocean San Marino Whisky Glass Set : 6 Pieces,,,735.0,
Soogo Gloria Cup & Saucer (150 ml) - Set Of 6 : 1 Unit,,,895.0,
Borosil Klip N Store Square Glass Container - Set of 2 : 1 Unit,Jars & Containers,container,875.0,
Ocean Unity Water Glass Set : 6 Pieces,,,675.0,
SignoraWare Lock N Store Borosilicate Glass Container: 800 ml,Jars & Containers,container,439.0,800 ml
Ocean Tango Whisky Glass Set : 6 Pieces,,,850.0,
Borosil Glass Snack Set : 3 Piece,,,545.0,
White Gold Mason Glass Jar with Lid (WG 8064) - 450 ml (Assorted) - 2 Pieces : 1 Unit,Jars & Containers,jar,250.0,
Ocean Tango Juice Glass Set : 6 Pieces,,,760.0,
Yamasin Bonechina Wonder Gold Rim Mug - Mint - 180 ml : 6 Pieces,,,2495.0,
Srithai Coffee Mug C6157-3.5 - Diana : 1 Unit,,,240.0,
Anjali Baby Spoon - 6 Pieces : 1 Unit,,,225.0,
Stainless Steel Spoon - 20 Pieces : 1 Unit,,,419.0,
Gokul Stainless Steel Cutlery Holder No.4 : 1 Piece,,,169.0,
Anjali Baby Fruit Fork - 6 Pieces : 1 Unit,,,190.0,
Anjali Stainless Steel Curio Cutlery Set With Baby Spoon : 24 Pieces,,,1325.0,
Wooden Spatula : 3 Pieces,,,80.0,
Anjali Stainless Steel Aspire Cutlery Set With Baby Spoon : 24 Pieces,,,1325.0,
Stainless Steel Gold Finish Dessert Spoon : 6 Pieces,,,399.0,
Bergner Master Pro Stainless Steel Spoon With Black Handle : 1 Unit,,,595.0,
Stainless Steel Casserole (Serving Pot) : 2 Litres,,,837.0,
Paras Hot Meal Casserole - 2.4 Litres : 1 Casserole,,,697.0,
Stainless Steel Triply Casserole With Gold PVD Handle : 18 cm,,,1149.0,
Princeware Solar Casserole with Inner Stainless Steel (Blue) : 1290 ml,,,415.0,1290 ml
Princeware Solar Casserole with Inner Stainless Steel (Pink) : 1290 ml,,,415.0,1290 ml
Wonderhcef Granite Die-Cast Caserole Set : 3 Pieces,,,7500.0,
Pinnacle Omega Plastic Inner Steel Insulated Casserole - 1000 ml : 1 Unit,,,1690.0,
Pinnacle Palazio Casserole + Carafe Gift Set of 3 : 1 Unit,,,2300.0,
Pinnacle Parisa Casserole + Carafe Gift Set of 3 : 1 Unit,,,1900.0,
Paras Hot Meal Magnus Casserole- Red : 3 Pieces,,,2175.0,
Pinnacle Pace Plastic Inner Steel Insulated Casserole (1 L) : 1 Unit,,,530.0,
Femora Borosilicate Microwave Glass Casserole With Lid -700 ml : 1 Unit,,,605.0,
Kitch'N'Stuff Ceramic Casserole With Lid : 5 Litres,,,1995.0,
Gokul Stainless Steel Single Wall Fame Tea Cup : 6 Pieces,,,399.0,
Gokul Stainless Steel Double Wall Tea Cup : 6 Pieces,,,715.0,
Soogo Plaza Mug Set (190 ml) - Set Of 6 : 1 Unit,,,495.0,
Soogo Scarlet Printed Glass Mug (290 ml) - Set Of 6 : 1 Unit,,,695.0,
Borosil Vision Classic Mug Set - 190 ml : 6 Pieces,,,595.0,
Soogo Primrose Printed Glass Mug (290 ml) - Set Of 6 : 1 Unit,,,695.0,
HAZEL Stainless Steel Multipurpose Mug - 900 ml : 1 Unit,,,919.0,
SignoraWare Insulated Stainless Steel Coffee Mug - Black : 350 ml,,,779.0,350 ml
Soogo Snowflake Printed Glass Mug (290 ml) - Set Of 6 : 1 Unit,,,695.0,
Lucky Glass Beer Mug (LG-115) - 400 ml (2 Pieces) : 1 Unit,,,200.0,
Lucky Glass Tea/Coffee Mugs (LG-312007) - 200 ml (6 Pieces) : 1 Unit,,,450.0,
Gokul Stainless Steel Mug - Medium : 100 ml,,,89.0,100 ml
Femora Ceramic Vinyl Tea Cup Set - 160 ml (4 Pieces) : 1 Unit,,,1050.0,
Brodees TriColour Printed Ceramic Mugs : 325 ml,,,249.0,325 ml
Femora Ceramic Sage Tea Cup Set - 160 ml (4 Pieces) : 1 Unit,,,1050.0,
Femora Ceramic Gold Line Cup & Saucer Set (200 ml) - Set of 2 : 1 Unit,,,700.0,
Femora Ceramic Safron Mandana Bandanwar Tea Cup Set - 160 ml (4 Pieces) : 1 Unit,,,1050.0,
Stainless Steel Gold PVD Coating Kids Tumbler : 1 Unit,,,119.0,
Femora Double Wall Glass Coffee Mug - 320 ml : 1 Unit,,,575.0,
Femora Ceramic 2 Mug + 4 Tea Cup - Black (6 Pieces) : 1 Unit,,,1270.0,
D Homes Square Glass Mug - 230 ml : 1 Unit,,,88.0,
Femora Ceramic Double Gold Line Cup & Saucer (200 ml) - Set of 2 : 1 Unit,,,700.0,
Femora Double Wall Glass Coffee Mug - 280 ml : 1 Unit,,,480.0,
Femora Ceramic 2 Mug + 4 Tea Cup - Royal Blue (6 Pieces) : 1 Unit,,,1270.0,
Femora Double Wall Glass Coffee Mug - 235 ml : 1 Unit,,,465.0,
Joyo Plastic Storage Container (Moovers Box) : 60 Litres,Jars & Containers,container,1600.0,
Venus Storage Container - 90 Litres : 1 Unit,Jars & Containers,container,3216.0,
Venus Storage Container - 32 Litres : 1 Unit,Jars & Containers,container,1269.0,
Venus Storage Container - 16 Litres : 1 Unit,Jars & Containers,container,812.0,
Joyo Plastic Storage Container (Moovers Box) : 45 Litres,Jars & Containers,container,1350.0,
Venus Storage Container 333 - 54 Litres : 1 Unit,Jars & Containers,container,1829.0,
Venus Storage Container - 67 Litres : 1 Unit,Jars & Containers,container,2299.0,
Joyo Plastic Storage Container (Moovers Box) : 30 Litres,Jars & Containers,container,1050.0,
Joyo Plastic Kitchen King Storage Container - Grey (20.5 L) : 1 Unit,Jars & Containers,container,693.0,
Joyo Plastic Kitchen King Storage Container - Grey (16.5 L) : 1 Unit,Jars & Containers,container,567.0,
Joyo Plastic Kitchen King Storage Container - Brown (20.5 L) : 1 Unit,Jars & Containers,container,693.0,
Joyo Plastic Fresherware Square Container : 6 Litres,Jars & Containers,container,504.0,
Joyo Plastic Kitchen King Storage Container - Brown (16.5 L) : 1 Unit,Jars & Containers,container,567.0,
Plastic Transparent Storage Box - 5.5 Litres : 1 Unit,,,225.0,
Joyo Plastic Fresherware Round Container : 5 Litres,Jars & Containers,container,267.0,
Joyo Plastic Fresherware Rectangle Container : 16 Litres,Jars & Containers,container,760.0,
Joyo Plastic Fresherware Round Container : 15 Litres,Jars & Containers,container,645.0,
Joyo Plastic Fresherware Round Container : 10 Litres,Jars & Containers,container,500.0,
Joyo Plastic Fresherware Square Container : 3000 ML,Jars & Containers,container,336.0,3000 ml
Signoraware Plastic Modular Storage (Container) : 24 Litres,Jars & Containers,container,1299.0,
Joyo Plastic Fresherware Round Container : 7 Litres,Jars & Containers,container,378.0,
Joyo Plastic Fresherware Rectangle Container : 10.5 Litres,Jars & Containers,container,571.0,
Joyo Plastic Fresherware Square Container : 4500 ML,Jars & Containers,container,435.0,4500 ml
Signoraware Plastic Modular Storage (Container) : 16 Litres,Jars & Containers,container,1070.0,
Joyo Plastic Fresherware Rectangle Container : 22 Litres,Jars & Containers,container,977.0,
Joyo Plastic Fresherware Round Container : 4 Litres,Jars & Containers,container,229.0,
SignoraWare Modular Steel Container (Deluxe) Window Round: 1250 ml,Jars & Containers,container,619.0,1250 ml
Signoraware Plastic Rice Dispenser (Container) : 10 Litres,Jars & Containers,container,2030.0,
Lock & Lock Classics Cereal Dispenser Container - HPL951 : 3.9 Litres,Jars & Containers,container,900.0,
Plastic Kitchen Flone Storage Container - 1260 ml : 1 Unit,Jars & Containers,container,155.0,1260 ml
Joyo Plastic Fresherware Round Container : 2 Litres,Jars & Containers,container,166.0,
Signoraware Steel Mixing Bowl - Blue : 1 Litre,,,310.0,
Deepvansh Stainless Steel Tea & Sugar Storage Jar (Canisters) : 2 Pieces,Jars & Containers,jar,389.0,
Joyo Plastic Fresherware Container - German lavender : 2500 ML,Jars & Containers,container,221.0,2500 ml
All Time Lock & Safe Container - Natural (1.3 Litres) : 1 Unit,Jars & Containers,container,245.0,
Princeware Click N Seal Square Plastic Container : 4.1 L,Jars & Containers,container,575.0,
HAZEL Stainless Steel Oil And Ghee Air Tight Container : 1 Unit,Jars & Containers,container,999.0,
Varmora Magnum Square Container Set - Blue : 4 Container,Jars & Containers,container,1249.0,
Signoraware Jumbo Easy Flow Container - Assorted : 1.1 Litre,Jars & Containers,container,325.0,
All Time Krisper Container - Natural (2.1 Litre) : 1 Unit,Jars & Containers,container,410.0,
All Time Krisper Container - Natural (1 Litre) : 1 Unit,Jars & Containers,container,285.0,
HAZEL Stainless Steel Container - 1000 ml : 1 Unit,Jars & Containers,container,759.0,
Lock & Lock Rectangular Food Container - HPL812H : 1.5 Litres,Jars & Containers,container,445.0,
Sanjeev kapoor Parka Borosilicate Round Container : 500 ml,Jars & Containers,container,335.0,500 ml
Sanjeev Kapoor Parka Borosilicate Square Container : 480 ml,Jars & Containers,container,335.0,480 ml
Sanjeev kapoor Lock & Lock Glassware Square Container - 520 ml : 1 Unit,Jars & Containers,container,299.0,
Joyo MaxSafe Rectangle Stainless Steel Container (2503) Silver - 800 ml : 1 Unit,Jars & Containers,container,1149.0,
Plastic Kitchen Flone Storage Container - 630 ml : 1 Unit,Jars & Containers,container,100.0,
HAZEL Stainless Steel Butter Container With Lid : 1 Unit,Jars & Containers,container,779.0,
Joyo Plastic Fresherware Square Container : 1500 ML,Jars & Containers,container,246.0,1500 ml
Joyo Plastic Fresherware Container - German lavender : 750 ML,Jars & Containers,container,113.0,750 ml
Plastic Square Felli Flip-Tite Storage Container : 500 ml,Jars & Containers,container,222.0,500 ml
Sanjeev kapoor Lock & Lock Glassware Round Container - 580 ml : 1 Unit,Jars & Containers,container,299.0,
Joyo MaxSafe Square Stainless Steel Container (3503) Silver - 600 ml : 1 Unit,Jars & Containers,container,1049.0,
Signoraware Executive Steel Medium Blue Container : 350 ml,Jars & Containers,container,175.0,350 ml
Sanjeev kapoor Lock & Lock Glassware Square Container - 760 ml : 1 Unit,Jars & Containers,container,399.0,
Joyo Plastic Fresherware Container - German lavender : 1600 ML,Jars & Containers,container,162.0,1600 ml
Borosil Klip-N-Store Square Glass Container : 320 ml,Jars & Containers,container,375.0,320 ml
Plastic Round Felli Flip-Tite Storage Container : 750 ml,Jars & Containers,container,333.0,750 ml
Borosil Klip-N-Store Square Glass Container : 520 ml,Jars & Containers,container,475.0,520 ml
Plastic Flone Kitchen Container - 900 ml : 1 Unit,Jars & Containers,container,110.0,900 ml
HAZEL Stainless Steel Oil Ghee Container With Spoon : 350 ml,Jars & Containers,container,909.0,350 ml
Joyo Plastic Fresherware Round Container : 150 ml,Jars & Containers,container,149.0,150 ml
Borosil Klip-N-Store Round Glass Container : 400 ml,Jars & Containers,container,395.0,400 ml
Joyo MaxSafe Round Stainless Steel Container (1503) Silver - 700 ml : 1 Unit,Jars & Containers,container,1149.0,
Femora Stainless Steel Airtight Lid Kitchen Storage Container - Silver : 1Unit,Jars & Containers,container,300.0,
All Time Krisper Container - Natural (450 ml) : 1 Unit,Jars & Containers,container,200.0,
Princeware Easy Pour Round Plastic Container (Violet) : 880 ml,Jars & Containers,container,170.0,880 ml
All Time Krisper Container - Natural (950 ml) : 1 Unit,Jars & Containers,container,260.0,
Femora Stainless Steel Airtight Lid Kitchen Storage Container - Grey : 1Unit,Jars & Containers,container,300.0,
Gokul Stainless Steel Ghee Pot Mercury Pot & Spoon: 350 ML,,,225.0,350 ml
Gokul Stainless Steel Tea Time Canister : 2 Pieces,,,450.0,
Joyo Spacio Container - 1.5 Litres (German Lavender) : 3 Units,Jars & Containers,container,160.0,
Stainless Steel Tea Time Canister: 2 Pieces,,,535.0,
Signoraware Modular Oval No.3 Container - Blue : 3 Containers,Jars & Containers,container,720.0,
Dynamic Container Set (Assorted) - 4 Pieces : 1 Unit,Jars & Containers,container,172.0,
Joyo Storewell Round Container - Pink : 4 Containers,Jars & Containers,container,550.0,
Ratan Plastic Ezee Lock Container Set - Beige (Set of 6) : 1 Unit,Jars & Containers,container,150.0,
Joyo Alfa Container Set (German Blue) - Set of 6 : 1 Unit,Jars & Containers,container,290.0,
Joyo Kitchen Classic Square Container - Pink : 3 Containers,Jars & Containers,container,1256.0,
Joyo 4 Side Lock Plastic Square Containers : Set of 4,Jars & Containers,container,369.0,
Joyo Spacio Container - 1.5 Litres (German Blue) : 3 Units,Jars & Containers,container,160.0,
Signoraware Steel Tiny Wonder Container - Blue : 2 Containers,Jars & Containers,container,280.0,
Joyo Storewell Round Container - Blue : 4 Containers,Jars & Containers,container,550.0,
Signoraware Glass Container Borosilicate (Transparent) - 3 Containers : 1 Unit,Jars & Containers,container,1159.0,
Steelo Solitaire Plastic Container - 4x 600 ml : 1 Unit,Jars & Containers,container,346.0,
Joyo 4 Side Lock Plastic Round Containers : Set of 4,Jars & Containers,container,479.0,
Steelo Solitaire Plastic Container - 6x200 ml : 1 Unit,Jars & Containers,container,296.0,
Joyo 4 Side Lock Plastic Rectangle Containers : Set of 4,Jars & Containers,container,399.0,
Joyo Kitchen Classic Square Container - Blue : 3 Containers,Jars & Containers,container,1256.0,
Signoraware Stainless Steel Tumbler - Blue : 2 Pieces,,,358.0,
Asian Stylo Pack Round Containers - Brown : 3 Container,Jars & Containers,container,230.0,
Joyo 4 Side Lock Plastic Rectangle Container : 4.6 Litre,Jars & Containers,container,305.0,
Princeware Classic Plastic Storage Container (Pink) - Set of 3 : 1 Unit,Jars & Containers,container,868.0,
Joyo Fresherware Container With Box (Blue) - Set of 6 : 1 Unit,Jars & Containers,container,410.0,
Princeware Twister Plastic Storage Container (Blue) - Set of 3 : 1 Unit,Jars & Containers,container,820.0,
Steelo Solitaire Plastic Container - 2x1.2 Litres :1 Unit,Jars & Containers,container,223.0,
All Time Plastic Frostee Container - 2.85 Litres : 3 Pieces,Jars & Containers,container,265.0,
All Time Bestow Box Container - Blush (560 ml) : 2 Pieces,Jars & Containers,container,150.0,
Asian Stylo Pack Round Containers - Blue : 3 Container,Jars & Containers,container,230.0,
Steelo Solitaire Plastic Container - 2x2 Litres : 1 Unit,Jars & Containers,container,336.0,
Asian Super Seal Plus Container Set : 5 Units,Jars & Containers,container,340.0,
All Time Bestow Box Container - Blush (200 ml) : 3 Pieces,Jars & Containers,container,130.0,
Varmora Fresh Container (Yellow / Blue / Green / Raspberry Pink) : 4 x 650 ml,Jars & Containers,container,215.0,650 ml
Princeware Twister Plastic Package Container Set (Blue) : 20 Pcs,Jars & Containers,container,1358.0,
Varmora Fresh Container (Yellow / Blue / Green / Raspberry Pink) : 4 x 400 ml,Jars & Containers,container,185.0,400 ml
SignoraWare Elegant Steel Containers (Assorted) - Set of 3 : 1 Unit,Jars & Containers,container,929.0,
All Time Plastic Polka Container (411X2) 1 Litre : 2 Pieces,Jars & Containers,container,115.0,
Princeware Classic Plastic Storage Container (Blue) - Set of 3 : 1 Unit,Jars & Containers,container,868.0,
SignoraWare Elegant Steel Round Containers (1000 ml+625 ml) - Set Of 2 : 1 Unit,Jars & Containers,container,435.0,
Joyo 4 Side Lock Plastic Round Containers : Set of 3,Jars & Containers,container,399.0,
Joyo 4 Side Lock Plastic Rectangle Containers : Set of 3,Jars & Containers,container,339.0,
Asian Aroma Plastic Spice Box (Masala Dabba) - Blue : 1 Unit,,,301.0,
Asian Super Stylo Pack Round Containers - Blue : 3 Container,Jars & Containers,container,508.0,
Asian Lock & Pack Containers (350 ml) - Assorted : Set Of 3,Jars & Containers,container,246.0,
Princeware Twister Plastic Storage Container (Pink) - Set of 3 : 1 Unit,Jars & Containers,container,820.0,
Princeware Classic Plastic Storage Container (Pink) - Set of 5 : 1 Unit,Jars & Containers,container,783.0,
Asian Aroma Plastic Spice Box (Masala Dabba) - Pink : 1 Unit,,,301.0,
Steelo SOfresh Square Plastic Container (600 ml) - Set Of 2 : 1 Unit,Jars & Containers,container,398.0,
Varmora Fresh Container (Yellow / Blue / Green / Raspberry Pink) : 4 x 250 ml,Jars & Containers,container,139.0,250 ml
Princeware Twister Plastic Package Container Set (Pink) : 20 Pcs,Jars & Containers,container,1358.0,
Princeware Easy Store Oval Plastic Container (Green) - Set of 3 : 1 Unit,Jars & Containers,container,653.0,
Steelo Sofresh Soclick Plastic Container - 2x800 ml : 1 Unit,Jars & Containers,container,498.0,
Asian Flora Container Set - Assorted : 4 Pieces,Jars & Containers,container,187.0,
Princeware Classic Plastic Storage Container (Blue) - Set of 5 : 1 Unit,Jars & Containers,container,783.0,
Belocopia Round Plastic Containers Aqua (Green) CFSC0045 - Set of 3 : 1 Unit,Jars & Containers,container,499.0,
Belocopia Plastic Containers Aqua (Green) CFS0014 - Set of 8 : 1 Unit,Jars & Containers,container,942.0,
All Time Plastic Polka Container (24X2) 1 Litre : 2 Pieces,Jars & Containers,container,170.0,
Princeware Click N Seal Plastic Container - Set of 4 : 1 Unit,Jars & Containers,container,299.0,
Varmora Magnum Round Container Set - Blue : 6 Container,Jars & Containers,container,1099.0,
Flair Storewell Square Plastic Container - Blue : Set of 3,Jars & Containers,container,675.0,
Steelo Sofresh Soclick Plastic Container - 2x500 ml : 1 Unit,Jars & Containers,container,358.0,
Varmora Fresh Container (Yellow / Blue / Raspberry Pink) : 3 x 1 Litre,Jars & Containers,container,239.0,
Belocopia Round Plastic Containers (Blue) CFS0020 - Set of 4 : 1 Unit,Jars & Containers,container,376.0,
Flair Storewell Square Plastic Container - Maroon : Set of 3,Jars & Containers,container,675.0,
Asian Super Stylo Pack Round Containers - Pink : 3 Container,Jars & Containers,container,508.0,
Steelo Sofresh Square Plastic Container - 2x400 ml : 1 Unit,Jars & Containers,container,318.0,
Belocopia Square & Rectangle Plastic Containers Aqua (Green) CFS0017 - Set of 4 : 1 Unit,Jars & Containers,container,696.0,
Belocopia Store & Pour Container & Bottle Combo (Pink) CFSC0047 - Set of 5 : 1 Unit,Jars & Containers,container,299.0,
All Time Plastic Lock & Safe Storage Container - 450 ml,Jars & Containers,container,,
Joyo Alfa Container Set (German Lavender) - Set of 6 : 1 Unit,Jars & Containers,container,290.0,
Belocopia Square & Rectangle Plastic Containers Aqua (Green) CFS0015 - Set of 6 : 1 Unit,Jars & Containers,container,954.0,
Joyo Knit Vintage Tray & Two Containers (Golden) : 1 Unit,Jars & Containers,container,756.0,
SKI Plastic Diamond Dry Fruit Tray Set : 2 Pieces,,,599.0,
SKI Plastic Diamond Dry Fruit Tray Set : 4 Pieces,,,999.0,
All Time Plastic Lock & Safe Storage Container - 450 ml,Jars & Containers,container,,
Steelo Varg Plastic Kitchen Jar Container 6x250 ml : 1 Unit,Jars & Containers,jar,294.0,
Steelo Varg Plastic Kitchen Jar Container 4x500 ml : 1 Unit,Jars & Containers,jar,288.0,
All Time Crystal Jar - Natural (460 ml) : 3 Pieces,Jars & Containers,jar,265.0,
Shubhkart Darshana Camphor Puja Oil : 900 ml,,,220.0,900 ml
Mangalmai Puja Lamp and Diya Oil : 900 ml,,,225.0,900 ml
Anurag Deeparadhana Pooja Oil : 900 ml,Pooja Needs,pooja,210.0,900 ml
Om Shanthi Chandanam Pure Puja Oil : 1 Litre,,,230.0,
Om Shanthi Saadana Pure Puja Oil : 1 Litre,,,230.0,
Mangalam Pure Camphor : 100 gms,,,195.0,100 g
Kaveri Premium Camphor : 250 g,,,450.0,250 g
Mangalam Pure Bhimseni Camphor : 50 gms,,,150.0,50 g
Kaveri Bhimseni Camphor : 100 gms,,,270.0,100 g
Ambica Shakti Camphor : 100 gms,,,180.0,100 g
Ambica Shakti Pure Camphor Loose : 50 gms,,,90.0,50 g
Kaveri Premium Camphor Pouch : 50 gms,,,95.0,50 g
Cycle All In 1 Pure Agarbathi : 191 Units,,,150.0,
Mangaldeep Sandalwood Pooja Agarbatti : 125 gm,Pooja Needs,pooja,76.0,125 g
Shubhkart Sambrani Cups : 12 Units,,,80.0,
Mangaldeep Mogra Puja Agarbattis : 125 g,,,76.0,125 g
Cycle Navin Pure Sambrani : 10 Units,,,72.0,
Mangaldeep 4 in 1 Puja Agarbattis : 125 g,,,76.0,125 g
Cycle Durgeshwari Sambrani Dhoop : 24 Units,,,24.0,
Cycle Woods Agarbathi : 32 Units,,,125.0,
Mysore Sandal Dhoop : 20 Units,,,30.0,
Mangaldeep French Lavender Premium Agarbattis : 125 g,,,76.0,125 g
Mangaldeep Sambrani Sticks : 15 Units,,,15.0,
Ambica Darbar Bathi Herbal Agarbathi : 220 gms,,,135.0,220 g
Mangaldeep Chandan 3 In 1 Agarbatti : 226 g,,,125.0,226 g
Mangaldeep Sandal Agarbattis : 72 Units,,,65.0,
Ambica Harini Dhoop Sticks : 60 Units,,,100.0,
Mangaldeep Treya 3 In 1 Sambrani Cup : 9 Units,,,75.0,
Heritage Chandanam Prayer Sticks : 206 gms,,,120.0,206 g
Ambica Durbar Agarbathi : 100 gms,,,75.0,100 g
Mangaldeep 3In1 Agarbatti : 213 gms,,,125.0,213 g
Moksh Swarna Champa Agarbatti : 81 gms,,,75.0,81 g
Ambica Panchagavya Agarbathi : 70 gms,,,58.0,70 g
Ambica Athisaya Dhoop: 1 U,,,90.0,
Moksh Rose Premium Incense Sticks : 30 gms,,,125.0,30 g
Ambica Dhoop Stick : 40 g,,,19.0,40 g
Moksh Swarna Chandan Agarbatti : 63 gms,,,75.0,63 g
Ambica Nitya Pooja Agarbatti : 114 gms,Pooja Needs,pooja,75.0,114 g
Ambica Baba Harathi : 100 gms,,,70.0,100 g
Cycle Baratanatyam Agarbathi : 160 gm,,,80.0,160 g
Moksh Swarna Lavand Agarbatthi : 81 gms,,,75.0,81 g
Mangaldeep Treya 3 In 1 Sambrani Stick : 42 Units,,,60.0,
Moksh Swarna Mallika Agarbatthi : 81 gms,,,75.0,81 g
Mangaldeep Camphor Patchouli Agarbatti : 120 g,,,76.0,120 g
Mangaldeep Muskmelon Agarbatti : 120 g,,,76.0,120 g
Lotus Urli : 1 Unit,,,1100.0,
Crystal Peacock Urli : 1 Unit,,,1100.0,
Red Mosaic Glass Tea light Votive Candle Holder : 1 unit,,,150.0,
Peacock Diya T-Light Holder : 1 Unit,,,700.0,
Metal Cutwork Lotus Candle Holder : 1 Unit,,,180.0,
Lotus Waterfall Urli : 1 Unit,,,1500.0,
Metal Urli Bowl : 1 Unit,,,425.0,
Diya Lotus Votive Candle Holder : Set of 2,,,600.0,
Marigold Plastic Flower Door Hanging Toran : 1 Unit,,,65.0,
Peacock Waterfall Urli : 1 Unit,,,1800.0,
Glass Laxmi Flicker Votive Candle Holder - Red : 1 Unit,,,349.0,
Diya Ganesha Lantern Candle Holder : Set of 2,,,900.0,
Glass Ganesh Flicker Votive Candle Holder - Red : 1 Unit,,,349.0,
Brass Borosil Akhand Diya Medium: 1 Unit,,,775.0,
Brass Borosil Akhand Diya Large : 1 Unit,,,1195.0,
Shubhkart Nitya Udipi Diya - 143 gms : 1 Unit,,,399.0,
Brass Borosil Akhand Diya Small : 1 Unit,,,575.0,
Shubhkart Nitya Crystal Deep Medium : 1 Unit,,,449.0,
Shubhkart Nitya Kuber Goblet Size 3 : 105 gms,,,225.0,105 g
Brass Borosil Mangal Diya Medium : 1 Unit,,,895.0,
Brass Borosil Mangal Diya Small : 1 Unit,,,545.0,
Shubhakrt Nitya Brass Kerla Samai (Size 1) : 108 Gms,,,299.0,108 g
Shubhkart Nitya Brass Prasadam Nakshi Plate (Size 1) - 219 gms : 1 Unit,,,399.0,
Shubhakrt Nitya Brass Akhand Narayan Diya : 110 Gms,,,210.0,110 g
Shubhkart Nitya Brass Kuber Deep - 52 gms : 1 Unit,,,149.0,
Shubhkart Nitya Devdas Deep Size 4 : 90 gms,,,199.0,90 g
Shubhkart Nitya Brass Paan Diya With Stand - 80 gms : 1 Unit,,,249.0,
Shubhkart Nitya Brass Diya With Borosilicate Glass - 251 gms : 1 Unit,,,499.0,
Shubhkart Nitya Pyali Size 4 -74 gms : 1 Unit,,,170.0,
Shubhkart Nitya Pyali Size 0 - 31 gms : 1 Unit,,,120.0,
Shubhkart Nitya Brass Omkareshwar Akhand Deep : 110 Gms,,,315.0,110 g
