name,category,subcategory,price,unit
Star Light Fabric Whitener : 500 ml,,,65.0,500 ml
Godrej Genteel Matic Liquid Detergent Top Load Pouch : 2 kg,Detergent & Fabric Care,detergent,290.0,
Star Bright Matic Liquid Detergent Top Load : 2 L,Detergent & Fabric Care,detergent,330.0,
BECO Natural Laundry Liquid - Front Load : 2 Litre,,,450.0,
Star Bright Matic Liquid Detergent Front Load : 2 L,Detergent & Fabric Care,detergent,370.0,
More Light Extra Power Liquid Detergent : 5 L,Detergent & Fabric Care,detergent,525.0,
Godrej Fab Liquid Detergent Pouch : 2 L,Detergent & Fabric Care,detergent,225.0,
Tide Matic Front Load Liquid Detergent : 3.2 L,Detergent & Fabric Care,detergent,505.0,
Tide Matic Liquid Front Load : 2 Litres,,,430.0,
Revive Liquid Stiffener : 400 gms,,,155.0,400 g
Ujala Supreme Fabric Whitener : 250 ml,,,80.0,250 ml
Henko Matic Lintelligent Front Load Liquid Detergent Pouch : 2 Litres,Detergent & Fabric Care,detergent,490.0,
Henko Matic Lintelligent Top Load Liquid Detergent Pouch : 2 Litres,Detergent & Fabric Care,detergent,430.0,
Pril Lime Dishwash Liquid : 225 ml,,,55.0,225 ml
Rin Advanced Detergent Powder : 7 kgs,Detergent & Fabric Care,detergent,740.0,
Star Bright Detergent Powder : 5 kgs,Detergent & Fabric Care,detergent,500.0,5 kg
Surf Excel Matic Front Load Detergent Powder : 6 kgs,Detergent & Fabric Care,detergent,1475.0,6 kg
Ariel Complete Detergent Powder : 2 kgs,Detergent & Fabric Care,detergent,800.0,2 kg
Surf Excel Matic Top Load Detergent Powder : 6 kgs,Detergent & Fabric Care,detergent,1375.0,6 kg
Tide Naturals Detergent Powder Lemon & Chandan : 800 gms,Detergent & Fabric Care,detergent,85.0,800 g
Vanish Oxi Action Stain Remover : 400 gms,,,240.0,400 g
Mr. White Detergent Powder : 5 kgs,Detergent & Fabric Care,detergent,620.0,5 kg
Wipro Safewash Front Load Liquid Detergent Pouch : 2 Litres,Detergent & Fabric Care,detergent,490.0,
Tide Matic Top Load Liquid Detergent : 3.2 L,Detergent & Fabric Care,detergent,449.0,
Henko Matic Lintelligent Top Load Detergent Powder : 2 kgs,Detergent & Fabric Care,detergent,540.0,2 kg
Patanjali Neem & Rose Detergent Powder : 1 kg,Detergent & Fabric Care,detergent,70.0,1 kg
Ariel Colour Detergent Powder : 1 kg,Detergent & Fabric Care,detergent,342.0,1 kg
Rin Antibac Detergent Powder : 1 kg,Detergent & Fabric Care,detergent,126.0,1 kg
Tide Detergent Bar : 4x200 g,Detergent & Fabric Care,detergent,115.0,200 g
Ghadi Detergent Cake : 5x250 gms,Detergent & Fabric Care,detergent,92.0,250 g
Tide Blue Detergent Bar : 80 gms,Detergent & Fabric Care,detergent,10.0,80 g
Jaldi Detergent Soap : 150 gms,Detergent & Fabric Care,detergent,18.0,150 g
Sof n Fluffy Fabric Conditioner Refill Pack : 2 Litres,,,450.0,
Sof N Fluffy Fabric Conditioner : 800 ml,,,200.0,800 ml
Wipro Softouch 2x French Perfume Fabric Conditioner : 200 ml,,,58.0,200 ml
Wipro Softouch Fabric Conditioner Garden Bouquet : 860 ml,,,235.0,860 ml
Wipro Softouch French Perfume Fabric Conditioner : 800 ml,,,235.0,800 ml
Comfort Royale Fabric Conditioner : 210 ml,,,65.0,210 ml
Wipro Safewash Liquid Detergent : 1 kg,Detergent & Fabric Care,detergent,300.0,1 kg
Ujala Crisp & Shine After Wash Fabric Enhancer - Floral : 200 gms,,,70.0,200 g
Ujala Supreme Fabric Whitener : 75 ml,,,35.0,75 ml
Phenox Concentrated Floor Cleaner : 1 Litre,Cleaners,cleaner,150.0,
Lizol Disinfectant Surface Cleaner - Citrus : 1 Litre,Cleaners,cleaner,246.0,
Sparkle Disinfectant Floor Cleaner - Citrus : 2 Litres,Cleaners,cleaner,250.0,
BECO Natural Floor Cleaner : 1 Litre,Cleaners,cleaner,205.0,
Sparkle Disinfectant Floor Cleaner - Lavender : 1 Litre,Cleaners,cleaner,130.0,
Domex Disinfectant Floor Cleaner : 1 Litre,Cleaners,cleaner,260.0,
Nimyle Lemongrass Anti-Bacterial Floor Cleaner : 975 ml,Cleaners,cleaner,205.0,975 ml
Germinil Jasmine Perfumed Floor Cleaner : 5 Litres,Cleaners,cleaner,355.0,
Germisol Perfumed Herbal Magic Phenyle : 1 Litre,,,99.0,
Mr Muscle Floral Floor Cleaner : 1 Litre,Cleaners,cleaner,232.0,
Germisol Perfumed Herbal Green Phenyle : 1 Litre,,,99.0,
Beco Natural Floor Cleaner Liquid : 2 L,Cleaners,cleaner,375.0,
Vim Ultrapro Floor Cleaner French Lavender - 1 L : 1 Unit,Cleaners,cleaner,240.0,
Germisol Perfumed Herbal Sensitive Phenyle : 1 Litre,,,99.0,
Vim Ultrapro Floor Cleaner Refreshing Lemongrass - 1 L : 1 Unit,Cleaners,cleaner,240.0,
Mr Muscle Citrus Floor Cleaner : 1 Litre,Cleaners,cleaner,232.0,
Germinil Rose Floor Cleaner & Deodorant : 1 Litre,Cleaners,cleaner,89.0,
Vim Ultrapro Floor Cleaner Sparkling Lemon - 1 L : 1 Unit,Cleaners,cleaner,240.0,
Lizol Disinfectant Surface Cleaner - Pine : 500 ml,Cleaners,cleaner,116.0,500 ml
Germinil Herbal Perfumed Floor Cleaner : 1 Litre,Cleaners,cleaner,89.0,
Germinil Sandal Perfumed Floor Cleaner : 1 Litre,Cleaners,cleaner,89.0,
Force 10 Bathroom Cleaner Floral : 1 Litre,Cleaners,cleaner,155.0,
Harpic Disinfectant Toilet Cleaner - Sparkling Lemon : 500 ml,Cleaners,cleaner,110.0,500 ml
Domex Disinfectant Toilet Cleaner - Ocean Fresh Guard  : 1 Litre,Cleaners,cleaner,235.0,
Sani Fresh Toilet Cleaner : 1 Litre,Cleaners,cleaner,225.0,
Harpic Disinfectant Toilet Cleaner - Joyful Jasmine : 1 Litre,Cleaners,cleaner,230.0,
Harpic Disinfectant Toilet Cleaner - Sparkling Lemon : 1 Litre,Cleaners,cleaner,245.0,
Domex Disinfectant Expert Toilet Cleaner : 1 Litre,Cleaners,cleaner,235.0,
Harpic Hygienic Toilet Citrus Rim Block : 26 gms,,,91.0,26 g
Harpic Flushmatic In-Cistern Toilet Cleaner Lavender : 150 gms,Cleaners,cleaner,248.0,150 g
Pitambari Shining Powder : 200 g,,,60.0,200 g
Mr Muscle Kitchen Cleaner : 450 ml,Cleaners,cleaner,175.0,450 ml
Harpic Drain Xpert Powder : 50 gms,,,30.0,50 g
Sparkle Disinfectant Glass Cleaner Refill : 1 Litre,Cleaners,cleaner,140.0,
Scale Out Washing Machine Cleaner Powder : 100 gms,Cleaners,cleaner,80.0,100 g
Pidilite WD-40 Multiple Maintenance Spray : 170 gms,,,260.0,170 g
Sabena Scouring Powder: 450 gms,,,15.0,450 g
Pidilite WD-40 Multiple Maintenance Spray: 63.8 gms,,,135.0,8 g
Jaldi Shines Copper & Brass Shining Powder : 200 gms,,,60.0,200 g
Jaldi Cleaning Powder : 900 gms,,,30.0,900 g
Sparkle Disinfectant Glass Cleaner : 500 ml,Cleaners,cleaner,90.0,500 ml
Pril Lime Dishwash Liquid : 2 Litres,,,475.0,
BECO Natural Dishwash Liquid : 750 ml,,,199.0,750 ml
Pril Perfect Tamarind Dishwash Liquid : 750 ml,,,209.0,750 ml
Vim Cooling Freshnes Mint Liquid Dishwash : 2 L,,,480.0,
Exo Ant Bacterial Round Dish Wash Bar : 2x700 gms,,,172.0,700 g
Vim Anti Bacteria Dishwash Bar Multipack - 4x190 g : 1 Unit,,,130.0,190 g
Patanjali Super Dishwash Bar : 145 gms,,,10.0,145 g
Pril Dishwash Bar : 3x360 gms,,,132.0,360 g
Pril Lime + Vinegar Dis Bar : 3x200 gms,,,69.0,200 g
Scotch Brite Scrub Sponge Large : 3 Units,,,105.0,
Scotch Brite Scrub Pad : 5 Units,,,75.0,
Reflect Scrub Pads - 7.5x10 cm : 5 Units,,,70.0,
Scotch Brite Sponge Wipe : 3 Units,,,230.0,
Reflect Sponge Wipes - 20 x 17.5 cm : 3 Units,,,149.0,
Reflect Sponge Wipe - 20x17.5 cm : 5 Units,,,220.0,
Gala Swash Stain Steel Scourer : 1 Unit,,,40.0,
Reflect Stainless Steel Scrub : 1 Unit,,,20.0,
Reflect Stainless Steel + Scrub Pad : 1 Unit,,,30.0,
Scotch-Brite Scrub Pad 9.5x14 cm : 3 Units,,,95.0,
Gala Scrub Pad : 5 Units,,,85.0,
Gala Super Scrub : 2 Units,,,85.0,
Scotch Brite Steel Scrubber : 3 Units,,,150.0,
Scotch-Brite Jet Scrubber : 1 Unit,,,160.0,
Force 10 Handle Scrubber : 1 Unit,,,135.0,
Gala Super Scrub : 1 Unit,,,45.0,
Scotch-Brite Scrub Sponge 9.5x6 cm : 2 Unit,,,40.0,
Reflect Sponge Scrub - 10 x 7 cm : 2 Units,,,50.0,
Scotch-Brite Super Strong Scrub Pad - 7x10 cm : 1 Unit,,,40.0,
Reflect Kitchen Sponge Scrubber - Set of 2 : 1 Unit,,,40.0,
Scotch Brite Kitchen Sink Brush : 1 Unit,,,160.0,
Scotch-Brite Scrub Sponge 6x9.5 cm : 1 Unit,,,20.0,
Gala Scrub Sponge Utensil Cleaner : 1 Unit,Cleaners,cleaner,35.0,
Scotch Brite Steel Scrub : 1 Unit,,,50.0,
Scotch-Brite Scrub Net Sponge : 2 Units,,,90.0,
Gala Iron Bull Scrub Pad : 1 Unit,,,155.0,
Scotch Brite Antibacterial Scrub Pad : 3 Units,,,55.0,
Scotch-Brite Non-Scratch Scrub Sponge : 1 Unit,,,50.0,
Gala Nonstik Care Scrub Sponge : 1 Unit,,,49.0,
Scotch-Brite Super Strong Scrub Pad : 2 Units,,,95.0,
Sabena Scouring Powder : 900 gms,,,30.0,900 g
Odonil Air Freshener Multi Piece Pack : 4x72 gms,Freshener & Repellents,freshener,310.0,72 g
Odonil 3 Powerful Fragrances Zipper : 3X10 gms,,,175.0,30 g
Godrej Aer Matic Automatic Air Freshener - Violet Valley Bloom : 1 Unit,Freshener & Repellents,freshener,625.0,
Mangalam Campure Camphor Cone - Original : 60 gms,,,199.0,60 g
Mangalam Campure Camphor Cone - Sandalwood : 60 gms,,,199.0,60 g
Mangalam Campure Camphor Cone - Lavender : 60 gms,,,199.0,60 g
Everfresh Round Sanicubes Air Freshener : 200 gms,Freshener & Repellents,freshener,109.0,200 g
Godrej Aer Matic Automatic Air Freshener Kit - Cool Surf Blue : 1 Unit,Freshener & Repellents,freshener,625.0,
Odonil Spray On Lavender Breeze : 220 ml,,,169.0,220 ml
Meadows Air Freshener Lavender Blossom : 240 ml,Freshener & Repellents,freshener,155.0,240 ml
Odonil Nature Rose Garden Room Freshener Spray : 220 ml,Freshener & Repellents,freshener,169.0,220 ml
Meadows Rose Wonder Air Freshener : 240 ml,Freshener & Repellents,freshener,155.0,240 ml
Godrej Aer Morning Spray : 220 ml,,,99.0,220 ml
Odonil Joyful Lavender Air Freshener Zipper : 10 gms,Freshener & Repellents,freshener,60.0,10 g
Godrej Aer O Car Fragrance - Cool Aqua : 7.5 gm,,,99.0,5 g
Godrej Aer Bathroom Fragrance Sea Breeze Pocket : 10 gms,,,65.0,10 g
Meadows Air Freshener Jasmine Glow : 240 ml,Freshener & Repellents,freshener,155.0,240 ml
Godrej Aer Bathroom Fragrance Berry Rush Pocket : 10 gms,,,65.0,10 g
Godrej Aer Bathroom Fragrance Lavender Bloom Pocket : 10 gms,,,65.0,10 g
Meadows Air Freshener Lavender Blossom : 10 gms,Freshener & Repellents,freshener,52.0,10 g
Odonil Soulful Jasmine Air Freshener : 10 gms,Freshener & Repellents,freshener,60.0,10 g
Ambi Pur Lavender Bouquet Air Freshener Spray: 275 ml,Freshener & Repellents,freshener,299.0,275 ml
Godrej Aer Bathroom Fragrance Fresh Blossom Pocket : 10 gms,,,65.0,10 g
Meadows Air Freshener Citrus Fresh : 240 ml,Freshener & Repellents,freshener,155.0,240 ml
Godrej Aer O Car Fragrance - Rose Blossom : 7.5 gm,,,99.0,5 g
Odonil Nature Sandal Bouquet Spray : 220 ml,,,169.0,220 ml
Absorbia Moisture Absorber Classic : 300 gms,,,189.0,300 g
Godrej Aer Power Pocket Floral Delight : 10 gms,,,60.0,10 g
Godrej Aer Twist Cool Car Fragrance : 45 gms,,,425.0,45 g
Odonil Lavender Meadows Air Freshener Block : 48 gms,Freshener & Repellents,freshener,58.0,48 g
Glade Touch & Fresh Lavender Room Freshener Refill : 12 ml,Freshener & Repellents,freshener,109.0,12 ml
Absorbia Moisture Absorber Closet Pouch : 400 gms,,,219.0,400 g
Absorbia Moisture Absorber Charcoal : 300 gms,,,199.0,300 g
Absorbia Moisture Absorber Sachet : 100 gms,,,110.0,100 g
Odonil Air Freshener Jasmine Mist : 48 gms,Freshener & Repellents,freshener,58.0,48 g
Ambi Pur Room Fresh Gel - Relax & Unwind : 180 gms,,,299.0,180 g
Iris Reed Diffuser - Lemon Grass : 1 Unit,,,600.0,
Iris Reed Diffuser - Lavender : 1 Unit,,,600.0,
Odonil Lavender Mist Room Freshener : 314 gms,Freshener & Repellents,freshener,500.0,314 g
Pan Aromas Car Scent Reed Diffuser - Fresh Berries : 8 ml,,,150.0,
Ambi Pur Car Fresh Gel Romantic Rose : 75 gms,,,349.0,75 g
Lia Citric Tango Air Freshener Car Gel : 45 gms,Freshener & Repellents,freshener,399.0,45 g
Lia Aqua Dream Serene Air Freshener Car Gel : 45 gms,Freshener & Repellents,freshener,399.0,45 g
Glade Touch & Fresh Lemon Air Freshener Refill : 12 ml,Freshener & Repellents,freshener,109.0,12 ml
Lia Seashore Harmony Air Freshener Car Gel : 45 gms,Freshener & Repellents,freshener,399.0,45 g
Lia Alpine Valley Air Freshener Car Gel : 45 gms,Freshener & Repellents,freshener,399.0,45 g
Glade Wild Lavender Air Freshener : 300 ml,Freshener & Repellents,freshener,169.0,300 ml
Hit Spray Mosquitoes and Flies : 625 ml,,,325.0,625 ml
Hit Anti-Roach Gel : 20 gms,,,199.0,20 g
Good Knight Gold Flash (1 Machine + 2 Refills x 45 ml) : 1 Unit,,,175.0,
All Out Ultra Day & Night Protection - Refill : 2x45 ml,,,155.0,45 ml
Good Knight Gold Flash Liquid Vapouriser Lavender : 2x45 ml,,,155.0,45 ml
D Homes Rechargeable Mosquito Racket With Torch : 1 Unit,,,370.0,
All Out 1 Machine + 2 Refills : 45 ml,,,180.0,45 ml
Godrej HIT Anti Mosquito Racquet : 1 Unit,,,600.0,
All Out Ultra Power + Refill : 4x45 ml,,,310.0,45 ml
Good Knight Gold Flash : 45 ml,,,80.0,45 ml
All Out Floral Fragrance Power Refill : 2x45 ml,,,155.0,45 ml
Odomos Naturals Non-Sticky Mosquito Repellent Cream : 100 gms,Freshener & Repellents,repellent,120.0,100 g
Maxo Genius Calming Aroma : 2x45 ml,,,125.0,45 ml
Baygon Cockroach Killer Spray : 625 ml,,,340.0,625 ml
All Out Ultra Machine + Refill : 45 ml,,,105.0,45 ml
Baygon Mosquito & Fly Killer  Spray : 625 ml,,,340.0,625 ml
All Out Anti Dengue Coil : 10 Pieces,,,40.0,
Baygon Max Mosquito & Fly Killer : 400 ml,,,225.0,400 ml
Rechargeable Mosquito Racket : 1 Unit,,,310.0,
Nippo Rechargeable Mosquito Bat : 1 Unit,,,699.0,
Nippo Guard Rechargeable Mosquito Swatter Bat - Blue : 1 Unit,,,599.0,
Foldable Mosquito Net : Double Bed : 1 Unit,,,810.0,
Elegant Weavers Loops Mat (Blue) - 38x58 cm : 1 Unit,,,250.0,
Elegant Weavers Primier Rug Doormat (Brown & Beige) - 40x60 cm : 1 Unit,,,245.0,
Elegant Weavers Loops Mat (Brown) - 38x58 cm : 1 Unit,,,250.0,
Elegant Weavers Heavy Doormat (Green) - 35x60 cm : 1 Unit,,,180.0,
Elegant Weavers Rangoli Round Mat - Multi Colour : 60x60 cm,,,699.0,
Elegant Weavers Eden Oval Mat - 33x53 cm (Assorted) Pack of 3 : 1 Unit,,,210.0,
Elegant Weavers Innova Rug Doormat (Black & Red) - 40x60 cm : 1 Unit,,,245.0,
Elegant Weavers Innova Rug Doormat (Brown & Beige) - 40x60 cm : 1 Unit,,,245.0,
Elegant Weavers Fort Door Mat - Grey : 38x58 cm,,,179.0,
Athom Living Contemporary Door Mat (01) - 37 X 57cm : Blue,,,599.0,
Elegant Weavers Fort Door Mat - Brown : 38x58 cm,,,179.0,
Elegant Weavers Peru Door Mat - Blue : 40x60 cm,,,439.0,
Elegant Weavers Oak Oval Door Mat Brown - 40x60 cm,,,189.0,
Elegant Weavers Preu Door Mat - Brown : 40x60 cm,,,439.0,
Elegant Weavers Sturdy Doormat (Assorted) - 36x58 cm : 1 Unit,,,150.0,
Elegant Weavers Oak Oval Door Mat Grey - 40x60 cm,,,189.0,
Elegant Weavers Panama Door Mat - Brown : 38x58 cm,,,169.0,
Elegant Weavers Welcome Door Mat Brown 40X60 cm : 1 Unit,,,299.0,
Elegant Weavers Newton Door Mat - Blue : 40x60 cm,,,439.0,
Elegant Weavers Salina Door Mat (Assorted) 38x58 cm - Set Of 3 : 1 Unit,,,289.0,
Elegant Weavers Dixon Door Mat - Blue : 38x58 cm,,,169.0,
Elegant Weavers Ocala Round Bath Door (Red & Brown) 40x40 cm - Set Of 2 : 1 Unit,,,169.0,
Elegant Weavers Dixon Door Mat - Brown : 38x58 cm,,,169.0,
Elegant Weavers Panama Door Mat - Red : 38x58 cm,,,169.0,
Elegant Weavers Croche Mat (Pink) - 40x60 cm : 1 Unit,,,150.0,
Elegant Weavers Newton Brown Mat - Brown : 40x60 cm,,,439.0,
Elegant Weavers Welcome Door Mat Blue 40X60 cm : 1 Unit,,,299.0,
Welcome Doormat PVC (Assorted) - 38x58 cm : 1 Unit,,,135.0,
Elegant Weavers Dixon Door Mat - Grey : 38x58 cm,,,169.0,
Elegant Weavers Grass Door Mat 38X58 cm : 1 Unit,,,179.0,
Allure Rubber 3D Print Doormat (5) - Assorted  : 40 X 60 cm,,,222.0,
Allure Jinhia Doormat (9206) - Assorted : 40 X 60 cm,,,222.0,
Allure Skya Doormat (4060) - Assorted : 40 X 60 cm,,,222.0,
Welspun Solid Door Mat (4060) Brown - 40 x 60 cm : 1 Unit,,,235.0,
Welspun Solid Door Mat (4060) Linen - 40 x 60 cm : 1 Unit,,,235.0,
Welspun Solid Door Mat (4060) Grey - 40 x 60 cm : 1 Unit,,,235.0,
Welspun Solid Door Mat (4060) Teal Rain - 40 x 60 cm : 1 Unit,,,235.0,
Welspun Solid Door Mat (4060) Claret - 40 x 60 cm : 1 Unit,,,235.0,
Welspun Solid Door Mat (4060) Teal - 40 x 60 cm : 1 Unit,,,235.0,
Welspun Solid Door Mat (4060) Navy Blue - 40 x 60 cm : 1 Unit,,,235.0,
Welspun Solid Door Mat (4060) Dark Purple - 40 x 60 cm : 1 Unit,,,235.0,
Joyo Cane Round Stool - Pleasant Blue : 1 Unit,,,693.0,
Joyo Cane Round Stool - Ice Cabbage : 1 Unit,,,693.0,
Happy Family Bubble Stool Big - Brown : 1 Unit,,,399.0,
Happy Family Bubble Stool Small - Sea Green : 1 Unit,,,339.0,
Cortina 3 Seater Geometric Sofa Cover (110-220 cm) - Dark Grey : 1 Unit,,,2999.0,
MHF Sofa Slip Cover Florida - Grey : 6 Units,,,1400.0,
Cortina 3 Seater Jacquard Sofa Cover (185-230 cm) : Brown,,,1699.0,
Cortina 3 Seater Jacquard Sofa Cover (185-230 cm) : Navy Blue,,,1699.0,
MHF Sofa Slip Cover Cloud Aqua - Aqua : 6 Units,,,1349.0,
MHF Sofa Slip Cover Paradise - Brown : 6 Units,,,1500.0,
MHF Sofa Slip Cover Florida - Mustard : 6 Units,,,1350.0,
Cortina 3 Seater Abstract Sofa Cover (185-230 cm) - Multicolour : 1 Unit,,,2999.0,
MHF Sofa Slip Cover Tohfa - Grey : 6 Units,,,1450.0,
MHF Sofa Slip Cover Denver 02 - Silver : 6 units,,,700.0,
MHF Sofa Slip Cover Cloud Coffee - Coffee : 6 Units,,,1349.0,
Cortina 1 Seater Jacquard Sofa Cover (90-145 cm) : Brown,,,1299.0,
MHF Grace Velvet Diwan Cover Set - Maroon : 6 Units,,,950.0,
MHF Sofa Slip Cover Ciaz - Wine : 6 Units,,,1350.0,
MHF Sofa Slip Cover Cloud Navy Blue - Navy Blue : 6 Units,,,1349.0,
Cortina 3 Seater Jacquard Sofa Cover (185-230 cm) : Beige,,,1299.0,
MHF Sofa Slip Cover Desire 02 - Camel : 6 units,,,825.0,
MHF Sofa Slip Cover Cotton Embose 14 - Coffee : 6 units,,,825.0,
Cortina 3 Seater Striped Sofa Cover (185-230 cm) - Grey : 1 Unit,,,2999.0,
Cortina 1 Seater Geometric Sofa Cover (90-145 cm) - Dark Grey : 1 Unit,,,1999.0,
MHF Sofa Slip Cover Sunshine 02 - Multicolor : 6 Units,,,625.0,
Cortina 2 Seater Abstract Sofa Cover (145-185 cm) - Multicolour : 1 Unit,,,2499.0,
MHF Sofa Slip Cover Galaxy 02 - White : 6 units,,,625.0,
Cortina 2 Seater Jacquard Sofa Cover (145-185 cm) : Brown,,,1499.0,
MHF Sofa Slip Cover Galaxy 05 - White : 6 units,,,625.0,
MHF Sofa Slip Cover Venus - Wine : 6 Units,,,1400.0,
MHF Sofa Slip Cover Cotton Embose 11 - Beige : 6 units,,,825.0,
Cortina 1 Seater Jacquard Sofa Cover (90-145 cm) : Navy Blue,,,1299.0,
MHF Sofa Slip Cover Pile Border 01 - Multicolor : 6 units,,,700.0,
Cortina 1 Seater Abstract Sofa Cover (90-145 cm) - Multicolour : 1 Unit,,,1999.0,
Cortina 2 Seater Striped Sofa Cover (145-185 cm) - Grey : 1 Unit,,,2499.0,
Cortina 2 Seater Jacquard Sofa Cover (145-185 cm) : Navy Blue,,,1499.0,
Cortina 2 Seater Jacquard Sofa Cover (145-185 cm) : Beige,,,1499.0,
Cortina 1 Seater Striped Sofa Cover (90-145 cm) - Grey : 1 Unit,,,1999.0,
Cortina 1 Seater Jacquard Sofa Cover (90-145 cm) : Beige,,,1299.0,
Cortina Polyester Dining Chair Cover Abstract - Orange & Black : 1 Unit,,,399.0,
Cortina Dining Chair Cover Jacquard - Coffee : 1 Unit,,,399.0,
Happy Family Kiddy Cushioned Baby Chair (Pink) : 1 Unit,,,649.0,
Happy Family Hello Folding Chair (Pink) : 1 Unit,,,999.0,
EVA Table Runner (45 x 150 cm) : 1 Unit,,,145.0,
VAA Vinyl Blossom Dining Table Cover 6 Seater (1.32x2.02 metres) - Gold : 1 Unit,,,800.0,
VAA Dining Table Cover With White Lace - 4 Seater (40x60 Inches) Transparent : 1 Unit,,,450.0,
VAA PVC Checks Dining Table Mat (Gold) - Set of 6 : 1 Unit,,,850.0,
VAA Vinyl Blossom Dining Table Cover 6 Seater (1.32x2.02 metres) - Brown : 1 Unit,,,800.0,
VAA PVC Fame Dining Table Mat (Grey) - Set of 6 : 1 Unit,,,850.0,
VAA Vinyl Blossom Dining Table Cover 6 Seater (1.32x2.02 metres) - Peach : 1 Unit,,,800.0,
VAA vinyl Blossom Dining Table cover 4 Seater (0.9x1.32 metres) - Brown : 1 Unit,,,400.0,
VAA Vinyl Blossom Dining Table Cover 4 Seater (0.9x1.32 metres) - Blue : 1 Unit,,,400.0,
VAA Vinyl Blossom Dining Table Cover 4 Seater (0.9x1.32 metres) - Peach : 1 Unit,,,400.0,
MHF Harmony Polyester Table Cover - Maroon : 1 Unit,,,300.0,
VAA Vinyl Blossom Dining Table Cover 4 Seater (0.9x1.32 metres) - Gold : 1 Unit,,,400.0,
VAA Vinyl Blossom Dining Table Cover 6 Seater (1.32x2.02 metres) - Blue : 1 Unit,,,800.0,
VAA PVC Zigzag Dining Table Mat (Black) - Set of 6 : 1 Unit,,,850.0,
VAA Vinyl Blossom Dining Table Cover 4 Seater (0.9x1.32 metres) - Grey : 1 Unit,,,400.0,
VAA Vinyl Blossom Dining Table Cover 6 Seater (1.32x2.02 metres) - Grey : 1 Unit,,,800.0,
Elegant Weavers Fridge Top Cover - Brown : 1 Unit,,,299.0,
Sheetal World Floor Mat 1919 Aasan Mat (Maroon - D3) 48x48 cm - Set Of 2 : 1 Unit,,,299.0,
MHF Velvet Polyester Aasan Mat - Brown : 1 Unit,,,120.0,
Sheetal World Floor Mat 1919 Aasan Mat (Maroon - D2) 48x48 cm - Set Of 2 : 1 Unit,,,299.0,
Sheetal World Floor Mat 1919 Aasan Mat (Maroon - D1) 48x48 cm - Set Of 2 : 1 Unit,,,299.0,
Sapana Plastic Floor Mat (Aasan Mat) Pink & Ivory - 6 Pieces : 1 Unit,,,475.0,
Sapana Plastic Floor Mat (Aasan Mat) Indigo & Ivory - 6 Pieces : 1 Unit,,,475.0,
Sapana Plastic Floor Mat (Aasan Mat) : Pink & Ivory Flower - 6 Pieces : 1 Unit,,,475.0,
Sapana Plastic Floor Mat (Aasan Mat) Red & Ivory - 6 Pieces : 1 Unit,,,475.0,
Sapana Plastic Folding Mat (Chatai) Strawberry Pink - 6X6 Feet : 1 Unit,,,1199.0,
Sapana Plastic Folding Mat (Chatai) : Strawberry Pink - 4X6 Feet : 1 Unit,,,799.0,
Sapana Plastic Folding Mat (Chatai) Pearl White - 4X6 Feet : 1 Unit,,,799.0,
Sahil Multipurpose Plastic Mat - 4X6 Feet : 1 Unit,,,675.0,
Sahil Multipurpose Plastic Mat - 6X6 Feet : 1 Unit,,,975.0,
Sheetal World Assanpati (Bed Side Runner) 2066 Maroon D3 : 51x168 cm,,,449.0,
MHF Tulip Flooring Carpet Mat - Brown : 1 Unit,,,1600.0,
MHF Tulip Flooring Carpet Mat - Maroon : 1 Unit,,,1600.0,
Elegant Calais Carpet -Brown : 60x40x25 cm,,,1199.0,
Elegant Calais Carpet - Red : 60x40x25 cm,,,1199.0,
Dettol Disinfectant Multi-Use Hygiene Liquid : 500 ml,Disinfectants,disinfectant,256.88,500 ml
Asahi Kasei Cooking Sheet Baking Paper : 30 cm x 5 metres,,,269.0,
Asahi Kasei Premium Cling Film Wrap : 22 cm x 20 metres,,,210.0,
Asahi Kasei Zipper Bag Large - 27x28 cm : 15 Units,,,255.0,
Asahi Kasei Aluminium Frying Pan Foil : 30 cm x 3 metres,,,249.0,
Hindalco Freshwrapp Aluminium Foil : 72 metres,,,650.0,
Hindalco Freshwrapp Aluminium Foil : 5.9 metres,,,125.0,
JK Pac Fresh Wrapping Paper Roll - White : 20 metres,,,199.0,
BECO Bake & Wrap Parchment Paper : 20 Metres,,,249.0,
Asahi Kasei Premium Cling Film Wrap : 30 cm x 20 metres,,,269.0,
Asahi Kasei Zipper Bag Medium - 18x20 cm : 20 Units,,,235.0,
Premier Face Tissue : 100 Units,Tissue Paper & Napkins,tissue,100.0,
Origami So Soft Face Tissue : 200 Units,Tissue Paper & Napkins,tissue,185.0,
CleanPlus Face Tissues : 200 Units,Tissue Paper & Napkins,tissue,145.0,
Fresh Ones Soft & Silky Facial Tissues : 100 Units,Tissue Paper & Napkins,tissue,110.0,
BECO Facial Tissue Napkin Box : 200 Pulls,Tissue Paper & Napkins,tissue,180.0,
BECO Multi Use Wet Wipe : 25 Wipes,,,149.0,
Origami So Soft Aloe Vera Wet Wipes : 25 Wipes,,,95.0,
Unigreen Compostable Blue Garbage Bag 19X21 Inches : 15 Bags,,,99.0,
Unigreen Compostable Green Garbage Bag 19X21 Inches : 15 Bags,,,99.0,
BECO Compostable Medium Garbage Bags - 19x21 Inches : 15 Units,,,135.0,
Compostable Green Garbage Bag (19x21 cm) - 15 Bags : 1 Unit,,,130.0,
Koti Disposable Garbage Bag 19x21 Inches : 15 Bags,,,75.0,
Earthmate Compostable Green Garbage Bag 25x30 Inches - 10 Pieces : 1 Unit,,,250.0,
Earthmate Compostable Blue Garbage Bag 25x30 Inches - 10 Pieces : 1 Unit,,,250.0,
Premier Kitchen Towel : 4 Units,,,330.0,
Clean Plus Kitchen Roll 60 Pulls : 4 Units,,,290.0,
Origami So Soft Godya 2-In-1 Kitchen Tissue Towel : 2 Units,Tissue Paper & Napkins,tissue,190.0,
BECO Eco-Friendly Reusable Kitchen Towel Roll : 20 U,,,350.0,
Origami So Soft 4 In 1 Tissue Roll : 4 Units,Tissue Paper & Napkins,tissue,375.0,
Origami Non-Woven Kitchen Towel - 23x21 cm : 80 Pulls,,,220.0,
Taina Cocktail Napkins : 100 Units,Tissue Paper & Napkins,napkin,65.0,
CleanPlus Party Tissues : 100 Units,Tissue Paper & Napkins,tissue,60.0,
Origami So Soft 2 Ply Tissues : 50 Units,Tissue Paper & Napkins,tissue,90.0,
CleanPlus Party Tissues Mini : 100 Units,Tissue Paper & Napkins,tissue,39.0,
Royal Cutie Tissue : 90 Units,Tissue Paper & Napkins,tissue,48.0,
Origami Klassic Premium Tissues : 100 Units,Tissue Paper & Napkins,tissue,45.0,
Savlon Germ Protection Wipe : 72 Wipes,,,210.0,
Beco Bamboo Tissues 2-Ply (100 Pulls) : Pack of 3,Tissue Paper & Napkins,tissue,270.0,
Premier Toilet 2 Ply Tissue Roll : 10 Units,Tissue Paper & Napkins,tissue,350.0,
CleanPlus Toilet Rolls : 6 Units,,,250.0,
CleanPlus Toilet Rolls : 10 Units,,,350.0,
Premier Toilet Tissue : 4 Units,Tissue Paper & Napkins,tissue,240.0,
Gala Double Hockey Toilet Brush : 1 Unit,,,170.0,
Gala Advanced Floor Cloth : 2 Units,,,255.0,
Gala Cloth Brush : 1 Unit,,,120.0,
Gala Stylo Sink Brush : 1 Unit,,,180.0,
Gebi Anti-Bacterial Toilet Round Brush With Container (Fluorescent Green) : 1 Unit,Jars & Containers,container,249.0,
Scotch Brite Premium Kitchen Towel : 3 Units,,,180.0,
Gebi Anti-Bacterial Mega Dual Action Toilet Brush (Fluorescent Green) : 1 Unit,,,175.0,
Scotch Brite Toilet Bowl & Rim Brush With Caddy - White & Turquoise : 1 Unit,,,950.0,
Sheetal World Cotton 4050 Yellow Duster 40x50cm : 5 Pieces,,,149.0,
Scotch Brite Scrubber Brush - White & Turquoise : 1 Unit,,,549.0,
Scotch Brite Lint Roller - White : 1 Unit,,,599.0,
Scotch-Brite Super Strong Scrub Pad - 7x10 cm : 2 Units,,,75.0,
Plastic Dustpan with Brush - Assorted : 1 Unit,,,110.0,
Scotch Brite Cotton Mop refill - White : 1 Unit,,,300.0,
Scotch Brite Dual Blade Squeegee - (Grey & White) : 1 Unit,,,475.0,
All Time Plastic Frosty Dust Bin : 5.5 Litre,,,150.0,
Balzano Tornado Cordless 2-in-1 Vacuum Cleaner - Black : 100 W,Cleaners,cleaner,10990.0,
Scotch Brite Handy Brush Scrubber - White & Turquoise : 1 Unit,,,499.0,
Vega Deluxe Body Sponge (BA-2/3) Assorted : 1 Unit,,,150.0,
Scotch Brite Microfiber Flat Mop - (Green) : 1 Unit,,,1499.0,
Kvg Teak Wood Double Spoon Stand : 1 Unit,,,529.0,
Stainless Steel Tissue Paper Holder - Triangle : 1 Unit,Tissue Paper & Napkins,tissue,150.0,
Happy Family Queen Tissue paper Holder (Wood Colour) : 1 Unit,Tissue Paper & Napkins,tissue,139.0,
Happy Family Woodland Multi Utility Set (Wood Colour ) : 1 Unit,,,349.0,
Happy Family Noble Antique Tea Coaster Set (Antique Silver) : 1 Unit,,,120.0,
Disposable Wooden Fork - 14 cm : 30 Pieces,,,69.0,
