name,category,subcategory,price,unit
Borosil Nickel Akhand Diya Large : 1 Unit,,,1295.0,
Shubhkart Nitya Steel Swastik Diya (No.12) - 19 g : 1 Unit,,,59.0,
Shubhkart Nitya Steel Niraanjan Diya No. 12 - 25 g : 1 Unit,,,58.0,
Janta Agarbatti Stand -110 gms : 1 Unit,,,120.0,110 g
Stainless Steel Gold PVD Coating Agarbatti Stand : 1 Unit,,,299.0,
Shubhkart Nitya Deepak Agarbatti Stand Set - 45 g : 1 Unit,,,79.0,
Shubhkart Nitya Steel Pushpa Agarbatti Stand (No.2) - 16 g : 1 Unit,,,39.0,
Shubhkart Nitya Copper Kalash Size 2- 140 gms : 1 Unit,,,399.0,
Shubhkart Nitya Gol Ghanti Size 2 -110 gms : 1 Unit,,,249.0,
Shubhkart Nitya Copper Kalash : 64 Gms,,,175.0,64 g
Shubhkart Nitya Naag Ghanti : 1 Unit,,,120.0,
Shubhkart Nitya Kalash Kori Haldi-Kumkum - 25 g : 1 Unit,,,59.0,
Copper Hammered Kalash - Size 3 : 1 Unit,,,500.0,
Homelites Matches : 5 Pieces,,,10.0,
Ship Safety Matches : 1 Unit,,,10.0,
Scented Tea Light Candles - Rose : 15 Pieces,,,150.0,
Scented Tea Light Candles - Fresh Linen : 15 Pieces,,,150.0,
Scented Tea Light Candles - Lemon Grass : 15 Pieces,,,150.0,
Scented Tea Light Candles - Orchid Blossom : 15 Pieces,,,150.0,
Scented Tea Light Candles - Fresh Lavender : 15 Pieces,,,150.0,
Shot Glass Candles : 3 Pieces,,,200.0,
Anurag Pooja Vathulu : 100 Units,Pooja Needs,pooja,18.0,
Welburn Veda & Co Scented Diya Candles : 5 Pieces,,,125.0,
Shrink Sleeve Glass Candle - Fresh Linen : 1 Piece,,,150.0,
Homelites Matches : 10 Pieces,,,10.0,
Shubhkart Nitya Brass Puja Jyot Kapooram Dhoop Aarti : 70 Gms,,,210.0,70 g
Shubhkart Nitya Choumukha Size 0 : 113 gms,,,280.0,113 g
Sanjeev Kapoor Vastu Set (Turtle + Tray) : 2 Piece,,,495.0,
Anurag Kum Kum : 100 gms,,,35.0,100 g
D Homes Tea Light Candles : 30 Pieces,,,145.0,
Shubhkart Nitya Steel Vaidik Choumuka - 60 g : 1 Unit,,,79.0,
Welburn Veda & Co Unscented Tealight Candle : 30 Piece,,,110.0,
Tealight Candle (Rf) - Set Of 50 : 1 Unit,,,180.0,
Pan Aromas Wonder Series Reed Diffuser - Chamomile & Lavender : 50 ml,,,200.0,50 ml
Iris Fragrance Gift Set INFG0324LA - Lavender : 1 Unit,,,625.0,
Pan Aromas Wonder Series Reed Diffuser -Forest Bliss : 50 ml,,,200.0,50 ml
Iris Fragrance Gift Set INFG0324AC - Apple Cinnamon : 1 Unit,,,625.0,
Iris Fragrance Gift Set INFG0326LA - Lavender : 1 Unit,,,750.0,
Pan Aromas Crystal Collection Scented Candle - Vanilla Latte : 150 gms,,,250.0,150 g
Pan Aromas Scented Tealight Candle Fresh Lavender : 45 Pieces,,,425.0,
Iris Home Fragrance Potpourri - Jasmine : 140 gms,,,150.0,140 g
Welburn Veda&Co Unscented Tealight Candle White - 100x12 g : 1 Unit,,,375.0,
Pan Aromas Wonder Series Shot Glass Candle - Purple & Peach : 2 Pieces,,,200.0,
Pan Aromas Wonder Series Reed Diffuser - Red Passion : 50 ml,,,200.0,50 ml
Iris Home Fragrance Potpourri - Rose : 140 gms,,,150.0,140 g
Pan Aromas Scented Tealight Candle Apple & Cinnamon : 45 Pieces,,,425.0,
Pan Aromas Wonder Series Shot Glass Candle - Green & Yellow : 2 Pieces,,,200.0,
Pan Aromas Wonder Series Shot Glass Candle - Red & Blue : 2 Pieces,,,200.0,
Pan Aromas Burner Oil Tealight Set Fresh Lavender : 1 Unit,,,300.0,
Pan Aromas Scented Tealight Candle Lemon Grass : 45 Pieces,,,425.0,
Iris Floater Candle - Frangipani : 4 Pieces,,,175.0,
Iris Floater Candle - Orange Truffle : 4 Pieces,,,175.0,
Pan Aromas Scented Tealight Candle Jasmine : 45 Pieces,,,425.0,
Iris Yankee Glass Jar Candle Berry Pop : 1 Unit,Jars & Containers,jar,150.0,
Iris Sceneted Votives Set : 3 Pieces,,,269.0,
Pan Aromas Burner Oil Tealight Set Lemon Grass : 1 Unit,,,300.0,
Iris Taper Jar Candle - Musk Elixir : 1 Unit,Jars & Containers,jar,149.0,
Pan Aromas Scented Tealight Candle Orchard Blossom : 45 Pieces,,,425.0,
Pan Aromas Burner Oil Tealight Set Orchard Blossom : 1 Unit,,,300.0,
Iris Taper Jar Candle - Berry Pop : 1 Unit,Jars & Containers,jar,149.0,
Iris Floater Candle - Lemon grass : 4 Pieces,,,175.0,
Iris Yankee Glass Jar Candle Orange Truffle : 1 Unit,Jars & Containers,jar,150.0,
Iris Yankee Glass Jar Candle Frangipani : 1 Unit,Jars & Containers,jar,150.0,
Pan Aromas Votive Glass Candle Rose : 6 Pieces,,,300.0,
Iris Taper Jar Candle - Sea Shore : 1 Unit,Jars & Containers,jar,149.0,
Iris Floater Candle - Berry pop : 4 Pieces,,,175.0,
Iris Ribbed Jar Candle - Lavender : 1 Unit,Jars & Containers,jar,149.0,
Pan Aromas Mercury Series Scented Candle Sandalwood Orchard Lilac : 3 Pieces,,,250.0,
Pan Aromas Votive Glass Candle French Vanilla : 6 Pieces,,,300.0,
Pan Aromas Votive Glass Candle Tangy Orange : 6 Pieces,,,300.0,
Iris Swirl Jar Candle - Cool Blue : 1 Unit,Jars & Containers,jar,149.0,
Pan Aromas Crystal Collection Scented Candle - Midnight Rose : 150 gms,,,250.0,150 g
Iris Fragrance Gift Set INFG0326JS - Jasmine : 1 Unit,,,750.0,
Iris Ribbed Jar Candle - Mango Sorbet : 1 Unit,Jars & Containers,jar,149.0,
Iris Pillar Candle Lavender : Set of 2,,,229.0,
Iris Pillar Candle Mango Sorbet : Set of 2,,,229.0,
Iris Yankee Glass Jar Candle Lavender : 1 Unit,Jars & Containers,jar,150.0,
Iris Ribbed Pillar Candle Berry Pop : 1 Unit,,,149.0,
Iris Ribbed Pillar Candle Lavender : 1 Unit,,,149.0,
Iris Ribbed Pillar Candle Orange Truffle : 1 Unit,,,149.0,
Plastic Spray Bottle : 550 ml,,,55.0,550 ml
Plastic Pressure Sprayer Bottle,,,,
