name,category,subcategory,mrp,our_price,quantity,status,stock_count,productid,imageurl,createdat,updatedat,details
Dot & Key Pomegranate Miracle Collagen Boost Retinol Youth Serum : 25 ml,Personal Care,Beauty & Grooming,399,399,1,,,,,,,
L'Oreal Revitalift Crystal Micro Essence : 65 ml,Grocery & Food,Pantry Essentials,485,485,1,,,,,,,
Plum Green Tea Alcohol-Free Toner : 200 ml,Sports & Fitness,Sports Accessories,470,470,1,,,,,,,
Lotus Herbals Rosetone Rose Petals Facial Skin Toner : 100 ml,Personal Care,Beauty & Grooming,120,120,1,,,,,,,
Lotus Herbals Basiltone Toner : 100 ml,Garden & Outdoor,Gardening,299,299,1,,,,,,,
Faces Canada Glow Lift Serum Dragon Fruit : 27 ml,Personal Care,Beauty & Grooming,485,485,1,,,,,,,
Garnier Bright Complete Overnight Booster Serum 10% Vitamin C : 15 ml,Sports & Fitness,Sports Accessories,1250,1250,1,,,,,,,
Garnier Bright Complete Overnight Booster Serum 10% Vitamin C : 30 ml,Sports & Fitness,Sports Accessories,90,90,1,,,,,,,
Faces Canada Pink Aloe Vera Toner : 100 ml,Personal Care,Beauty & Grooming,1049,1049,1,,,,,,,
Faces Canada Clear Skin Serum Matcha Green Tea : 27 ml,Personal Care,Beauty & Grooming,399,399,1,,,,,,,
Vaseline Intensive Care Body Lotion : 400 ml,Personal Care,Baby Care,345,345,1,,,,,,,
Nivea Cocoa Nourish Body Lotion : 400 ml,Personal Care,Baby Care,345,345,1,,,,,,,
Vaseline Cocoa Glow Body Lotion : 600 ml,Personal Care,Beauty & Grooming,465,465,1,,,,,,,
Vaseline Aloe Fresh Body Lotion : 90 ml,Personal Care,Beauty & Grooming,550,550,1,,,,,,,
Nivea Body Milk Shea Smooth Body Lotion : 400 ml,Grocery & Food,Dairy & Eggs,695,695,1,,,,,,,
Nivea Shea Smooth Body Lotion : 600 ml,Personal Care,Beauty & Grooming,695,695,1,,,,,,,
Boro Plus Doodh Kesar Ayurvedic Body Lotion : 400 ml,Sports & Fitness,Sports Accessories,499,499,1,,,,,,,
Nivea Body Nourishing Lotion : 120 ml,Personal Care,Baby Care,649,649,1,,,,,,,
Vaseline Healthy Bright Daily Brightening Lotion : 400 ml,Garden & Outdoor,Gardening,420,420,1,,,,,,,
Vaseline Healthy Bright Daily Brightening Lotion : 90 ml,Garden & Outdoor,Gardening,1035,1035,1,,,,,,,
Parachute Advanced Deep Nourish Dry Skin Body Lotion : 250 ml,Personal Care,Baby Care,599,599,1,,,,,,,
Pond's Body Lotion : 90 ml,Sports & Fitness,Sports Accessories,899,899,1,,,,,,,
Himalaya Nourishing Body Lotion Cocoa Butter Wheat Germ : 400 ml,Grocery & Food,Pantry Essentials,499,499,1,,,,,,,
Nivea Aloe Protection Body Lotion SPF 15 : 400 ml,Personal Care,Beauty & Grooming,599,599,1,,,,,,,
Parachute Advanced Soft Touch Body Lotion : 250 ml,Sports & Fitness,Sports Equipment,649,649,1,,,,,,,
Nivea Body Nourishing Lotion Aloe : 120 ml,Personal Care,Baby Care,699,699,1,,,,,,,
mCaffeine Naked & Raw Coffee Body Scrub : 55 gms,Personal Care,Baby Care,399,399,1,,,,,,,
Parachute Advansed Cocoa Repair Body Lotion : 250 ml,Sports & Fitness,Sports Accessories,225,225,1,,,,,,,
Himalaya Nourishing Body Lotion Winter Cherry Aloe Vera : 400 ml,Personal Care,Baby Care,1000,1000,1,,,,,,,
Plum Body Lovin Vanilla Caramello Body Lotion With Cocoa Butter : 400 ml,Grocery & Food,Bakery & Breakfast,550,550,1,,,,,,,
Parachute Natural Moisture Body Lotion : 400 ml,Sports & Fitness,Sports Accessories,595,595,1,,,,,,,
Plum Body Lovin - Vanilla Vibes Body Oil : 200 ml,Personal Care,Beauty & Grooming,799,799,1,,,,,,,
Yardley Body Lotion - English Lavender : 350 ml,Sports & Fitness,Sports Accessories,420,420,1,,,,,,,
Mamaearth Vitamin C Body Lotion : 400 ml,Personal Care,Baby Care,325,325,1,,,,,,,
Dr. Rashel De Tan Scrub : 380 ml,Personal Care,Beauty & Grooming,325,325,1,,,,,,,
Mamaearth Ubtan Body Lotion : 400 ml,Personal Care,Baby Care,549,549,1,,,,,,,
Aveeno Daily Moisturizing Lotion For Dry Skin : 71 ml,Personal Care,Beauty & Grooming,329,329,1,,,,,,,
Nivea Aloe Protection Body Lotion : 200 ml,Personal Care,Baby Care,699,699,1,,,,,,,
Episoft Cleansing Lotion For Sensitive Skin : 125 ml,Personal Care,Beauty & Grooming,399,399,1,,,,,,,
Everyuth Naturals Exfoliating Walnut Scrub : 200 gms,Garden & Outdoor,Gardening,549,549,1,,,,,,,
Garnier Serum Bright Complete Mask Lemon : 28 gms,Sports & Fitness,Sports Accessories,435,435,1,,,,,,,
mCaffeine Naked & Raw Coffee Face Scrub : 75 gms,Personal Care,Baby Care,550,550,1,,,,,,,
Nykaa Skin Secrets Pearl & Hyaluronic Acid Sheet Mask : 20 ml,Personal Care,Beauty & Grooming,729,729,1,,,,,,,
Mirabelle Papaya Fairness Facial No.1 K-Mask : 25 ml,Personal Care,Beauty & Grooming,115,115,1,,,,,,,
Lakme Blush & Glow Watermelon Sheet Mask : 20 ml,Personal Care,Beauty & Grooming,550,550,1,,,,,,,
Garnier Black Serum Face Mask Pure Charcoal : 1 Unit,Personal Care,Beauty & Grooming,759,759,1,,,,,,,
Garnier Japanese Sakura Serum Tissue Mask : 28 gms,Personal Care,Baby Care,415,415,1,,,,,,,
Mirabelle Berries Fairness Facial No.1 K-Mask : 25 ml,Personal Care,Beauty & Grooming,110,110,1,,,,,,,
Dr. Rashel Skin Whitening Scrub : 380 ml,Personal Care,Beauty & Grooming,500,500,1,,,,,,,
Nykaa Skin Secrets Black Mud + Aloe Vera Sheet Mask : 20 ml,Personal Care,Beauty & Grooming,115,115,1,,,,,,,
Dr. Rashel Bamboo Charcoal Nose Pore Strip : 10 U,Personal Care,Beauty & Grooming,198,198,1,,,,,,,
Dr. Rashel De Tan Face Pack : 380 ml,Personal Care,Beauty & Grooming,105,105,1,,,,,,,
Nykaa Skin Secrets Lemon & Honey Sheet Mask : 20 ml,Personal Care,Beauty & Grooming,399,399,1,,,,,,,
Mirabelle Aloe Vera Fairness Facial No.1 K-Mask : 25 ml,Personal Care,Beauty & Grooming,550,550,1,,,,,,,
The Face Shop Real Nature Rice Sheet Mask : 20 gms,Grocery & Food,Bakery & Breakfast,198,198,1,,,,,,,
L'Oreal Revitalift Crystal Sheet Mask : 25 gms,Industrial & Scientific,Lab & Scientific,110,110,1,,,,,,,
Everyuth Naturals Advanced Walnut Apricot Scrub : 100 gms,Grocery & Food,Fresh Produce,279,279,1,,,,,,,
Mirabelle Charcoal Premium Facial Sheet Mask : 25 ml,Personal Care,Beauty & Grooming,220,220,1,,,,,,,
mCaffeine Coffee Sheet Mask With Vitamin C : 20 gms,Personal Care,Baby Care,399,399,1,,,,,,,
The Face Shop Real Nature Aloe Sheet Mask : 20 gms,Personal Care,Beauty & Grooming,475,475,1,,,,,,,
Lakme Sun Expert De-Tan Scrub : 50 gms,Industrial & Scientific,Lab & Scientific,435,435,1,,,,,,,
Dr. Rashel De Tan Sheet Mask : 1 U,Personal Care,Beauty & Grooming,550,550,1,,,,,,,
The Face Shop Real Nature Lemon Sheet Mask : 20 gms,Party & Events,Party Supplies,425,425,1,,,,,,,
Dot & Key Pollution + Acne Defense Green Clay Mask : 85 gms,Home & Living,Cleaning & Household,469,469,1,,,,,,,
Everyuth Naturals Exfoliating Walnut Scrub : 50 gms,Garden & Outdoor,Gardening,225,225,1,,,,,,,
Dr. Rashel Vitamin C Sheet Mask : 1 U,Personal Care,Baby Care,469,469,1,,,,,,,
L'Oreal Revitalift Hyaluronic Acid Serum Mask : 33 gms,Personal Care,Beauty & Grooming,350,350,1,,,,,,,
Nykaa Skin Secrets Tea Tree + Aloe Vera Sheet Mask : 20 ml,Personal Care,Beauty & Grooming,330,330,1,,,,,,,
Skin Fx Detan & Lightening Serum Mask : 20 g,Personal Care,Beauty & Grooming,450,450,1,,,,,,,
Mirabelle Cucumber Fairness Facial No.1 K-Mask : 25 ml,Personal Care,Beauty & Grooming,300,300,1,,,,,,,
Skin Fx Detoxifying & Hydrating Serum Mask : 20 g,Personal Care,Beauty & Grooming,99,99,1,,,,,,,
Mirabelle Tea Tree Essential Facial Sheet Mask : 25 ml,Personal Care,Beauty & Grooming,229,229,1,,,,,,,
Skin Fx Anti Aging & Revitalizing Serum Mask : 20 g,Personal Care,Beauty & Grooming,100,100,1,,,,,,,
Skin Fx Brightening & Moisturizing Serum Mask : 20 g,Personal Care,Beauty & Grooming,99,99,1,,,,,,,
Pond's Bright Beauty Face Scrub : 100 gms,Garden & Outdoor,Gardening,100,100,1,,,,,,,
Tonymoly I'm Aloe Mask Sheet : 21 gms,Personal Care,Baby Care,99,99,1,,,,,,,
Tonymoly Eggpore Nose Pack Package : 7 Units,Pet Supplies,Other Pets,99,99,1,,,,,,,
Tonymoly I'm Lemon Mask Sheet : 21 gms,Party & Events,Party Supplies,99,99,1,,,,,,,
Mirabelle Pearl+Charcoal Facial Sheet Mask : 25 ml,Personal Care,Beauty & Grooming,250,250,1,,,,,,,
Mirabelle Gold + Charcoal Facial Mask : 25 ml,Personal Care,Beauty & Grooming,100,100,1,,,,,,,
Garnier Serum Hydra Bomb Green Tea Tissue Mask : 28 gms,Sports & Fitness,Sports Accessories,140,140,1,,,,,,,
Skin Fx Refreshing & Glowing Serum Mask : 20 g,Personal Care,Beauty & Grooming,250,250,1,,,,,,,
Mirabelle Rose Essential Facial Sheet Mask : 25 ml,Personal Care,Beauty & Grooming,100,100,1,,,,,,,
Mirabelle Turmeric Essential Facial Sheet Mask : 25 ml,Personal Care,Beauty & Grooming,99,99,1,,,,,,,
Pond's Detoxing Sheet Mask : 1 Unit,Personal Care,Baby Care,100,100,1,,,,,,,
Dot & Key Lip Plumping Sleeping Mask Vitamin C+E : 15 ml,Personal Care,Baby Care,159,159,1,,,,,,,
Cetaphil Sunscreen SPF 50+ Light Gel : 50 ml,Personal Care,Beauty & Grooming,189,189,1,,,,,,,
Lakme Sun Expert Tinted Sunscreen SPF 50 : 100 ml,Personal Care,Beauty & Grooming,149,149,1,,,,,,,
Cetaphil Sunscreen SPF 30 Light Gel : 100 ml,Personal Care,Beauty & Grooming,149,149,1,,,,,,,
Lotus Herbals UV Screen Matte Gel SPF 50 UVB : 50 gms,Sports & Fitness,Sports Accessories,100,100,1,,,,,,,
La Shield Pollution Protect Mineral Sunscreen Gel SPF 50 : 50 gms,Sports & Fitness,Sports Accessories,170,170,1,,,,,,,
Lotus Herbals Sunscreen Cream SPF 20 UVB : 100 gms,Personal Care,Beauty & Grooming,75,75,1,,,,,,,
Lakme Sun Expert SPF 24 Ultra Matte Lotion : 50 ml,Garden & Outdoor,Gardening,100,100,1,,,,,,,
Lakme Sun Expert SPF30 PA++ Ultra Matte Lotion : 100 ml,Garden & Outdoor,Gardening,550,550,1,,,,,,,
Lotus Herbals Kids Sun Block Cream - Sensitive Skin Formula : 100 gms,Personal Care,Beauty & Grooming,99,99,1,,,,,,,
mCaffeine Coffee Sunscreen Lotion SPF 50 : 50 ml,Personal Care,Beauty & Grooming,75,75,1,,,,,,,
Lakme Sun Expert SPF 30 Ultra Matte Lotion : 50 ml,Garden & Outdoor,Gardening,199,199,1,,,,,,,
mCaffeine Coffee Powder Sunscreen SPF 50 : 4 gms,Sports & Fitness,Sports Accessories,100,100,1,,,,,,,
Lakme Sun Expert SPF 50 PA+++ Ultra Matte Lotion : 100 ml,Garden & Outdoor,Gardening,149,149,1,,,,,,,
Renee Princess Snowball Lip Balm : 3 gms,Sports & Fitness,Sports Accessories,99,99,1,,,,,,,
Lotus Herbals Lip Therapy Cherry : 3.4 gms,Personal Care,Beauty & Grooming,149,149,1,,,,,,,
Lotus Herbals Strawberry Lip Balm : 5 gms,Grocery & Food,Snacks & Beverages,129,129,1,,,,,,,
Dot & Key Gloss Boss Lip Balm - Strawberry Crush : 12 gms,Personal Care,Beauty & Grooming,149,149,1,,,,,,,
Dot & Key Gloss Boss Lip Balm - Cherry Pop : 12 gms,Personal Care,Beauty & Grooming,149,149,1,,,,,,,
Nykaa Serial Kisser Lip Balm - Strawberry : 4.5 gms,Personal Care,Beauty & Grooming,225,225,1,,,,,,,
Maybelline New York Color Lip Balm - Manhattan Mauve : 4 gms,Sports & Fitness,Sports Accessories,100,100,1,,,,,,,
Dot & Key Gloss Boss Lip Balm - Cocoa Mint : 12 gms,Personal Care,Beauty & Grooming,625,625,1,,,,,,,
Nykaa Serial Kisser Lip Balm Peach : 4.5 gms,Personal Care,Baby Care,100,100,1,,,,,,,
Odomos Naturals Non-Sticky Mosquito Repellent Cream : 100 gms,Home & Living,Cleaning & Household,159,159,1,,,,,,,
VLCC Natural Science - Gold Facial Kit : 60 gms,Pet Supplies,Cat Supplies,159,159,1,,,,,,,
VLCC Diamond Facial Kit : 60 gms,Personal Care,Baby Care,99,99,1,,,,,,,
Lotus Herbals Radiant Gold Facial Kit : 1 Unit,Jewelry & Watches,Fine Jewelry,149,149,1,,,,,,,
Lotus Herbals Radiant Diamond Facial Kit : 1 Unit,Jewelry & Watches,Fine Jewelry,129,129,1,,,,,,,
VLCC Natural Science - Pearl Facial Kit : 60 gms,Personal Care,Baby Care,129,129,1,,,,,,,
WOW Vitamin C Brightening Facial Kit : 6x10 ml,Personal Care,Beauty & Grooming,75,75,1,,,,,,,
WOW Ubtan Radiance Facial Kit : 6x10 ml,Personal Care,Beauty & Grooming,295,295,1,,,,,,,
mCaffeine Green Tea Hydrogel Under Eye Patches : 30 Units,Personal Care,Beauty & Grooming,1182,1182,1,,,,,,,
mCaffeine Naked & Raw Coffee Under Eye Cream : 15 ml,Personal Care,Baby Care,599,599,1,,,,,,,
mCaffeine Green Tea Under Eye Cream : 15 ml,Personal Care,Beauty & Grooming,1200,1200,1,,,,,,,
Tonymoly Panda's Dream Eye Patch : 7 ml,Jewelry & Watches,Fine Jewelry,375,375,1,,,,,,,
Skin Fx Foot Mask : 16 gm,Fashion & Accessories,Footwear,299,299,1,,,,,,,
Dr. Rashel De Tan Foot Mask : 1 U,Fashion & Accessories,Footwear,330,330,1,,,,,,,
Dr. Rashel Vitamin C Foot Mask : 1 U,Fashion & Accessories,Footwear,269,269,1,,,,,,,
Skin Fx Hand Mask : 14 gm,Personal Care,Beauty & Grooming,475,475,1,,,,,,,
Green Leaf Foot Care Cream : 50 gms,Garden & Outdoor,Gardening,385,385,1,,,,,,,
Patanjali Saundarya Aloe Vera Gel : 150 ml,Jewelry & Watches,Fine Jewelry,499,499,1,,,,,,,
Greenleaf Pure Aloe Vera Skin Gel : 500 gm,Personal Care,Beauty & Grooming,299,299,1,,,,,,,
Green Leaf Pure Aloe Vera Skin Gel : 190 gms,Grocery & Food,Fresh Produce,649,649,1,,,,,,,
Plum Hello Aloe Just Gel : 250 gms,Grocery & Food,Fresh Produce,550,550,1,,,,,,,
Green Leaf Aloe Cucumber Gel : 120 gms,Grocery & Food,Fresh Produce,399,399,1,,,,,,,
Clensta Red Aloe Vera Multipurpose Gel With 1% Niacinamide : 300 ml,Grocery & Food,Dairy & Eggs,199,199,1,,,,,,,
Green Leaf Aloe Cucumber Gel : 190 gms,Grocery & Food,Fresh Produce,199,199,1,,,,,,,
The Face Shop Jeju Aloe Fresh Soothing Foam Cleanser : 150 ml,Personal Care,Beauty & Grooming,249,249,1,,,,,,,
The Face Shop Rice Ceramide Moisturizing Skincare kit : 1 Unit,Personal Care,Beauty & Grooming,249,249,1,,,,,,,
mCaffeine Coffee Moment Skin Care Gift Set For Men & Women : 1 Unit,Personal Care,Baby Care,149,149,1,,,,,,,
mCaffeine Milky Brew Latte Gift Set For Men & Women : 1 Unit,Party & Events,Party Supplies,199,199,1,,,,,,,
Plum Body Lovin Vanilla Vibes Bath & Body Gift Set : 3 U,Party & Events,Event Planning,249,249,1,,,,,,,
Soulflower Try me Gift Set - Lavender : 1 Unit,Jewelry & Watches,Fine Jewelry,149,149,1,,,,,,,
Plum Body Lovin Hawaiian Rumba Lets Get Beachin Duo : 1 Unit,Grocery & Food,Meat & Seafood,120,120,1,,,,,,,
Soulflower Hexagon Bath Set with Lavender : 1 Unit,Garden & Outdoor,Gardening,340,340,1,,,,,,,
Soulflower Heart Bath Set With Rose : 1 Unit,Home & Living,Home Improvement,430,430,1,,,,,,,
Mcaffeine Cvr Me In Std Shm Gf St : 120 gm,Books & Media,Musical Instruments,325,325,1,,,,,,,
Soulflower Vitamin C - Orange Glam Box : 1 Unit,Personal Care,Health & Wellness,365,365,1,,,,,,,
Soulflower Travel Kit : 1 Unit,Garden & Outdoor,Gardening,315,315,1,,,,,,,
mCaffeine Coffee De-Stress Gift Set For Men & Women : 1 Unit,Personal Care,Baby Care,325,325,1,,,,,,,
Soulflower Try me Gift Set - Rose : 1 Unit,Party & Events,Party Supplies,325,325,1,,,,,,,
White Tone Pearl Face Powder : 75 gms,Personal Care,Beauty & Grooming,799,799,1,,,,,,,
Vaseline Lip Care Rosy Lips : 10 gms,Personal Care,Beauty & Grooming,349,349,1,,,,,,,
Nivea Strawberry Shine Caring Lip Balm : 4.8 gms,Personal Care,Beauty & Grooming,375,375,1,,,,,,,
Nivea Original Care Lip Balm : 4.8 gms,Personal Care,Baby Care,150,150,1,,,,,,,
Lakme Eyeconic Kajal Twin Pack : 2x0.35 gms,Jewelry & Watches,Fine Jewelry,299,299,1,,,,,,,
Himalaya Lip Balm : 10 gms,Grocery & Food,Pantry Essentials,199,199,1,,,,,,,
Renee PH Stick Madness Lipstick : 3 gms,Personal Care,Beauty & Grooming,199,199,1,,,,,,,
Faces Canada Weightless Matte Finish Compact Powder (Natural) - 9 g : 1 Unit,Industrial & Scientific,Industrial Tools,299,299,1,,,,,,,
Lakme Eyeconic Liquid Eyeliner - Black : 4.5 ml,Personal Care,Beauty & Grooming,110,110,1,,,,,,,
Renee Fab 5 In 1 Lipstick : 7.5 gms,Fashion & Accessories,Women's Fashion,100,100,1,,,,,,,
Nivea Pomegranate Shine Lip Balm : 4.8 gms,Personal Care,Beauty & Grooming,400,400,1,,,,,,,
Lakme Rose Face Powder With Sunscreen - Warm Pink : 40 gms,Personal Care,Beauty & Grooming,230,230,1,,,,,,,
Faces Canada Peaches N Cream Tinted Moisturizer : 35 gms,Personal Care,Beauty & Grooming,395,395,1,,,,,,,
Insight 3 In 1 Long Lasting Primer : 30 ml,Industrial & Scientific,Lab & Scientific,130,130,1,,,,,,,
Lakme Sun Expert Ultra Matte SPF 40 PA+++ Compact : 7 gms,Electronics,Computer Accessories,319,319,1,,,,,,,
Lakme Lumi Skin Cream : 30 gms,Personal Care,Beauty & Grooming,230,230,1,,,,,,,
Lakme Insta Eye Liner - Black : 9 ml,Sports & Fitness,Sports Accessories,500,500,1,,,,,,,
Himalaya Strawberry Shine Lip Care : 4.5 gms,Grocery & Food,Fresh Produce,849,849,1,,,,,,,
Nykaa Black Magic Kajal - Black : 0.3 gms,Industrial & Scientific,Industrial Tools,1445,1445,1,,,,,,,
Plum Kohl Kajal - Deep Black : 0.35 gms,Grocery & Food,Fresh Produce,1006,1006,1,,,,,,,
Insight Pro Concealer Palette - Concealer : 15 gms,Personal Care,Beauty & Grooming,749,749,1,,,,,,,
Faces Canada Nail Enamel Remover Transparent : 30 ml,Personal Care,Beauty & Grooming,1000,1000,1,,,,,,,
Lakme Absolute Blur Perfect Makeup Primer : 10 gms,Home & Living,Home Decor,899,899,1,,,,,,,
Lakme Jewel Sindoor - Maroon : 4.5 ml,Jewelry & Watches,Fine Jewelry,1500,1500,1,,,,,,,
Himalaya Rich Cocoa Butter Lip Care : 4.5 gms,Grocery & Food,Pantry Essentials,2000,2000,1,,,,,,,
Lakme Perfecting Liquid Foundation - Marble : 27 ml,Garden & Outdoor,Gardening,599,599,1,,,,,,,
Himalaya Litchi Shine Lip Care : 4.5 gms,Personal Care,Beauty & Grooming,1300,1300,1,,,,,,,
Maybelline New York Colossal Bold Liner - Black : 3 ml,Grocery & Food,Meat & Seafood,500,500,1,,,,,,,
Maybelline New York Colossal Mascara : 10 ml,Party & Events,Party Supplies,1192,1192,1,,,,,,,
Insight Pro Concealer Palette - Corrector : 15 gms,Personal Care,Beauty & Grooming,1000,1000,1,,,,,,,
Maybelline New York Blushed Nudes Eyeshadow Palette : 9 gms,Personal Care,Beauty & Grooming,125,125,1,,,,,,,
Blue Heaven Intense Easy Sketch Eyeliner : 1 ml,Home & Living,Home Decor,65,65,1,,,,,,,
Faces Canada Magneteyes Dramatic Volumizing Mascara - Black : 9.5 ml,Personal Care,Beauty & Grooming,260,260,1,,,,,,,
Lakme Jewel Sindoor - Red : 4.5 ml,Jewelry & Watches,Fine Jewelry,175,175,1,,,,,,,
Maybelline New York Creamy Mattes Lipstick - Nude Nuance : 3.9 gms,Personal Care,Beauty & Grooming,399,399,1,,,,,,,
Renee Fab 3 in 1 Eyeshadow : 4.5 gms,Jewelry & Watches,Watches,40,40,1,,,,,,,
Insight Mascara : 9 ml,Personal Care,Beauty & Grooming,499,499,1,,,,,,,
Lakme 9to5 Primer + Matte Lipstick - Rosy Sunday : 3.6 gms,Personal Care,Beauty & Grooming,225,225,1,,,,,,,
Faces Canada Magneteyes Eyeliner - Black : 3.5 ml,Jewelry & Watches,Watches,299,299,1,,,,,,,
Faces Canada Matte Finish Lipstick - Buff Nude 05 : 4 gms,Personal Care,Beauty & Grooming,750,750,1,,,,,,,
Lakme Eyeconic Volume Mascara : 8.5 ml,Home & Living,Home Decor,260,260,1,,,,,,,
Renee Stay Forever Matte Liquid Lipsticks : 10x1 ml,Personal Care,Beauty & Grooming,229,229,1,,,,,,,
Insight Intense Kohl Kajal : 0.35 gm,Grocery & Food,Fresh Produce,599,599,1,,,,,,,
Insight Liner Express Eye Pen : 1.5 gms,Smart Home,Smart Devices,310,310,1,,,,,,,
Faces Canada Clean Glow Make Up Remover Wipes : 30 Wipes,Personal Care,Baby Care,325,325,1,,,,,,,
Elle 18 Eye Drama Kajal - Super Black : 0.35 gm,Jewelry & Watches,Watches,325,325,1,,,,,,,
Renee Makeup Removal Wipes : 30 Wipes,Personal Care,Baby Care,180,180,1,,,,,,,
Lakme Nail Colour Remover : 27 ml,Personal Care,Beauty & Grooming,199,199,1,,,,,,,
Lakme 9to5 Matte Complexion Compact - Melon : 8 gms,Personal Care,Beauty & Grooming,189,189,1,,,,,,,
Himalaya Peach Shine Lip Care : 4.5 gms,Grocery & Food,Fresh Produce,279,279,1,,,,,,,
Insight Non-Transfer Lip Color - Toffee Cream : 4 ml,Personal Care,Beauty & Grooming,230,230,1,,,,,,,
Maybelline Fit Me Compact - 310 Sun Beige : 6 gm,Sports & Fitness,Sports Accessories,99,99,1,,,,,,,
Lakme Face It Compact - Coral : 9 gms,Electronics,Computer Accessories,299,299,1,,,,,,,
Insight 24 Hrs Matte Lipstick - Moody (13) : 3 gms,Personal Care,Beauty & Grooming,175,175,1,,,,,,,
Insight Make Up Fixer Spray : 75 ml,Industrial & Scientific,Industrial Tools,199,199,1,,,,,,,
Insight Pastel Color Nail Polish - 34 : 9 ml,Personal Care,Beauty & Grooming,209,209,1,,,,,,,
Plum Red Velvet Love Lip Balm : 12 gms,Personal Care,Beauty & Grooming,199,199,1,,,,,,,
Elle 18 Color Pop Matte Lip Color - P22 Pink Stylist : 4.3 gms,Personal Care,Beauty & Grooming,275,275,1,,,,,,,
Maybelline New York 5th Avenue Sunset Mini Palette : 6.1 gms,Smart Home,Smart Devices,499,499,1,,,,,,,
Lotus Make-Up Ecostay Kajal : 1.2 gms,Garden & Outdoor,Gardening,230,230,1,,,,,,,
Faces Canada CC Cream - Natural 01 : 35 gms,Grocery & Food,Dairy & Eggs,999,999,1,,,,,,,
Maybelline New York Blackest Black Eyeliner : 2.5 gms,Personal Care,Beauty & Grooming,180,180,1,,,,,,,
Faces Canada Berry Blush - Love Vibes Only : 4 gms,Personal Care,Beauty & Grooming,449,449,1,,,,,,,
Color Fx Twilight 155 Nail Enamel : 9 ml,Jewelry & Watches,Fine Jewelry,175,175,1,,,,,,,
Faces Canada Magneteyes Kajal - Brown Comfort : 0.30 gms,Electronics,Computer Accessories,329,329,1,,,,,,,
Renee Very Matte Lipsticks : 4x1.6 g,Personal Care,Beauty & Grooming,750,750,1,,,,,,,
Insight Shiny Waterproof Eyeliner - Black : 5 ml,Personal Care,Beauty & Grooming,135,135,1,,,,,,,
Lakme Eyeconic Liner Pen Block Tip : 1 ml,Industrial & Scientific,Industrial Tools,550,550,1,,,,,,,
Faces Canada Magneteyes Kajal - Blue Motivation : 0.30 gms,Jewelry & Watches,Watches,270,270,1,,,,,,,
Faces Canada Fresh Eyes Kajal - Intense Black : 0.35 gm,Personal Care,Beauty & Grooming,325,325,1,,,,,,,
Faces Canada Longwear Eye Pencil - Solid Black : 1.2 gms,Jewelry & Watches,Watches,449,449,1,,,,,,,
Lakme Cushion Matte Lipstick - Red Blaze : 4.5 gms,Fashion & Accessories,Footwear,750,750,1,,,,,,,
Lakme Eyeconic Curling Mascara - Black : 9 ml,Personal Care,Beauty & Grooming,115,115,1,,,,,,,
Insight Ultra-Thin Foundation - 03 Sunbeige : 20 ml,Sports & Fitness,Sports Accessories,180,180,1,,,,,,,
Blue Heaven True Matte Lipstick Combo : 4 Unit,Jewelry & Watches,Fine Jewelry,299,299,1,,,,,,,
Renee Fab 3 in 1 Highlighter : 4.5 gms,Party & Events,Party Supplies,125,125,1,,,,,,,
Lakme Eyeconic Kajal - Turquoise : 0.35 gm,Garden & Outdoor,Outdoor Living,250,250,1,,,,,,,
Maybelline New York Fit Me Liquid Foundation - 310 : 30 ml,Sports & Fitness,Sports Accessories,99,99,1,,,,,,,
Insight Cosmetics Beauty Blender Sponge Applicator - Pink : 1 Unit,Personal Care,Beauty & Grooming,599,599,1,,,,,,,
Blue Heaven Saubhagya Liquid Sindoor Matte Finish - Maroon : 7 ml,Home & Living,Kitchen & Dining,199,199,1,,,,,,,
Blue Heaven Gentle Nail Paint Remover : 125 ml,Home & Living,Home Improvement,115,115,1,,,,,,,
Lotus Make-Up Xpress Glow 10-In-1 Daily Beauty Creme : 30 gms,Personal Care,Beauty & Grooming,269,269,1,,,,,,,
Lakme Forever Matte Liquid Lip Colour - Red Wine : 5.6 ml,Sports & Fitness,Sports Accessories,225,225,1,,,,,,,
Renee See Me Shine Lip Gloss - Pucker Up Peach : 2.5 ml,Personal Care,Beauty & Grooming,280,280,1,,,,,,,
Lotus Make-Up Xpress Glow 10-in-1 Beauty Cream SPF 25 : 30 gms,Personal Care,Beauty & Grooming,210,210,1,,,,,,,
Renee Summer Slush Jelly Tint - Tempting Grape : 13 gms,Grocery & Food,Pantry Essentials,80,80,1,,,,,,,
Lakme Cushion Matte Lipstick - Brown Sugar : 4.5 gms,Sports & Fitness,Sports Accessories,295,295,1,,,,,,,
Lakme Lip Love Chapstick - Strawberry : 4.5 gms,Grocery & Food,Snacks & Beverages,110,110,1,,,,,,,
Insight Nail Polish - Color 215 : 9 ml,Jewelry & Watches,Fine Jewelry,750,750,1,,,,,,,
Blue Heaven Long Lasting Make-Up Fixer : 60 ml,Toys & Games,Video Games,375,375,1,,,,,,,
Blue Heaven Flawless Make-up Base Primer : 30 gms,Electronics,Entertainment,479,479,1,,,,,,,
Blue Heaven Mighty Weightless Liquid Bridesmaid Nude : 4 Unit,Jewelry & Watches,Fine Jewelry,599,599,1,,,,,,,
Lotus Make-Up Ecostay Insta-Smooth Perfecting Primer : 30 gms,Garden & Outdoor,Gardening,349,349,1,,,,,,,
Blue Heaven Flaw Finishing Compact - Powder Natural : 20 gms,Industrial & Scientific,Industrial Tools,299,299,1,,,,,,,
Insight Matte Lip Ink - Top Notch : 4 gms,Personal Care,Beauty & Grooming,249,249,1,,,,,,,
Renee Stay With Me Minis Matte Liquid Lipstick : 4 U,Personal Care,Beauty & Grooming,599,599,1,,,,,,,
Insight Hd Conceal - 04 Golden Sand : 8 gms,Electronics,Computer Accessories,125,125,1,,,,,,,
Lakme Eyebrow Pencil - Black : 1.2 gms,Industrial & Scientific,Lab & Scientific,550,550,1,,,,,,,
Faces Canada Mini Nail Enamel - Floral Dream : 5 ml,Jewelry & Watches,Fine Jewelry,249,249,1,,,,,,,
Color Fx New York Xprss Nail Polish - Elegance : 5ml x 2N,Jewelry & Watches,Fine Jewelry,225,225,1,,,,,,,
Nykaa Serial Kisser Lip Balm - Raspberry : 4.5 gms,Personal Care,Beauty & Grooming,399,399,1,,,,,,,
Insight HD Concealer - (CR-111) LN 10 : 9 gms,Electronics,Computers & Laptops,299,299,1,,,,,,,
Blue Heaven Pearl Glow Compact - Honey Medium : 9 gms,Smart Home,Smart Devices,499,499,1,,,,,,,
Blue Heaven 10X Volumising Mascara - Black : 8 ml,Personal Care,Beauty & Grooming,230,230,1,,,,,,,
Lotus Make-Up Colorkick Kajal : 0.28 gms,Fashion & Accessories,Footwear,500,500,1,,,,,,,
Blue Heaven Instant Nail Paint Remover : 28 ml,Home & Living,Home Improvement,750,750,1,,,,,,,
Lakme 9to5 Primer + Matte Liquid Lip Color - MB3 Strong Espresso : 4.2 ml,Smart Home,Smart Devices,325,325,1,,,,,,,
Faces Canada Berry Blush - Hop To Beach : 4 gms,Party & Events,Party Supplies,649,649,1,,,,,,,
Renee Fab Face Nude : 4.5 gms,Personal Care,Baby Care,130,130,1,,,,,,,
Faces Canada Magneteyes Kajal - Burgundy Love : 0.30 gms,Jewelry & Watches,Watches,75,75,1,,,,,,,
Blue Heaven Oil Infused Make-Up Remover : 125 ml,Personal Care,Beauty & Grooming,135,135,1,,,,,,,
Insight Hd Conceal - 01 Sun Beige : 8 gms,Electronics,Computers & Laptops,390,390,1,,,,,,,
Blue Heaven 2X Intense Kajal - Green Queen :0.30 gms,Grocery & Food,Fresh Produce,399,399,1,,,,,,,
Insight Mega Last Crayon Lipstick - Taming Anger (22) : 1.3 gms,Personal Care,Beauty & Grooming,350,350,1,,,,,,,
Lakme Absolute Matte Melt Liquid Lip Color - Nude Sensation : 6 ml,Personal Care,Beauty & Grooming,390,390,1,,,,,,,
Maybelline New York Superstay Vinyl Ink Liquid Lipstick Witty : 4.2 ml,Personal Care,Beauty & Grooming,399,399,1,,,,,,,
Color Fx Perfect Pastel Bumble Bee Yellow 164 Nail Enamel : 9 ml,Jewelry & Watches,Fine Jewelry,299,299,1,,,,,,,
Color Fx Perfect Stay 119 Nail Enamel Glossy : 9 ml,Jewelry & Watches,Fine Jewelry,249,249,1,,,,,,,
Faces Canada Ultime Pro HD Concealer - Sand Beige : 3.8 ml,Electronics,Computer Accessories,80,80,1,,,,,,,
Blue Heaven Get Bold Eyeliner - Black Diamond : 7 ml,Jewelry & Watches,Fine Jewelry,190,190,1,,,,,,,
