name,category,subcategory,mrp,our_price,quantity,status,stock_count,productid,imageurl,createdat,updatedat,details
"Vega Insta Glam Hair Dryer (1000 W, VHDH-20)",Fashion & Accessories,Footwear,315,,1,,,,,,,
beatXP Gravity Prism Digital Weighing Scale (Blue),Sports & Fitness,Exercise & Fitness,540,,1,,,,,,,
Solara Electric Kettle (1500 W),Electronics,Home Appliances,390,,1,,,,,,,
Black + Decker Steam Iron 1600W (Red),Industrial & Scientific,Industrial Tools,262,,1,,,,,,,
Prestige Pic 20.0 Induction Cooktop (Black),Garden & Outdoor,Outdoor Living,311,,1,,,,,,,
Borosil Chef Delite 300-W Electric Chopper,Electronics,Home Appliances,439,,1,,,,,,,
Black + Decker Cordless Steam Iron 2200W (Green),Sports & Fitness,Sports Accessories,351,,1,,,,,,,
Havells D'zire Dry Iron 1000 W (Mint),Sports & Fitness,Sports Accessories,743,,1,,,,,,,
Philips Multi Grooming 7 in 1 Trimmer Kit (White),Fashion & Accessories,Footwear,338,,1,,,,,,,
Borosil Chefdelite Electric Chopper 260W (White),Garden & Outdoor,Outdoor Living,176,,1,,,,,,,
"Vega 3-In-1 Hair Styler (55 W, VHSCC-01)",Jewelry & Watches,Watches,192,,1,,,,,,,
beatXP PulsePod Mini Handheld Vibration Massager for Head & Neck,Electronics,Audio Devices,480,,1,,,,,,,
"Philips 2-Slice Pop Up Toaster (830 W, White)",Smart Home,Home Automation,525,,1,,,,,,,
beatXP Blaze Electric Body Massager (Black),Personal Care,Health & Wellness,293,,1,,,,,,,
Agaro Electric Hot Water Bag Grey,Sports & Fitness,Sports Accessories,808,,1,,,,,,,
beatXP Bolt Deep Tissue Massager Gun,Personal Care,Health & Wellness,479,,1,,,,,,,
﻿Moi Soi Veg Hakka Noodles,Grocery & Food,Meat & Seafood,225,,1,,,,,,,
﻿KLF Nirmal Virgin Cold Pressed Coconut Hair Oil,Fashion & Accessories,Footwear,210,,1,,,,,,,
﻿101 Tales The Great Panchatantra Collection Of Witty Moral Stories,Books & Media,Books,1395,,1,,,,,,,
﻿Amazon Lite Fire TV Stick with Alexa Voice Remote Lite,Smart Home,Home Automation,235,,1,,,,,,,
﻿Kent Smart Chef Egg Boiler (360 W),Grocery & Food,Dairy & Eggs,800,,1,,,,,,,
Crax Pasta Crunch Chinese Tadka Crisps,Grocery & Food,Meat & Seafood,845,,1,,,,,,,
BRB Popped Potato Chips (Pasta Cheese Flavour) - Pack of 2,Grocery & Food,Bakery & Breakfast,369,,1,,,,,,,
Cheetos Flamin Hot Crunchy Crisps,Grocery & Food,Fresh Produce,248,,1,,,,,,,
RiteBite Max Protein Spanish Tomato Chips,Grocery & Food,Pantry Essentials,440,,1,,,,,,,
Lay's Maxx Sizzling Barbeque Potato Chips - Pack of 2,Garden & Outdoor,Outdoor Living,387,,1,,,,,,,
Yu 100% Whole Wheat Noodles,Grocery & Food,Meat & Seafood,300,,1,,,,,,,
Mama Rice Instant Vermicelli Noodles,Grocery & Food,Pantry Essentials,450,,1,,,,,,,
Manforce Epic Strawberry Flavoured Lubricant - Pack of 2,Sports & Fitness,Sports Accessories,277,,1,,,,,,,
Bold Care Topical Delay Wipes ClockStopper for Men,Personal Care,Baby Care,225,,1,,,,,,,
Skore Strawberry Dotted Condom - Pack of 3,Sports & Fitness,Sports Accessories,277,,1,,,,,,,
Plush Love Glove Multi Textured Condom - Pack of 2,Jewelry & Watches,Fine Jewelry,347,,1,,,,,,,
"The Week India - January 28, 2024",Fashion & Accessories,Footwear,277,,1,,,,,,,
"Open - 29th January, 2024",Party & Events,Event Planning,462,,1,,,,,,,
"The Caravan - January, 2024",Party & Events,Event Planning,380,,1,,,,,,,
Pedigree Dog Starter Kit - Dog Food & Treats,Pet Supplies,Dog Supplies,203,,1,,,,,,,
Kwality Walls Feast Cadbury Crackle Frozen Dessert Stick,Grocery & Food,Bakery & Breakfast,1150,,1,,,,,,,
Beyond Snack Peri Peri Kerala Banana Chips,Grocery & Food,Snacks & Beverages,1043,,1,,,,,,,
Bingo Original Style Salt Potato Chips,Grocery & Food,Snacks & Beverages,699,,1,,,,,,,
4700BC Cheese & Herbs Popped Corn Chips + - Pack of 2,Grocery & Food,Fresh Produce,225,,1,,,,,,,
Too Yumm Baked Potato Stix Crisps - Pack of 2,Grocery & Food,Bakery & Breakfast,372,,1,,,,,,,
Natureland Cold Pressed Organic Mustard Oil - Pack of 2,Garden & Outdoor,Gardening,507,,1,,,,,,,
"Maggi Rich Tomato Sauce (No Onion, No Garlic)",Grocery & Food,Fresh Produce,1104,,1,,,,,,,
Toyshine Unbreakable Automobile Car Toy Vehicle (4 - 8 years),Toys & Games,Kids Toys,95,,1,,,,,,,
Lift-The-Flap Very First Q&A: What is Poo?,Sports & Fitness,Sports Equipment,50,,1,,,,,,,
Lift-The-Flap Very First Questions And Answers:Why Should I Brush My Teeth?,Personal Care,Baby Care,34,,1,,,,,,,
"Kid Who Came From Space, The",Toys & Games,Kids Toys,760,,1,,,,,,,
Baby Touch-Peekaboo,Personal Care,Baby Care,50,,1,,,,,,,
Room On The Broom,Home & Living,Home Improvement,762,,1,,,,,,,
Baby Touch-Colours,Personal Care,Baby Care,285,,1,,,,,,,
Peppa Pig- Sticker Activity,Toys & Games,Games & Puzzles,623,,1,,,,,,,
"Unstoppable Us, Volume 1",Books & Media,Musical Instruments,235,,1,,,,,,,
Thea Stilton #05 Thea Stilton And The Mystery In Paris,Jewelry & Watches,Fine Jewelry,49,,1,,,,,,,
Tiger Who Came To Tea,Pet Supplies,Cat Supplies,376,,1,,,,,,,
Geronimo Stilton #40 The Karate Mouse,Fashion & Accessories,Footwear,180,,1,,,,,,,
Baby Touch-Vehicles,Personal Care,Baby Care,235,,1,,,,,,,
My Little Book Of Shiva,Books & Media,Books,198,,1,,,,,,,
Dog Man #01,Pet Supplies,Dog Supplies,470,,1,,,,,,,
Where'S Spot? (Spot - Original Lift The Flap),Sports & Fitness,Sports Equipment,760,,1,,,,,,,
ENN Glow Ghee Body Lotion,Personal Care,Beauty & Grooming,353,,1,,,,,,,
Parachute Advansed Deep Nourish Body Lotion - Pack of 2,Sports & Fitness,Sports Accessories,63,,1,,,,,,,
Parachute Advansed Deep Nourish Body Lotion (400 ml) - Pack of 2,Sports & Fitness,Sports Accessories,49,,1,,,,,,,
Infino Crispy Chocolate Espresso Ice Cream Stick - Pack of 3,Grocery & Food,Bakery & Breakfast,672,,1,,,,,,,
4700BC Salt & Truffle Popped Corn Chips + - Pack of 3,Grocery & Food,Fresh Produce,190,,1,,,,,,,
Desi Tomato Pack of 4 (Tamatar),Grocery & Food,Fresh Produce,672,,1,,,,,,,
Green Peas Pack of 4 (Matar),Grocery & Food,Fresh Produce,1135,,1,,,,,,,
Hybrid Tomato Pack of 4 (Tamatar),Grocery & Food,Fresh Produce,99,,1,,,,,,,
Lady Finger Pack of 3 (Bhindi),Jewelry & Watches,Fine Jewelry,1116,,1,,,,,,,
Corn Cob Pack of 3 (Bhutta),Garden & Outdoor,Outdoor Living,725,,1,,,,,,,
Onion (1 kg) + Potato - 1 kg + Hybrid Tomato -500 g Combo,Grocery & Food,Fresh Produce,725,,1,,,,,,,
Onion (1 kg) + Potato 1 kg + Desi Tomato - 500 g Combo,Grocery & Food,Fresh Produce,190,,1,,,,,,,
Spinach - Pack of 4 (Palak),Sports & Fitness,Sports Accessories,498,,1,,,,,,,
Amul Buffalo Milk,Grocery & Food,Dairy & Eggs,1182,,1,,,,,,,
Too Yumm Classic Salted Wafers Potato Chips - Buy 2 Get 1 Free,Grocery & Food,Bakery & Breakfast,672,,1,,,,,,,
Crax Corn Rings Masala Mania Crisps,Jewelry & Watches,Fine Jewelry,3400,,1,,,,,,,
Beyond Snack Desi Masala Kerala Banana Chips,Grocery & Food,Snacks & Beverages,2950,,1,,,,,,,
Crax Cheese Balls - Pack of 2,Party & Events,Party Supplies,1154,,1,,,,,,,
Pringles South African Peri Peri Chips - Pack of 2,Grocery & Food,Snacks & Beverages,4100,,1,,,,,,,
Pringles Tangy Tomato Twist Potato Chips - Pack of 2,Grocery & Food,Fresh Produce,304,,1,,,,,,,
Crax Simply Salted Potato Chips,Grocery & Food,Dairy & Eggs,260,,1,,,,,,,
Crax Creamy Onion Potato Chips,Grocery & Food,Dairy & Eggs,250,,1,,,,,,,
Peanut Gajak by Gulab Pack of 2,Grocery & Food,Snacks & Beverages,720,,1,,,,,,,
Kapiva Desi A2 Ghee (Cow),Grocery & Food,Meat & Seafood,735,,1,,,,,,,
Durex Naturals Lubricant,Industrial & Scientific,Industrial Tools,750,,1,,,,,,,
Azah Groove Personal Massager,Personal Care,Health & Wellness,260,,1,,,,,,,
Manforce XTASY Dotted Condom (Black Grapes Flavour),Jewelry & Watches,Fine Jewelry,950,,1,,,,,,,
Skore Skin Thin Condom - Pack of 2,Sports & Fitness,Sports Accessories,1898,,1,,,,,,,
"Toyshine Transform Robot Racing Car (Blue, 3+ years)",Toys & Games,Kids Toys,725,,1,,,,,,,
"Toyshine Transform Robot Racing Car (Red, 3+ years)",Toys & Games,Kids Toys,1380,,1,,,,,,,
Colouring Book Of Shapes,Toys & Games,Kids Toys,1605,,1,,,,,,,
Peep Inside The Garden,Garden & Outdoor,Gardening,180,,1,,,,,,,
Peppa Pig- Going On Holiday,Party & Events,Event Planning,3700,,1,,,,,,,
My First Sudha Murty Collection,Sports & Fitness,Sports Accessories,250,,1,,,,,,,
IAMS Proactive Health Dog Dry Food (Adult and Large Breed),Pet Supplies,Dog Supplies,696,,1,,,,,,,
IAMS Proactive Health Dog Dry Food (Small and Medium Breed),Pet Supplies,Dog Supplies,250,,1,,,,,,,
BRB Popped Potato Chips (Spicy Chipotle Flavour),Grocery & Food,Bakery & Breakfast,840,,1,,,,,,,
BRB Peri Peri Rice Popped Chips,Grocery & Food,Snacks & Beverages,196,,1,,,,,,,
BRB Classic Salted Rice Popped Chips,Grocery & Food,Snacks & Beverages,1620,,1,,,,,,,
BRB Popped Potato Chips (Bhel Flavour),Grocery & Food,Snacks & Beverages,1700,,1,,,,,,,
BRB Popped Potato Chips (Salt & Pepper Flavour),Grocery & Food,Snacks & Beverages,1399,,1,,,,,,,
BRB Popped Potato Chips (Pasta Cheese Flavour),Grocery & Food,Bakery & Breakfast,506,,1,,,,,,,
Nissin Geki - Hot & Spicy Korean Veg Flavoured Instant Noodles,Grocery & Food,Meat & Seafood,85,,1,,,,,,,
Nissin Mazedar Masala Cup Noodles,Grocery & Food,Pantry Essentials,152,,1,,,,,,,
Nissin Veggi Manchow Cup Noodles,Grocery & Food,Meat & Seafood,105,,1,,,,,,,
Nissin Geki - Hot & Spicy Korean Chicken Flavoured Instant Noodles,Grocery & Food,Meat & Seafood,477,,1,,,,,,,
﻿Nissin Geki Hot & Spicy Korean Veg Flavoured Instant Noodles,Grocery & Food,Meat & Seafood,70,,1,,,,,,,
Nissin Spiced Chicken Cup Noodles,Grocery & Food,Meat & Seafood,190,,1,,,,,,,
Moi Soi Veg Long Hakka Noodles - Pack of 3,Grocery & Food,Meat & Seafood,351,,1,,,,,,,
﻿My First Transport Sticker Book,Sports & Fitness,Sports Accessories,375,,1,,,,,,,
Morphy Richards Stylist Care Hair Dryer (2200 W  HD222DC),Personal Care,Beauty & Grooming,336,,1,,,,,,,
Philips ‎250W Hand Blender,Industrial & Scientific,Industrial Tools,327,,1,,,,,,,
Potato - New Crop + Desi Tomato + Onion 1 kg Combo,Grocery & Food,Fresh Produce,400,,1,,,,,,,
Onion - 1 kg + Potato 1 kg + Hybrid Tomato Combo,Grocery & Food,Fresh Produce,475,,1,,,,,,,
Onion - 1 kg + Potato - 1 kg + Desi Tomato Combo,Grocery & Food,Fresh Produce,182,,1,,,,,,,
Girnar Masala Instant Tea Premix - Pack of 2,Grocery & Food,Pantry Essentials,144,,1,,,,,,,
Oreo Moments Assorted Biscuits Gift Pack - Pack of 2,Grocery & Food,Bakery & Breakfast,240,,1,,,,,,,
Fusion Baklava by Oasis Baklawa Pack of 2,Garden & Outdoor,Outdoor Living,63,,1,,,,,,,
Baklava by Oasis Baklawa Pack of 2,Garden & Outdoor,Outdoor Living,435,,1,,,,,,,
24 Mantra 7 Grain Organic Atta - Pack of 2,Grocery & Food,Fresh Produce,134,,1,,,,,,,
Durex Extra Time Condom (3 Pieces),Personal Care,Health & Wellness,165,,1,,,,,,,
Malgudi Adventures,Toys & Games,Games & Puzzles,360,,1,,,,,,,
Ladybird Big Noisy Book,Books & Media,Books,418,,1,,,,,,,
"The Gruffalo A Push, Pull and Slide Book",Books & Media,Books,77,,1,,,,,,,
Peppa Pig- Bedtime Little Library,Pet Supplies,Cat Supplies,415,,1,,,,,,,
My Little Book Of Krishna,Books & Media,Books,143,,1,,,,,,,
Dog Man #05,Pet Supplies,Dog Supplies,299,,1,,,,,,,
Dog Man #10,Pet Supplies,Dog Supplies,141,,1,,,,,,,
Dog Man #04,Pet Supplies,Dog Supplies,215,,1,,,,,,,
Sugarlump And The Unicorn,Jewelry & Watches,Fine Jewelry,204,,1,,,,,,,
Peppa Pig,Grocery & Food,Meat & Seafood,294,,1,,,,,,,
"BW Businessworld - 27th January, 2024",Jewelry & Watches,Watches,380,,1,,,,,,,
Plum BodyLovin' Orchid You Not Shower Gel - Pack of 2,Sports & Fitness,Sports Accessories,142,,1,,,,,,,
Philips Classic Dry Iron 750 W (Peach),Electronics,Home Appliances,418,,1,,,,,,,
Godrej Aer Morning Misty Meadows Air Freshener,Garden & Outdoor,Gardening,128,,1,,,,,,,
Godrej Aer Cool Surf Blue Room Freshener,Sports & Fitness,Sports Equipment,180,,1,,,,,,,
﻿Yu Zingy Cheese Instant Cup Noodles (80 g),Grocery & Food,Meat & Seafood,128,,1,,,,,,,
﻿Anveshan Wood Cold Pressed Groundnut Oil,Fashion & Accessories,Footwear,475,,1,,,,,,,
﻿Baby Touch-Vehicles,Personal Care,Baby Care,285,,1,,,,,,,
"﻿""Philips 50 Watts Hair Straightener (With Keratin-Infused Bristles  Black)""",Personal Care,Beauty & Grooming,196,,1,,,,,,,
Beyond Snack Salt & Black Pepper Kerala Banana Chips,Grocery & Food,Snacks & Beverages,149,,1,,,,,,,
BRB Classic Salted Rice Popped Chips - Pack of 2,Grocery & Food,Snacks & Beverages,292,,1,,,,,,,
The Lion Inside,Pet Supplies,Cat Supplies,233,,1,,,,,,,
Kimirica How Holiday Smells Tucuma Butter Hand Cream,Grocery & Food,Bakery & Breakfast,475,,1,,,,,,,
Go Zero Nostalgia Mango Duet Ice Cream Stick,Grocery & Food,Frozen & Ice Cream,264,,1,,,,,,,
Go Zero Nostalgia Raspberry Duet Ice Cream Stick,Grocery & Food,Frozen & Ice Cream,97,,1,,,,,,,
Airveda Air Quality Monitor (10 W),Smart Home,Smart Devices,473,,1,,,,,,,
"Prestige Sandwich Maker - (800 W, Black)",Grocery & Food,Meat & Seafood,180,,1,,,,,,,
﻿Samyang Ramen Instant Noodles - Kimchi,Grocery & Food,Meat & Seafood,1520,,1,,,,,,,
﻿Durex Skin-on-Skin Real Feel Condom (3 pieces),Personal Care,Health & Wellness,135,,1,,,,,,,
﻿Fabessentials Lavender Coconut Organic Handmade Bathing Bar,Sports & Fitness,Sports Accessories,314,,1,,,,,,,
﻿CamPure Lavender Cone Camphor / Kapur,Garden & Outdoor,Gardening,401,,1,,,,,,,
﻿MasterChow Instant Cup Noodles (Chowmein Flavour),Grocery & Food,Meat & Seafood,490,,1,,,,,,,
﻿Raag Gold Palmolein Oil,Fashion & Accessories,Footwear,499,,1,,,,,,,
﻿Pandit Vishnu Sharma'S Panchatantra,Grocery & Food,Snacks & Beverages,292,,1,,,,,,,
"﻿""Havells Men's Grooming Kit (Grey  GS6532)""",Fashion & Accessories,Men's Fashion,600,,1,,,,,,,
4700BC Cheese & Herbs Popped Corn Chips +,Grocery & Food,Fresh Produce,137,,1,,,,,,,
4700BC Hawaiian Barbeque Popped Corn Chips + - Pack of 2,Garden & Outdoor,Outdoor Living,279,,1,,,,,,,
4700BC Cheese & Herbs Corn Popped Chips + - Pack of 2,Grocery & Food,Fresh Produce,296,,1,,,,,,,
Tagz Beer n Barbeque Potato Popped Chips,Garden & Outdoor,Outdoor Living,117,,1,,,,,,,
Tagz Masala Trekkin Potato Popped Chips,Grocery & Food,Snacks & Beverages,145,,1,,,,,,,
4700BC Hawaiian Barbeque Corn Popped Chips + - Pack of 3,Garden & Outdoor,Outdoor Living,131,,1,,,,,,,
4700BC Salt & Truffle Corn Popped Chips + - Pack of 3,Grocery & Food,Fresh Produce,97,,1,,,,,,,
Kaju Katli by Amul Pack of 2,Fashion & Accessories,Women's Fashion,175,,1,,,,,,,
Gulab Goodness Cold Pressed Sesame Oil,Grocery & Food,Dairy & Eggs,232,,1,,,,,,,
Centy Toys Dhruv Helicopter Toy Vehicle (3+ years),Toys & Games,Kids Toys,274,,1,,,,,,,
"The Week India - February 04, 2024",Fashion & Accessories,Footwear,264,,1,,,,,,,
"Open - 05th February, 2024",Party & Events,Event Planning,221,,1,,,,,,,
ZM Zayn & Myza Vitamin C Soap,Personal Care,Baby Care,175,,1,,,,,,,
ZM Zayn & Myza Tea Tree Body Lotion,Garden & Outdoor,Gardening,235,,1,,,,,,,
Lifelong Electric Foot Massager (Brown),Fashion & Accessories,Footwear,212,,1,,,,,,,
Mother Dairy Dairy Ultimate Sandwich Bread + Dairy Toned Fresh Milk Combo,Grocery & Food,Dairy & Eggs,264,,1,,,,,,,
Mother Dairy Dairy 100% Whole Wheat Bread + Dairy Toned Fresh Milk Combo,Grocery & Food,Dairy & Eggs,399,,1,,,,,,,
Mother Dairy Ultimate Brown Bread + Mother Dairy Toned Fresh Milk Combo,Grocery & Food,Dairy & Eggs,297,,1,,,,,,,
Beyond Snack Kerala Original Style Banana Chips,Grocery & Food,Snacks & Beverages,295,,1,,,,,,,
Let's Try Aloo Chips,Toys & Games,Games & Puzzles,324,,1,,,,,,,
Beyond Snack Kerala Peri Peri Banana Chips,Grocery & Food,Snacks & Beverages,813,,1,,,,,,,
Gulab Mota Chips / Aloo Chips,Grocery & Food,Snacks & Beverages,645,,1,,,,,,,
Beyond Snack Original Style Kerala Banana Chips,Grocery & Food,Snacks & Beverages,128,,1,,,,,,,
Chheda's Golden Aloo Chips (Lightly Salted),Grocery & Food,Snacks & Beverages,252,,1,,,,,,,
"Beyond Snack Kerala Sour Cream, Onion & Parsley Banana Chips",Grocery & Food,Snacks & Beverages,301,,1,,,,,,,
BRB Popped Potato Chips (Spicy Chipotle Flavour) - Pack of 2,Grocery & Food,Snacks & Beverages,184,,1,,,,,,,
Let's Try Pudina Potato Wafers - Pack of 2,Sports & Fitness,Sports Equipment,1188,,1,,,,,,,
Beyond Snack Hot and Sweet Chilli Kerala Banana Chips,Grocery & Food,Snacks & Beverages,544,,1,,,,,,,
Let's Try Desi Spicy Wafers - Pack of 2,Grocery & Food,Meat & Seafood,526,,1,,,,,,,
Crax Fritts Corn & Potato Stick - Pack of 2,Grocery & Food,Dairy & Eggs,526,,1,,,,,,,
Bingo Cream & Onion Potato Chips,Grocery & Food,Bakery & Breakfast,526,,1,,,,,,,
To Be Honest Golden Sweet Potato Chips with Peri Peri - Pack of 2,Grocery & Food,Snacks & Beverages,440,,1,,,,,,,
Sunfeast Yipee Instant Pasta Treat - Masala + Bingo Baked No Rulz Masala Curlz Puffs Combo,Grocery & Food,Bakery & Breakfast,554,,1,,,,,,,
Sunfeast Yippee Tricolor Instant Pasta - Creamy Corn + Bingo Tedhe Medhe Masala Tadka Crisps Combo,Grocery & Food,Bakery & Breakfast,200,,1,,,,,,,
Sunfeast Yippee Tricolor Instant Pasta - Masala + Bingo Mad Angles Achaari Masti Crisps Combo,Grocery & Food,Bakery & Breakfast,200,,1,,,,,,,
Too Yumm Baked Potato Stix Crisps,Grocery & Food,Bakery & Breakfast,273,,1,,,,,,,
Orion Turtle Spicy Devil Corn Chips + Orion Turtle Masala Corn Chips Combo,Party & Events,Party Supplies,1116,,1,,,,,,,
Orion Turtle Spicy Devil Corn Chips + Orion Turtle Mexican Lime Corn Chips Combo,Party & Events,Party Supplies,285,,1,,,,,,,
Orion Turtle Spicy Devil Corn Chips + Orion Turtle Sour Cream & Onion Corn Chips Combo,Party & Events,Party Supplies,370,,1,,,,,,,
Orion Turtle Spicy Devil Corn Chips + Orion Turtle Tangy Tomato Corn Chips Combo,Party & Events,Party Supplies,383,,1,,,,,,,
Taali Cheese & Herbs Protein Puffs + Taali Masala Mania Protein Puffs Combo,Grocery & Food,Pantry Essentials,778,,1,,,,,,,
Taali Cheese & Herbs Protein Puffs + Taali Smoky Barbeque Protein Puffs Combo,Grocery & Food,Pantry Essentials,418,,1,,,,,,,
"Beyond Snack Kerala Original Style Banana Chips + Peri Peri Banana Chips + Sour Cream, Onion & Parsley Banana Chips Combo",Grocery & Food,Snacks & Beverages,842,,1,,,,,,,
Sunfeast Yippee Tricolor Instant Pasta - Masala + Bingo Original Style Chilli Sprinkled Potato Chips Combo,Grocery & Food,Bakery & Breakfast,320,,1,,,,,,,
Pringles Tangy Tomato Twist Potato Chips + Thums Up Soft Drink (750 ml) Combo,Grocery & Food,Snacks & Beverages,315,,1,,,,,,,
Tagz Italian Cheese Dribblin Popped Chips,Grocery & Food,Snacks & Beverages,743,,1,,,,,,,
Tagz Beer n Barbeque Campin Popped Chips,Garden & Outdoor,Outdoor Living,293,,1,,,,,,,
Tagz Cream Onion Divin Potato Popped Chips,Grocery & Food,Snacks & Beverages,479,,1,,,,,,,
Tagz Salt Trippin Potato Popped Chips,Grocery & Food,Snacks & Beverages,210,,1,,,,,,,
Tagz Thai Vodka Tom Yum Popped Chips,Party & Events,Party Supplies,1395,,1,,,,,,,
Wai Wai Chinese Hakka Veg Noodles - Pack of 2,Grocery & Food,Meat & Seafood,235,,1,,,,,,,
WickedGud Masala Instant Noodles,Grocery & Food,Meat & Seafood,445,,1,,,,,,,
Nongshim Stir Fry Shin Ramyun Noodles With Cheese - Pack of 2,Grocery & Food,Meat & Seafood,845,,1,,,,,,,
WickedGud Masala Flavoured Instant Noodles,Grocery & Food,Meat & Seafood,450,,1,,,,,,,
Rajgira Laddu /Cholai Laddu/ Amaranth Laddu by Gulab,Jewelry & Watches,Watches,225,,1,,,,,,,
Emami Healthy & Tasty Super Strong Kachchi Ghani Mustard Oil,Grocery & Food,Pantry Essentials,347,,1,,,,,,,
Kissan Tomato Ketchup (No Onion & Garlic) - Doy Pack,Grocery & Food,Fresh Produce,462,,1,,,,,,,
Kissan Sweet & Spicy Tomato Ketchup,Grocery & Food,Fresh Produce,380,,1,,,,,,,
Plush Strawberry Flavoured Lubricant (for Men & Women) - Pack of 3,Sports & Fitness,Sports Accessories,1242,,1,,,,,,,
Toyshine Cartoon Style Animals Toy Figure (1+ years),Toys & Games,Kids Toys,1150,,1,,,,,,,
Soulflower Pure & Natural Coldpressed Carrier Castor Oil for Hair and Skin,Personal Care,Beauty & Grooming,1043,,1,,,,,,,
Plum BodyLovin' Vanilla Vibes Shower Gel - Pack of 2,Sports & Fitness,Sports Accessories,699,,1,,,,,,,
Plum BodyLovin' Vanilla Vibes Body Wash,Personal Care,Beauty & Grooming,507,,1,,,,,,,
Baskin Robbins Almond & Caramel Ice Cream Stick - Pack of 2,Grocery & Food,Bakery & Breakfast,1197,,1,,,,,,,
Baskin Robbins Mississipi Mud Ice Cream Stick - Pack of 2,Grocery & Food,Bakery & Breakfast,230,,1,,,,,,,
Airveda Airveda Sky - PM2.5 PM10 App-Enabled Air Quality Monitor (10 W),Smart Home,Smart Devices,405,,1,,,,,,,
"Lifelong Belgian Waffle & Sandwich Maker (750 W, Black)",Grocery & Food,Bakery & Breakfast,153,,1,,,,,,,
Anchor Capton Ding Dong Bell (White),Smart Home,Smart Devices,162,,1,,,,,,,
Odonil Odonil Jasmine Fresh Room Freshener + Odonil Lavender Mist Room Freshener Combo,Garden & Outdoor,Gardening,225,,1,,,,,,,
Brodees TriColour Printed Round Neck T-Shirt : 42 Size,Party & Events,Party Supplies,134,,1,,,,,,,
Brodees TriColour Printed Round Neck T-Shirt : 40 Size,Party & Events,Party Supplies,495,,1,,,,,,,
Brodees TriColour Printed Round Neck T-Shirt : 44 Size,Party & Events,Party Supplies,285,,1,,,,,,,
No Fuss Men's Cotton Vest Sleeveless - 80 cm (S) : 2 Pieces,Fashion & Accessories,Men's Fashion,132,,1,,,,,,,
No Fuss Men's Cotton Vest Sleeveless - 85 cm (M) : 2 Pieces,Fashion & Accessories,Men's Fashion,293,,1,,,,,,,
No Fuss Men's Cotton Vest Sleeveless - 90 cm (L) : 2 Pieces,Fashion & Accessories,Men's Fashion,165,,1,,,,,,,
No Fuss Men's Cotton Vest Sleeveless - 95 cm (XL) : 2 Pieces,Fashion & Accessories,Men's Fashion,233,,1,,,,,,,
Macho Men's Metro Vest White RN - 80 cm (S) : 2 Pieces,Industrial & Scientific,Industrial Tools,404,,1,,,,,,,
Macho Men's Metro Vest White RN - 85 cm (M) : 2 Pieces,Industrial & Scientific,Industrial Tools,414,,1,,,,,,,
Macho Men's Metro Vest White RN - 90 cm (L) : 2 Pieces,Industrial & Scientific,Industrial Tools,251,,1,,,,,,,
Macho Men's Metro Vest White RN - 95 cm (XL) : 2 Pieces,Industrial & Scientific,Industrial Tools,413,,1,,,,,,,
VIP Bonus Premium Round Neck Cotton Men's Vest - 100cm (XXL): 2 Piece,Jewelry & Watches,Fine Jewelry,135,,1,,,,,,,
Rupa Frontline Round Neck Men's Vest - 80 cm (S) - White : 2 Piece,Fashion & Accessories,Men's Fashion,298,,1,,,,,,,
Dutch Harbor Men's Vest Rib Sleeveless - XL (95 cm) : 2 Pieces,Fashion & Accessories,Men's Fashion,532,,1,,,,,,,
VIP Array Round Neck Men's White Vest - 80cm (S): 2 Piece,Jewelry & Watches,Fine Jewelry,134,,1,,,,,,,
Rupa Frontline Round Neck Sleeve Men's Vest - 80 cm (S) - White : 2 Piece,Fashion & Accessories,Men's Fashion,622,,1,,,,,,,
Rupa Jon Round Neck Sleeve Men's Vest - 80 cm (S) - White: 3 Piece,Fashion & Accessories,Men's Fashion,345,,1,,,,,,,
Rupa Jon Folding Round Neck Sleeve Men's Vest - 80 cm (S) - White: 3 Piece,Fashion & Accessories,Men's Fashion,203,,1,,,,,,,
Rupa Jon Folding Round Neck Men's Vest - 80 cm (S) - White: 2 Piece,Fashion & Accessories,Men's Fashion,821,,1,,,,,,,
Rupa Frontline Xing Men's Vest - 85 cm (M) : 2 Pieces,Industrial & Scientific,Industrial Tools,352,,1,,,,,,,
Dutch Harbor Men's Vest Rib Sleeveless - S (80 cm) : 2 Pieces,Fashion & Accessories,Men's Fashion,428,,1,,,,,,,
Dutch Harbor Men's Vest Rib Sleeveless - M (85 cm) : 2 Pieces,Fashion & Accessories,Men's Fashion,220,,1,,,,,,,
Dutch Harbor Men's Vest Rib Sleeveless - L (90 cm) : 2 Pieces,Fashion & Accessories,Men's Fashion,212,,1,,,,,,,
Rupa Frontline Round Neck Men's Vest - 80 cm (S) - White: 3 Piece,Fashion & Accessories,Men's Fashion,280,,1,,,,,,,
Rupa Jon Round Neck Men's Vest - 80 cm (S) - White: 3 Piece,Fashion & Accessories,Men's Fashion,280,,1,,,,,,,
Macho Multicolour Brief Smart Cut - 80 cm (S) : 2 Pieces,Jewelry & Watches,Watches,180,,1,,,,,,,
Macho Multicolour Brief Smart Cut - 85 cm (M) : 2 Pieces,Industrial & Scientific,Industrial Tools,420,,1,,,,,,,
Macho Multicolour Brief Smart Cut - 90 cm (L) : 2 Pieces,Jewelry & Watches,Watches,380,,1,,,,,,,
Macho Multicolour Brief Smart Cut - 95 cm (XL) : 2 Pieces,Industrial & Scientific,Industrial Tools,800,,1,,,,,,,
Macho Multicolour Brief Smart Cut - 100 cm (XXL) : 2 Pieces,Jewelry & Watches,Fine Jewelry,500,,1,,,,,,,
VIP Frenchie Plus Men's Brief 100cm (XXL): 2 Piece,Fashion & Accessories,Men's Fashion,500,,1,,,,,,,
Rupa Frontline Colors Men's Trunk - 80 cm (S) - Blue & Wine : 2 Piece,Fashion & Accessories,Men's Fashion,99,,1,,,,,,,
VIP Punch Plain Men's Trunk - 80cm (S) - Assorted: 1 Piece,Fashion & Accessories,Men's Fashion,99,,1,,,,,,,
Macho Multicolour Intro Long Trunk - 80 cm (S) : 1 Piece,Fashion & Accessories,Footwear,99,,1,,,,,,,
Macho Multicolour Intro Long Trunk - 85 cm (M) : 1 Piece,Fashion & Accessories,Footwear,50,,1,,,,,,,
Macho Multicolour Intro Long Trunk - 90 cm (L) : 1 Piece,Fashion & Accessories,Footwear,80,,1,,,,,,,
Macho Multicolour Intro Long Trunk - 100 cm (XXL) : 1 Piece,Fashion & Accessories,Footwear,117,,1,,,,,,,
VIP Elements Men's Trunk - 80cm (S) - Assorted: 2 Piece,Fashion & Accessories,Men's Fashion,50,,1,,,,,,,
Rupa Frontline Colors Men's Trunk - 80 cm (S) - Teal Green & Brown : 2 Piece,Fashion & Accessories,Footwear,117,,1,,,,,,,
VIP Brando Plain Trunk - 80cm (S) - Assorted: 1 Piece,Sports & Fitness,Sports Accessories,99,,1,,,,,,,
Macho Printed Mini Men's Trunk - 85 cm (M) : 1 Piece,Industrial & Scientific,Industrial Tools,90,,1,,,,,,,
Macho Printed Mini Men's Trunk - 90 cm (L) : 1 Piece,Industrial & Scientific,Industrial Tools,90,,1,,,,,,,
Macho Printed Mini Men's Trunk - 95 cm (XL) : 1 Piece,Industrial & Scientific,Industrial Tools,64,,1,,,,,,,
Rupa Frontline Colors Men's Brief - 80 cm (S) - Blue & Olive Green : 2 Piece,Fashion & Accessories,Men's Fashion,80,,1,,,,,,,
Rupa Frontline Colors Men's Trunk - 80 cm (S) - Blue & Black : 2 Piece,Fashion & Accessories,Men's Fashion,64,,1,,,,,,,
Rupa Frontline Colors Men's Brief - 80 cm (S) - Teal Green & Brown : 2 Piece,Fashion & Accessories,Footwear,96,,1,,,,,,,
Rupa Frontline DRAW Men's Trunk - 85 cm (M) : 1 Piece,Fashion & Accessories,Footwear,140,,1,,,,,,,
Rupa Frontline DRAW Men's Trunk - 90 cm (L) : 1 Piece,Fashion & Accessories,Footwear,140,,1,,,,,,,
VIP Advanta White Men's Trunk - 80cm (S) - Assorted: 1 Piece,Fashion & Accessories,Men's Fashion,140,,1,,,,,,,
Rupa Jon Obama Men's Brief - 80 cm (S) : 3 Piece,Toys & Games,Games & Puzzles,80,,1,,,,,,,
Rupa Frontline Expando Men's Brief - 85 cm (M) : 2 Pieces,Fashion & Accessories,Footwear,160,,1,,,,,,,
