name,category,subcategory,mrp,dmart_price,unit
Fabrique Orchid Floral Cushion Cover - Multicolour (40x40 cm) Set of 5 : 1 Unit,Personal Care & Beauty,oral,,550.0,
Fabrique Floral Embroidered Cushion Cover (Cream) - 40x40 cm : 1 Unit,Personal Care & Beauty,oral,,250.0,
Fabrique Royal Floral Cushion Cover (Maroon) - 40x40 cm : 1 Unit,Personal Care & Beauty,oral,,120.0,
Fabrique Sparkle Floral Cushion Cover (Beige) - 40x40 cm : 1 Unit,Personal Care & Beauty,oral,,150.0,
Fabrique Sparkle Floral Cushion Cover (Wine) - 40 x 40 cm : 1 Unit,Personal Care & Beauty,oral,,150.0,
Fabrique Sparkle Floral Cushion Cover (Beige) - 40 x 40 cm : 1 Unit,Personal Care & Beauty,oral,,150.0,
Fabrique Sparkle Floral Cushion Cover (Brown) - 40 x 40 cm : 1 Unit,Personal Care & Beauty,oral,,150.0,
