name,category,subcategory,mrp,dmart_price,unit
Amul Spray Milk Powder : 1 kg,Uncategorized,,,455,1 kg
Aditi Toys Mini Doctor Set With Case - Assorted : 1 Unit,Uncategorized,,,455,
Toyshine Junior Fast Sling Hockey Puck Board Game - Multicolour : 1 Unit,Bags & Accessories,sling,,455,
Toyshine Projection Flashlight Torch For Kids 3 Slides - Multicolour : 1 Unit,Lighting & Electrical,light,,455,
Toyshine 2 In 1 Ring Toss Games - Multicolour : 1 Unit,Uncategorized,,,455,
Toyshine Rolling & Flipping Car Ramp Racing - Multicolour : 1 Unit,Uncategorized,,,455,
Toyshine Educational 8.5 Inch LCD Writing Tablet Board - Multicolour : 1Unit,Pet Supplies,cat,,455,
Toyshine Wooden Angle Geometric Block Puzzle Set - Multicolour : 1 Unit,Uncategorized,,,455,
Toyshine Cartoon Wild Animals - Multicolour : Pack Of 12,Uncategorized,,,455,
Toyshine Kids Apple Shape Kids Computer Tablet - Multicolour : 1 Unit,Uncategorized,,,455,
Toyshine Creative Sand For Kid With 12 Play Molds - Natural : 1 Kg,Uncategorized,,,455,1 Kg
Toyshine Plastic Kitchen Cooking Set Toys - Yellow : 1 Unit,Home Decor,kitchen,,455,
Toyshine Monster Truck Toy For Kids -Multicolour : Pack Of 4,Uncategorized,,,455,
Toyshine Talking Tom Cat Toy For Kids - Grey : 1 Unit,Pet Supplies,cat,,455,
Toyshine Kids Friction Powered Car - Multicolour : Pack of 4,Uncategorized,,,455,
Toyshine Wooden 12 Colour Dominos Blocks Kids Game - Multicolour : 1 Unit,Uncategorized,,,455,
Toyshine Friction Rock Crawler Mini Car - Multicolour : 1 Unit,Uncategorized,,,455,
Aditi Toys Mini Beauty Set With Case - Assorted : 1 Unit,Personal Care & Beauty,beauty,,455,
Toyshine 2 in 1 Baby Piano Xylophone Toy for Toddlers - Multicolour : 1Unit,Uncategorized,,,455,
Bokai Badminton Racket Set : 2 Pieces,Home Utility & Organisers,rack,,455,2 Pc
Toyshine Concept Musical & 3D Lights Transparent Car - Multicolour : 1 Unit,Lighting & Electrical,light,,455,
Toyshine Gizmo Foam Blaster Gun Toy 20 Bullets - Multicolour : 1 Unit,Uncategorized,,,455,
Table Tennis Racket Set : 1 Unit,Home Utility & Organisers,rack,,455,
Toyshine Kids Shape Sorter Baby Toy - Multicolour : 1 Unit,Uncategorized,,,455,
Parksons Snake & Ladder & Ludo 2 In 1 Board Game: 1 Unit,Uncategorized,,,455,
Aditi Toys Fruit Set of 7 pieces - Multicolor : 1 Unit,Uncategorized,,,455,
Toyshine Plastic Archery Bow and Arrows For Kids - Red  : 1 Unit,Uncategorized,,,455,
Parksons Housie Board Game: 1 Unit,Uncategorized,,,455,
Toyshine High Stability Cube -  Multicolour : 1 Unit,Uncategorized,,,455,
DSports Basketball - Orange (Size 7) : 1 Unit,Uncategorized,,,455,
Toyshine Kids Doctor Set - Blue : 1 Unit,Uncategorized,,,455,
Parksons Chess Board Game: 1 Unit,Uncategorized,,,455,
Toyshine Sun Shape Drum Keyboard Musical Toy - Multicolour : 1 Unit,Uncategorized,,,455,
Toyshine Foam Blaster Gun For Kids - Multicolour : 1 Unit,Uncategorized,,,455,
Funskool Giggles Army Jeep Toy : 1 Unit,Uncategorized,,,455,
Parksons Plastic Playing Cards Black Box Premium: 1 Unit,Uncategorized,,,455,
Toyshine Rattle Set With Teathers For Newborn Babies - Multicolour : 1Unit,Uncategorized,,,455,
Football Kick-Off (Size 5) - Assorted : 1 Unit,Uncategorized,,,455,
Toyshine Kids Football - Orange (Size-3) : 1 Unit,Uncategorized,,,455,
DSports Basketball - Assorted (Size 3) : 1 Unit,Uncategorized,,,455,
Tennis Light Ball : 1 Unit,Lighting & Electrical,light,,455,
Toyshine 5 Layer Plastic Stack For Kids - Multicolour : 1 Unit,Uncategorized,,,455,
Parksons Business Board Game: 1 Unit,Uncategorized,,,455,
Parksons Picnic Board Game: 1 Unit,Uncategorized,,,455,
Parksons Playing Cards Plastic Coated Meredian 555 Gold Premium: 1 Unit,Uncategorized,,,455,
Parksons Bicycle Standard 808 Gold Playing Cards - Red Or Blue: 1 Unit,Uncategorized,,,455,
Dimpy Teddy Promo Soft Toy - 40 cms : 1 Unit,Uncategorized,,,455,
Dimpy Elephant Super Soft Toy - 20 cms : 1 Unit,Uncategorized,,,455,
Parksons Colour Addict: 1 Unit,Uncategorized,,,455,