Title,Category,Subcategory,MRP,DMart Price,Discount,Quantity,Unit Price,Product URL,Is DMart Exclusive
Himalaya Purifying Neem Face Wash : 200 ml,Uncategorized,,325.0,325.0,163.0,200 ml,0.81,./personalcarebeauty_files/MAY140000394xx12MAY23_5_P.jpg,False
Ayurmix Neem Face Wash : 200 ml,Uncategorized,,160.0,160.0,61.0,200 ml,0.49,./personalcarebeauty_files/MAR140005565xx27MAR24_5_P.jpg,True
Cetaphil Gentle Skin Cleanser : 500 ml,Uncategorized,,1049.0,1049.0,113.0,500 ml,1.87,./personalcarebeauty_files/MAR140005503xx5MAR24_5_P.jpg,False
Pond's Bright Beauty Spot-Less Glow Facewash : 200 gms,Gardening,pot,452.0,452.0,234.0,200 g,1.09,./personalcarebeauty_files/JUL140001199xx23JUL24_5_P.jpg,False
Clean & Clear Foaming Facewash : 240 ml,Uncategorized,,430.0,430.0,215.0,240 ml,0.9,./personalcarebeauty_files/MAR140003491xx19MAR23_5_P.jpg,False
Cetaphil Oily Skin Cleanser : 125 ml,Uncategorized,,649.0,649.0,167.0,125 ml,3.86,./personalcarebeauty_files/OCT140004355xx14OCT22_5_P.jpg,False
Everyuth Naturals Brightening Lemon & Cherry Face Wash : 150 gms,Uncategorized,,205.0,205.0,79.0,150 g,0.84,./personalcarebeauty_files/KFACEWASH150gmEVUT58xx070621_5_P.jpg,False
Garnier Bright Complete Face Wash - Lemon : 100 gms,Uncategorized,,209.0,209.0,15.0,100 g,1.94,./personalcarebeauty_files/IFaceWash100gGNR855xx26621_4_P.jpg,False
Garnier Bright Complete Vitamin C Face Wash : 150 g,Uncategorized,,349.0,349.0,175.0,150 g,1.16,./personalcarebeauty_files/MAR140004589xx17MAR23_5_P.jpg,False
Skin Fx Superfood Coffee Shot Anti Acne Foaming Face Wash : 100 ml,Uncategorized,,299.0,299.0,250.0,100 ml,0.49,./personalcarebeauty_files/MAR140005536xx20MAR24_5_P.jpg,False
Ayurmix Purifying Neem Face Wash : 150 ml,Uncategorized,,130.0,130.0,65.0,150 ml,0.43,./personalcarebeauty_files/JAN140003023xx19JAN24_5_P.jpg,True
Nivea Milk Delight Saffron Face Wash : 100 ml,Lighting & Electrical,light,230.0,230.0,74.0,100 ml,1.56,./personalcarebeauty_files/JAN140002183xx28JAN22_5_P.jpg,False
The Face Shop Rice Water Bright Foaming Cleanser : 150 Ml,Uncategorized,,899.0,899.0,405.0,150 ml,3.29,./personalcarebeauty_files/DEC140005374xx27DEC23_5_P.jpg,False
Clean & Clear Morning Energy Berry Face Wash : 150 ml,Uncategorized,,260.0,260.0,25.0,150 ml,1.57,./personalcarebeauty_files/JAN140002044xx23JAN22_5_P.jpg,False
Cetaphil Hydrating Foaming Cream Cleanser : 236 ml,Uncategorized,,890.0,890.0,267.0,236 ml,2.64,./personalcarebeauty_files/MAR140005502xx5MAR24_5_P.jpg,False
Cetaphil Brightness Reveal Creamy Cleanser : 100 gms,Uncategorized,,700.0,700.0,175.0,100 g,5.25,./personalcarebeauty_files/FEB140004523xx6FEB23_5_P.jpg,False
Glow & Lovely Facewash Instant Glow : 100 gms,Uncategorized,,160.0,160.0,40.0,100 g,1.2,./personalcarebeauty_files/JUN140002916xx24JUN24_5_P.jpg,False
Neutrogena Oil-Free Acne Wash : 175 ml,Uncategorized,,795.0,795.0,159.0,175 ml,3.63,./personalcarebeauty_files/APR140004136xx26APR22_5_P.jpg,False
Everyuth Natural Tulsi & Turmeric Face Wash : 150 gms,Uncategorized,,205.0,205.0,90.0,150 g,0.77,./personalcarebeauty_files/LFACEWASH150gmEver10xx070621_5_P.jpg,False
Lotus Herbals Apriscrub Fresh Apricot Scrub : 100 gms,Uncategorized,,235.0,235.0,94.0,100 g,1.41,./personalcarebeauty_files/LSKINREJU100gmLotu48xx280220_4_P.jpg,False
Lotus Herbals Oatmeal & Yogurt Skin Whitening Scrub : 100 gms,Uncategorized,,310.0,310.0,109.0,100 g,2.01,./personalcarebeauty_files/JUN140000584xx29JUN22_5_P.jpg,False
mCaffeine Coffee Face Wash : 75 ml,Uncategorized,,229.0,229.0,115.0,75 ml,1.52,./personalcarebeauty_files/MAY140004850xx3MAY23_5_P.jpg,False
Pilgrim Vitamin C Gel Face Wash : 100 ml,Uncategorized,,250.0,250.0,125.0,100 ml,1.25,./personalcarebeauty_files/APR140005457xx15APR24_5_P.jpg,False
WOW Skin Science Vit C Foaming Face Wash With Brush : 150 ml,Cleaning Tools,brush,399.0,399.0,200.0,150 ml,1.33,./personalcarebeauty_files/JUL140004455xx23JUL24_5_P.jpg,False
Mamaearth Vitamin C Face Wash For Skin Illumination : 100 ml,Uncategorized,,269.0,269.0,33.0,100 ml,2.36,./personalcarebeauty_files/JUN140003497xx29JUN22_5_P.jpg,False
The Derma Co 1% Salicylic Acid Gel Face Wash For Active Acne : 100 ml,Uncategorized,,299.0,299.0,36.0,100 ml,2.63,./personalcarebeauty_files/JUN140005039xx20JUN23_5_P.jpg,False
Simple Refreshing Facial Wash : 150 ml,Uncategorized,,399.0,399.0,52.0,150 ml,2.31,./personalcarebeauty_files/FEB140004551xx22FEB23_5_P.jpg,False
Dot & Key Ceramides & Hyaluronic Skin Barrier Repair Face Cream : 100 gms,Uncategorized,,395.0,395.0,119.0,100 g,2.76,./personalcarebeauty_files/OCT140005251xx12OCT23_5_P.jpg,False
Plum Salicylic Acid Face Wash : 110 ml,Uncategorized,,325.0,325.0,39.0,110 ml,2.6,./personalcarebeauty_files/JUL140005119xx28JUL23_5_P.jpg,False
Plum Saffron & Papaya Glow Bright Face Wash : 100 ml,Uncategorized,,249.0,249.0,20.0,100 ml,2.29,./personalcarebeauty_files/JUL140005120xx28JUL23_5_P.jpg,False
Nykaa Sandalwood & Orange Peel De-tanning Face Wash : 100 ml,Footwear,sandal,159.0,159.0,40.0,100 ml,1.19,./personalcarebeauty_files/AUG140004251xx13AUG22_5_P.jpg,False
VLCC Insta Glow Gold Bleach Cream : 60 gms,Uncategorized,,140.0,140.0,70.0,60 g,1.17,./personalcarebeauty_files/MAR140002762xx14MAR23_5_P.jpg,False
Dot & Key Watermelon Superglow Gel Face Wash : 100 ml,Uncategorized,,249.0,249.0,75.0,100 ml,1.74,./personalcarebeauty_files/OCT140005243xx12OCT23_5_P.jpg,False
Lotus Whiteglow 3 In 1 Deep Cleansing Whitening Facial Foam : 100 gms,Uncategorized,,285.0,285.0,100.0,100 g,1.85,./personalcarebeauty_files/NOV140003463xx8NOV21_5_P.jpg,False
Lotus Herbals Teatreewash Tea & Cinnamon Face Wash : 120 gms,Uncategorized,,235.0,235.0,78.0,120 g,1.31,./personalcarebeauty_files/JUN140003459xx24JUN22_5_P.jpg,False
The Face Shop Rice Water Bright Foaming Cleanser Combo : 2 Unit,Uncategorized,,370.0,370.0,167.0,,101.5,./personalcarebeauty_files/DEC140005369xx27DEC23_5_P.jpg,False
Dot & Key Barrier Repair + Hydrating Gentle Face Wash : 100 ml,Uncategorized,,249.0,249.0,75.0,100 ml,1.74,./personalcarebeauty_files/OCT140005250xx12OCT23_5_P.jpg,False
Neutrogena Oil-Free Acne Wash - Pink Grapefruit : 175 ml,Lighting & Electrical,pin,855.0,855.0,171.0,175 ml,3.91,./personalcarebeauty_files/APR140004137xx26APR22_5_P.jpg,False
VLCC Serum Face Wash Vitamin C Serum & Mulberry : 100 ml,Uncategorized,,165.0,165.0,83.0,100 ml,0.82,./personalcarebeauty_files/FEB140005461xx13FEB23_5_P.jpg,False
mCaffeine Green Tea Face Wash Vitamin C : 110 ml,Uncategorized,,299.0,299.0,150.0,110 ml,1.35,./personalcarebeauty_files/MAY140004851xx3MAY23_5_P.jpg,False
Dot & Key Cica Calming Blemish Clearing Face Wash : 100 ml,Uncategorized,,249.0,249.0,50.0,100 ml,1.99,./personalcarebeauty_files/OCT140005240xx12OCT23_5_P.jpg,False
Soulflower Kumkumadi Face Wash : 100 ml,Uncategorized,,350.0,350.0,175.0,100 ml,1.75,./personalcarebeauty_files/MAR140004245xx31MAR23_5_P.jpg,False
Nivea Men Oil Control Facewash : 100 gms,Clothing,men,249.0,249.0,50.0,100 g,1.99,./personalcarebeauty_files/IFaceWash100gNVA1761xx050521_5_P.jpg,False
Lakme Blush & Glow Strawberry Freshness Gel Facewash : 100 gms,Uncategorized,,269.0,269.0,114.0,100 g,1.55,./personalcarebeauty_files/SEP140001126xx10SEP24_5_P.jpg,False
Simple Moisturising Facial Wash : 150 ml,Uncategorized,,385.0,385.0,26.0,150 ml,2.39,./personalcarebeauty_files/FEB140004552xx22FEB23_5_P.jpg,False
Clean & Clear Foaming Facewash : 100 ml,Uncategorized,,180.0,180.0,11.0,100 ml,1.69,./personalcarebeauty_files/MAY140000372xx26MAY22_5_P.jpg,False
Mamaearth Tea Tree Face Wash For Acne & Pimples : 100 ml,Uncategorized,,269.0,269.0,33.0,100 ml,2.36,./personalcarebeauty_files/JUN140003499xx29JUN22_5_P.jpg,False
Nykaa Naturals Saffron & Honey Glowing Face Wash : 100 ml,Uncategorized,,159.0,159.0,56.0,100 ml,1.03,./personalcarebeauty_files/AUG140003657xx6AUG22_5_P.jpg,False
Pilgrim Tea Tree Purifying Gel Face Wash : 100 ml,Uncategorized,,250.0,250.0,125.0,100 ml,1.25,./personalcarebeauty_files/APR140005456xx15APR24_5_P.jpg,False
Himalaya Kesar Face Wash : 150 ml,Uncategorized,,240.0,240.0,18.0,150 ml,1.48,./personalcarebeauty_files/SEP140000388xx21SEP23_5_P.jpg,False
Aqualogica Detan+ Face Wash - Cherry Tomato & Glycolic Acid : 100 ml,Uncategorized,,249.0,249.0,30.0,100 ml,2.19,./personalcarebeauty_files/MAR140005558xx21MAR24_5_P.jpg,False
Nykaa Naturals Tea Tree & Neem Purifying Face Wash : 100 ml,Uncategorized,,159.0,159.0,64.0,100 ml,0.95,./personalcarebeauty_files/SEP140003656xx14SEP22_5_P.jpg,False
Pilgrim 24K Gold Gel Face Wash : 80 ml,Uncategorized,,395.0,395.0,198.0,80 ml,2.46,./personalcarebeauty_files/APR140005460xx15APR24_5_P.jpg,False
Mamaearth Charcoal Face Wash For Oil Control : 100 ml,Uncategorized,,259.0,259.0,100.0,100 ml,1.59,./personalcarebeauty_files/JUN140003498xx29JUN22_5_P.jpg,False
WOW Skin Science Activated Charcoal Face Wash Tube : 100 ml,Uncategorized,,259.0,259.0,130.0,100 ml,1.29,./personalcarebeauty_files/JAN140004454xx30JAN23_5_P.jpg,False
VLCC Serum Face Wash Salicylic Acid Serum & Neem : 100 ml,Uncategorized,,165.0,165.0,83.0,100 ml,0.82,./personalcarebeauty_files/FEB140005462xx13FEB23_5_P.jpg,False
Lotus Herbals Neemwash Neem & Clove Face Wash : 120 gms,Uncategorized,,235.0,235.0,106.0,120 g,1.07,./personalcarebeauty_files/JUN140003456xx29JUN22_5_P.jpg,False
L'Oreal Paris Glycolic Bright Daily Foaming Face Cleanser : 100 ml,Uncategorized,,329.0,329.0,83.0,100 ml,2.46,./personalcarebeauty_files/JAN140004442xx5JAN23_5_P.jpg,False
Aqualogica Glow+ Smoothie Face Wash - Papaya & Vitamin C : 100 ml,Uncategorized,,249.0,249.0,30.0,100 ml,2.19,./personalcarebeauty_files/MAR140005554xx21MAR24_5_P.jpg,False
Clean & Clear Morning Energy Lemon Face Wash : 150 ml,Uncategorized,,260.0,260.0,25.0,150 ml,1.57,./personalcarebeauty_files/JAN140002045xx12JAN22_5_P.jpg,False
mCaffeine Coffee Foaming Face Wash : 75 ml,Uncategorized,,229.0,229.0,115.0,75 ml,1.52,./personalcarebeauty_files/MAY140004852xx3MAY23_5_P.jpg,False
Plum Turmeric & White Clay Acne Action Face Wash : 100 ml,Uncategorized,,249.0,249.0,20.0,100 ml,2.29,./personalcarebeauty_files/JUL140005121xx28JUL23_5_P.jpg,False
Himalaya Orange Face Wash : 100 ml,Uncategorized,,149.0,149.0,11.0,100 ml,1.38,./personalcarebeauty_files/MAY140002049xx12MAY23_5_P.jpg,False
VLCC Insta Glow Diamond Bleach : 60 gms,Uncategorized,,160.0,160.0,70.0,60 g,1.5,./personalcarebeauty_files/NOV140005309xx13NOV23_5_P.jpg,False
Himalaya Oil Clear Lemon Face Wash : 150 ml,Uncategorized,,240.0,240.0,50.0,150 ml,1.27,./personalcarebeauty_files/IFaceWash150mlHML1177XX290216_1_P.jpg,False
Lotus Herbals Jojobawash Face Wash : 120 gms,Uncategorized,,235.0,235.0,67.0,120 g,1.4,./personalcarebeauty_files/JUN140003457xx29JUN22_5_P.jpg,False
Dr. Rashel Vitamin C Face Wash : 100 ml,Uncategorized,,199.0,199.0,100.0,100 ml,0.99,./personalcarebeauty_files/SEP140005921xx18SEP24_5_P.jpg,False
Neutrogena Deep Clean Gentle Foaming Cleanser : 100 g,Uncategorized,,345.0,345.0,69.0,100 g,2.76,./personalcarebeauty_files/JUL140005747xx4JUL24_5_P.jpg,False
Aqualogica Radiance+ Face Wash - Watermelon & Niacinamide : 100 ml,Uncategorized,,249.0,249.0,30.0,100 ml,2.19,./personalcarebeauty_files/MAR140005555xx21MAR24_5_P.jpg,False
Greenleaf Aloe Face Wash Gel With Turmeric & Tea Tree Oil : 50 gm,Uncategorized,,65.0,65.0,30.0,50 g,0.7,./personalcarebeauty_files/APR140005594xx16APR24_5_P.jpg,False
Pond's Pure Detox Facewash : 50 gms,Uncategorized,,115.0,115.0,7.0,50 g,2.16,./personalcarebeauty_files/JAN140000400xx11JAN22_5_P.jpg,False
Aqualogica Hydrate+ Face Wash - Coconut Water & Hyaluronic Acid : 100 ml,Uncategorized,,249.0,249.0,30.0,100 ml,2.19,./personalcarebeauty_files/MAR140005561xx21MAR24_5_P.jpg,False
The Face Shop Rice Water Bright Light Cleansing Oil : 55 ml,Lighting & Electrical,light,549.0,549.0,300.0,55 ml,4.53,./personalcarebeauty_files/JUL140005764xx10JUL24_5_P.jpg,False
Nature's Essence Lacto Bleach : 48 gm,Uncategorized,,100.0,100.0,40.0,48 g,1.25,./personalcarebeauty_files/FEB140004498xx2FEB23_5_P.jpg,False
Wow Anti-Acne Face Wash : 100 ml,Uncategorized,,249.0,249.0,88.0,100 ml,1.61,./personalcarebeauty_files/MAY140005653xx23MAY24_5_P.jpg,False
Clensta Acne Control Face Wash Multani Mitti With 1% Salicylic Acid : 100 ml,Uncategorized,,249.0,249.0,129.0,100 g,1.2,./personalcarebeauty_files/MAY140005646xx13MAY24_5_P.jpg,False
Clensta Red Aloe Vera Skin Glow Face Wash : 100 ml,Uncategorized,,249.0,249.0,125.0,100 ml,1.24,./personalcarebeauty_files/MAY140005642xx13MAY24_5_P.jpg,False
Soulflower Vitamin C Green Tea Foaming Face Wash : 100 ml,Uncategorized,,350.0,350.0,105.0,100 ml,2.45,./personalcarebeauty_files/DEC140004242xx4DEC23_5_P.jpg,False
Neutrogena Hydro Boost Water Gel Cleanser : 145 ml,Uncategorized,,1050.0,1050.0,240.0,145 ml,5.59,./personalcarebeauty_files/JUL140005749xx4JUL24_5_P.jpg,False
Pears Pure & Gentle Facewash : 60 gms,Uncategorized,,160.0,160.0,10.0,60 g,2.5,./personalcarebeauty_files/KFACEWASH60gmDmar2xx140521_5_P.jpg,False
Green Leaf Aloe Face Wash Gel : 120 gms,Uncategorized,,130.0,130.0,50.0,120 g,0.67,./personalcarebeauty_files/JUN140001381xx18JUN24_5_P.jpg,False
Clean & Clear Foaming Face Wash : 50 ml,Uncategorized,,95.0,95.0,6.0,50 ml,1.78,./personalcarebeauty_files/JAN140002041xx29JAN23_5_P.jpg,False
The Face Shop Foaming Cleanser Lemon & Grapefruit : 100 ml,Uncategorized,,365.0,365.0,215.0,100 ml,1.5,./personalcarebeauty_files/JUL140005767xx10JUL24_5_P.jpg,False
Clensta Red Aloe Vera Oil Control Face Wash : 100 ml,Uncategorized,,249.0,249.0,139.0,100 ml,1.1,./personalcarebeauty_files/MAY140005641xx13MAY24_5_P.jpg,False
Neutrogena Deep Clean Gentle Foaming Cleanser : 50 g,Uncategorized,,185.0,185.0,37.0,50 g,2.96,./personalcarebeauty_files/JUL140005748xx4JUL24_5_P.jpg,False
Cetaphil Moisturising Lotion : 500ml,Uncategorized,,1599.0,1599.0,400.0,500 ml,2.4,./personalcarebeauty_files/MAR210000689xx5MAR24_5_P.jpg,False
Pond's Super Light Gel Oil Fresh Moisturiser : 200 ml,Lighting & Electrical,light,499.0,499.0,250.0,200 ml,1.25,./personalcarebeauty_files/FEB140004797xx29FEB24_5_P.jpg,False
Cetaphil Moisturising Cream : 80 gms,Uncategorized,,599.0,599.0,152.0,80 g,5.59,./personalcarebeauty_files/OCT140004356xx14OCT22_5_P.jpg,False
Pond's Light Non-Oily Moisturiser Skin Cream : 200 ml,Lighting & Electrical,light,449.0,449.0,225.0,200 ml,1.12,./personalcarebeauty_files/FEB140004221xx29FEB24_5_P.jpg,False
Lakme Peach Milk Soft Creme : 200 gms,Uncategorized,,499.0,499.0,249.0,200 g,1.25,./personalcarebeauty_files/FEB140002224xx29FEB24_5_P.jpg,False
Vicco Turmeric Skin Cream : 70 gms,Uncategorized,,275.0,275.0,20.0,70 g,3.64,./personalcarebeauty_files/DEC140000622xx14DEC21_5_P.jpg,False
Pond's Super Light Skin Gel : 98 gms,Lighting & Electrical,light,259.0,259.0,70.0,98 g,1.93,./personalcarebeauty_files/FEB140004220xx29FEB24_5_P.jpg,False
Pond's Cold Cream : 55 ml,Uncategorized,,114.0,114.0,9.0,55 ml,1.91,./personalcarebeauty_files/LSKINPROT55mlPond12xx140521_5_P.jpg,False
Nivea Soft Berry Blossom Moisturiser Creme : 200 ml,Uncategorized,,449.0,449.0,134.0,200 ml,1.57,./personalcarebeauty_files/APR140001333xx24APR24_5_P.jpg,False
Pilgrim Squalane Glow Moisturizer : 50 gm,Uncategorized,,550.0,550.0,275.0,50 g,5.5,./personalcarebeauty_files/APR140005453xx15APR24_5_P.jpg,False
Lakme Peach Milk Moisturiser : 120 ml,Uncategorized,,274.0,274.0,49.0,120 ml,1.88,./personalcarebeauty_files/KSKINPROTECT120mlLKM23xx140521_5_P.jpg,False
Cetaphil Brightening Night Comfort Cream : 50 gms,Uncategorized,,1199.0,1199.0,300.0,50 g,17.98,./personalcarebeauty_files/FEB140004522xx6FEB23_5_P.jpg,False
Cetaphil Brightening Day Protection Cream SPF 15 : 50 gms,Uncategorized,,1199.0,1199.0,300.0,50 g,17.98,./personalcarebeauty_files/FEB140004521xx6FEB23_5_P.jpg,False
Emami Fair And Handsome Cream For Men : 60 gms,Clothing,men,175.0,175.0,20.0,60 g,2.58,./personalcarebeauty_files/JUN140001256xx21JUN24_5_P.jpg,False
Neutrogena Ultra Sheer Dry Touch Sunblock SPF 50+ : 80 gms,Uncategorized,,780.0,780.0,203.0,80 g,7.21,./personalcarebeauty_files/APR140004133xx26APR22_5_P.jpg,False
Pond's White Beauty BB Fairness Cream 01 Original : 18 gms,Personal Care & Beauty,beauty,165.0,165.0,11.0,18 g,8.56,./personalcarebeauty_files/FEB140000612xx29FEB24_5_P.jpg,False
Glow & Lovely Ayurvedic Care Cream : 50 gms,Uncategorized,,160.0,160.0,35.0,50 g,2.5,./personalcarebeauty_files/AUG140003247xx26AUG24_5_P.jpg,False
The Face Shop Rice Ceramide Moisturizing Cream : 50 Ml,Uncategorized,,1040.0,1040.0,468.0,50 ml,11.44,./personalcarebeauty_files/DEC140005373xx27DEC23_5_P.jpg,False
Nivea Soft Peach Moisturizing Skin Cream : 200 ml,Uncategorized,,449.0,449.0,200.0,200 ml,1.25,./personalcarebeauty_files/NOV140004305xx30NOV22_5_P.jpg,False
Garnier Bright Complete Serum Cream : 45 gms,Uncategorized,,189.0,189.0,3.0,45 g,4.13,./personalcarebeauty_files/JAN140001994xx19JAN23_5_P.jpg,False
Mamaearth Ubtan Nourishing Cold Cream : 200 gms,Uncategorized,,349.0,349.0,175.0,200 g,0.87,./personalcarebeauty_files/NOV140003650xx8NOV21_5_P.jpg,False
Lotus Herbals Youthrx Anti Ageing Transforming Creme : 50 gms,Uncategorized,,755.0,755.0,265.0,50 g,9.8,./personalcarebeauty_files/JUN140003440xx24JUN22_5_P.jpg,False
The Face Shop Rice Ceramide Moisturizing Emulsion : 150 Ml,Uncategorized,,990.0,990.0,495.0,150 ml,3.3,./personalcarebeauty_files/DEC140005372xx27DEC23_5_P.jpg,False
Dot & Key Vitamin C + E Super Bright Moisturizer : 60 ml,Uncategorized,,495.0,495.0,174.0,60 ml,5.35,./personalcarebeauty_files/OCT140005238xx12OCT23_5_P.jpg,False
Cetaphil Optimal Hydration Daily Cream : 50 gm,Uncategorized,,1250.0,1250.0,313.0,50 g,18.74,./personalcarebeauty_files/MAR140005499xx5MAR24_5_P.jpg,False
Lakme 9to5 Vitamin C+ Day Cream : 50 gms,Uncategorized,,409.0,409.0,144.0,50 g,5.3,./personalcarebeauty_files/APR140004206xx18APR24_5_P.jpg,False
Nivea Soft Berry Blossom Moisturising Cream : 100 ml,Uncategorized,,245.0,245.0,56.0,100 ml,1.89,./personalcarebeauty_files/APR140004776xx19APR23_5_P.jpg,False
Lotus Herbals SPF 70 Daily Multi-Function Sunblock Cream : 60 gms,Uncategorized,,695.0,695.0,278.0,60 g,6.95,./personalcarebeauty_files/JUN140000582xx24JUN22_5_P.jpg,False
Lotus Herbals Sunscreen Cream SPF 30 UVB : 100 gms,Uncategorized,,435.0,435.0,174.0,100 g,2.61,./personalcarebeauty_files/APR140000581xx19APR22_5_P.jpg,False
Lacto Calamine Oil Balance Lotion For Oily Skin : 120 ml,Uncategorized,,260.0,260.0,52.0,120 ml,1.73,./personalcarebeauty_files/FEB140001055xx1FEB22_3_P.jpg,False
Lotus Herbals Whiteglow Night Cream : 60 gms,Uncategorized,,480.0,480.0,168.0,60 g,5.2,./personalcarebeauty_files/DEC140001553xx11DEC21_5_P.jpg,False
Glow & Lovely Winter Glow Face Cream : 50 gms,Uncategorized,,150.0,150.0,20.0,50 g,2.6,./personalcarebeauty_files/FEB140002917xx29FEB24_5_P.jpg,False
Plum Rice Water & Niacinamide 2% Clear Moisture Gel Cream : 50 gms,Uncategorized,,525.0,525.0,63.0,50 g,9.24,./personalcarebeauty_files/NOV140005303xx10NOV23_5_P.jpg,False
L'Oreal Paris Revitalift Cream For Women : 50 ml,Clothing,men,999.0,999.0,200.0,50 ml,15.98,./personalcarebeauty_files/FEB140003759xx03FEB22_5_P.jpg,False
Plum Saffron & Kumkumadi Oil Glow Bright Moisturizer : 50 gms,Uncategorized,,399.0,399.0,40.0,50 g,7.18,./personalcarebeauty_files/JUL140005123xx28JUL23_5_P.jpg,False
Dot & Key 72HR Hydrating Gel + Probiotics : 60 ml,Uncategorized,,495.0,495.0,149.0,60 ml,5.77,./personalcarebeauty_files/OCT140005237xx12OCT23_5_P.jpg,False
Lotus Herbals Youthrx Anti-Ageing Nourishing Night Creme : 50 gms,Uncategorized,,790.0,790.0,277.0,50 g,10.26,./personalcarebeauty_files/JUN140003442xx24JUN22_5_P.jpg,False
Simple Hydrating Light Moisturiser : 125 ml,Lighting & Electrical,light,465.0,465.0,66.0,125 ml,3.19,./personalcarebeauty_files/FEB140004550xx22FEB23_5_P.jpg,False
Dr. Rashel Vitamin C Brightening & Anti Aging Day Cream : 50 g,Uncategorized,,299.0,299.0,150.0,50 g,2.98,./personalcarebeauty_files/SEP140005924xx18SEP24_5_P.jpg,False
Dot & Key Night Reset Retinol + Ceramide Cream : 60 ml,Uncategorized,,695.0,695.0,209.0,60 ml,8.1,./personalcarebeauty_files/OCT140005255xx12OCT23_5_P.jpg,False
Faces Canada Hydro Face Moisturizer : 100 ml,Uncategorized,,599.0,599.0,210.0,100 ml,3.89,./personalcarebeauty_files/FEB140003876xx20FEB23_5_P.jpg,False
Cetaphil Optimal Hydration Replenishing Night Cream : 50 gm,Uncategorized,,1100.0,1100.0,275.0,50 g,16.5,./personalcarebeauty_files/MAR140005500xx5MAR24_5_P.jpg,False
Lacto Calamine Oil Balance Lotion For Normal Skin : 120 ml,Uncategorized,,260.0,260.0,52.0,120 ml,1.73,./personalcarebeauty_files/KSKINCREAMS12mlLTCM16xx210621_5_P.jpg,False
Himalaya Fairness Cream : 50 gms,Uncategorized,,100.0,100.0,6.0,50 g,1.88,./personalcarebeauty_files/JUN140002729xx25JUN23_5_P.jpg,False
The Face Shop Rice Water Bright Trial Kit : 1 Unit,Uncategorized,,899.0,899.0,450.0,,,./personalcarebeauty_files/DEC140005375xx27DEC23_5_P.jpg,False
Dot & Key Cica + Niacinamide Oil-Free Moisturizer : 60 ml,Uncategorized,,495.0,495.0,149.0,60 ml,5.77,./personalcarebeauty_files/OCT140005253xx12OCT23_5_P.jpg,False
Plum Green Tea Renewed Clarity Night Gel : 50 ml,Uncategorized,,575.0,575.0,69.0,50 ml,10.12,./personalcarebeauty_files/MAY140004169xx31MAY22_5_P.jpg,False
Dot & Key Cica Calming Skin Renewing Night Gel : 60 ml,Uncategorized,,495.0,495.0,150.0,60 ml,5.75,./personalcarebeauty_files/OCT140005239xx12OCT23_5_P.jpg,False
L'Oreal Paris Revitalift Cream For Women : 15 ml,Clothing,men,529.0,529.0,159.0,15 ml,24.67,./personalcarebeauty_files/FEB140003758xx03FEB22_5_P.jpg,False
Lakme 9to5 Vitamin C+ Night Cream : 50 gms,Uncategorized,,399.0,399.0,99.0,50 g,6.0,./personalcarebeauty_files/OCT140004229xx23OCT23_5_P.jpg,False
Lotus Herbals Nutranite Night Creme : 50 gms,Uncategorized,,485.0,485.0,194.0,50 g,5.82,./personalcarebeauty_files/NOV140003474xx8NOV21_5_P.jpg,False
Plum Green Tea Mattifying Moisturizer : 50 ml,Uncategorized,,470.0,470.0,66.0,50 ml,8.08,./personalcarebeauty_files/MAR140005509xx15MAR24_5_P.jpg,False
Pond's Light Moisturiser Cream : 50 ml,Lighting & Electrical,light,120.0,120.0,10.0,50 g,2.2,./personalcarebeauty_files/DEC140004368xx13DEC22_5_P.jpg,False
Clensta Red Aloe Vera Skin Glow Face Moisturizer : 80 gm,Uncategorized,,299.0,299.0,150.0,80 g,1.86,./personalcarebeauty_files/MAY140005643xx13MAY24_5_P.jpg,False
Lotus Papaya Saffron : 50 gms,Uncategorized,,485.0,485.0,161.0,50 g,6.48,./personalcarebeauty_files/NOV140003003xx8NOV21_5_P.jpg,False
Neutrogena Hydro Boost Hyaluronic Acid Serum : 30 ml,Uncategorized,,1250.0,1250.0,250.0,30 ml,33.33,./personalcarebeauty_files/JUL140005750xx4JUL24_5_P.jpg,False
Emami Fair And Handsome Radiance Cream For Men  : 30 gms,Clothing,men,90.0,90.0,7.0,30 g,2.77,./personalcarebeauty_files/AUG140002504xx2AUG22_3_P.jpg,False
Lakme Youth Infinity Skin Firming Night Cream : 50 gms,Uncategorized,,1049.0,1049.0,183.0,50 g,17.32,./personalcarebeauty_files/LSKINPROT50gmLakm62xx140521_5_P.jpg,False
Plum 1% Oat & Allantoin Nourishing Cream : 50 gms,Uncategorized,,399.0,399.0,32.0,50 g,7.34,./personalcarebeauty_files/NOV140005301xx10NOV23_5_P.jpg,False
Plum Body Lovin Coffee Wake-a-ccino Foot Cream : 75 gms,Uncategorized,,345.0,345.0,28.0,75 g,4.23,./personalcarebeauty_files/NOV140005305xx10NOV23_5_P.jpg,False
VLCC Matte Look Sun Screen Cream - SPF 30  : 100 gms,Uncategorized,,345.0,345.0,141.0,100 g,2.04,./personalcarebeauty_files/MAR140002763xx14MAR23_5_P.jpg,False
Vlcc Skin Nourishing Ssl Spf40 : 100G,Uncategorized,,465.0,465.0,201.0,100 g,2.64,./personalcarebeauty_files/MAR140003109xx19MAR23_5_P.jpg,False
Plum Vitamin C Face Serum With Mandarin : 20 ml,Uncategorized,,550.0,550.0,94.0,20 ml,22.8,./personalcarebeauty_files/AUG140004175xx8AUG24_5_P.jpg,False
Pilgrim Brightening Serum With Blueberry : 30 ml,Uncategorized,,695.0,695.0,348.0,30 ml,11.57,./personalcarebeauty_files/APR140005458xx15APR24_5_P.jpg,False
Pilgrim 24K Gold Serum : 20 ml,Uncategorized,,695.0,695.0,348.0,20 ml,17.35,./personalcarebeauty_files/APR140005459xx15APR24_5_P.jpg,False
The Derma Co 2% Kojic Acid Face Serum : 30 ml,Uncategorized,,499.0,499.0,60.0,30 ml,14.63,./personalcarebeauty_files/JUL140005042xx7JUL23_5_P.jpg,False
Plum Rice Water & 10% Niacinamide Serum : 30 ml,Uncategorized,,649.0,649.0,72.0,30 ml,19.23,./personalcarebeauty_files/AUG140005508xx8AUG24_5_P.jpg,False
Plum Rice Water & Niacinamide 3% Toner : 150 ml,Uncategorized,,420.0,420.0,34.0,150 ml,2.57,./personalcarebeauty_files/FEB140005495xx27FEB24_5_P.jpg,False
Cetaphil Brightness Refresh Toner : 150 ml,Uncategorized,,1035.0,1035.0,311.0,150 ml,4.83,./personalcarebeauty_files/FEB140004524xx6FEB23_5_P.jpg,False
Lakme 9to5 Vitamin C+ Facial Serum : 30 ml,Uncategorized,,599.0,599.0,36.0,30 ml,18.77,./personalcarebeauty_files/JUN140004209xx24JUN22_5_P.jpg,False
The Face Shop Rice Ceramide Moisturizing Toner : 150 Ml,Uncategorized,,899.0,899.0,450.0,150 ml,2.99,./personalcarebeauty_files/DEC140005371xx27DEC23_5_P.jpg,False
The Derma Co 2% Salicylic Acid Face Serum For Active Acne : 30 ml,Uncategorized,,499.0,499.0,60.0,30 ml,14.63,./personalcarebeauty_files/JUN140005038xx20JUN23_5_P.jpg,False
The Derma Co 10% Niacinamide Face Serum For Acne Marks : 30 ml,Uncategorized,,599.0,599.0,72.0,30 ml,17.57,./personalcarebeauty_files/JUN140005037xx20JUN23_5_P.jpg,False
The Derma Co 10% Vitamin C Face Serum For Skin Radiance : 30 ml,Uncategorized,,649.0,649.0,78.0,30 ml,19.03,./personalcarebeauty_files/JUN140005040xx20JUN23_5_P.jpg,False
WOW Skin Science Vit C Face Serum : 30 ml,Uncategorized,,699.0,699.0,350.0,30 ml,11.63,./personalcarebeauty_files/JUN140004458xx3JUN24_5_P.jpg,False
Dr. Rashel Vitamin C Brightening & Anti Aging Face Serum : 30 ml,Uncategorized,,399.0,399.0,200.0,30 ml,6.63,./personalcarebeauty_files/SEP140005920xx18SEP24_5_P.jpg,False
Plum Bulgarian Valley Rose Water Toner : 100 ml,Uncategorized,,225.0,225.0,18.0,100 ml,2.07,./personalcarebeauty_files/MAY140004174xx31MAY22_5_P.jpg,False
Soulflower Kumkumadi Night Beauty Elixir : 12 ml,Personal Care & Beauty,beauty,1000.0,1000.0,500.0,12 ml,41.67,./personalcarebeauty_files/AUG140004244xx04AUG22_5_P.jpg,False
